{"run":94,"commit":"2f0ee0f","metric":0.359446,"metrics":{"mean_device_f1_p10":0.344277,"transfer_mean_f1":0.151921,"median_kettle_f1":0.55514,"median_microwave_f1":0.267281,"median_fridge_f1":0.370963,"median_washing_machine_f1":0.246657,"median_dishwasher_f1":0.384353,"b1_events_mined":5260,"b1_enroll_top1_enc":0.84,"b1_enroll_top1_raw":0.65,"b1_cross_house_top1":0.21,"b1_gate_kettle_kept_frac":0.813,"b1_gate_mw_kept_frac":0.853,"b2_probe_mw_iso_mean":0.34,"b2_probe_iso_all_mean":0.61,"device_balanced_mean":0.365435,"house_1_v4_mean":0.540104,"v4_n_pairs":66,"v4_n_houses":20,"fridge_median_delta":0,"primary_delta":0.004823},"status":"discard","description":"RUN 94 = run 91 (dw span/extension) + one consistency fix: the washing-machine profile's emission\nextensions were the MEAN of the per-mark-window run offsets (np.mean(oss/oes), model.py L728-729)\nwhile the dishwasher profile uses the MEDIAN with a non-negative clamp (np.median(pres/posts) L502-503,\nrun 67/91). One anomalous mark window therefore moves the wm's mean by up to a fifth of its span and\nshifts every emitted episode; the wm's three 'right count, zero matches' pairs (refit/house_18 43/37\nF1=0.03, refit/house_6 27/22 F1=0.04, refit/house_11 33/15 F1=0.00) are exactly that signature.\n\nPOOL (frozen v4, 66 pairs, 20 houses, median of seeds 2026/1/2/3/4): primary 0.359446, p10 0.344277,\ndevice_balanced 0.365435, house_1_v4_mean 0.540104. Floor 2f0ee0f=0.354623; run 91 alone=0.358165.\nSo the wm fix is +0.0013 over run 91 and +0.0048 over the floor: real but below the +0.01 keep bar,\nhence discard. Device medians: kettle 0.555140 (=floor), mw 0.267281 (=floor), fridge 0.370963 (=floor),\nwm 0.246657 (floor 0.242345, +0.0043), dw 0.384353 (=run 91, gain intact). No median regressed and p10\nrose, so the change is harmless; it cannot be kept alone.\n\nWHY THE WM FIX IS ONLY +0.0013: the offsets were already consistent in 13 of 14 screened wm houses;\nthe entire gain comes from refit/house_10's wm (0.163 -> 0.25, n 133 -> 136/77) - the same house whose\ndw was wrecked by a 606-642s offset error in run 67. The mean-vs-median asymmetry was the last\ninconsistent convention of its kind in the file.\n\nRUN 94 ALSO CLOSES THE FRIDGE'S ADMISSION-SIDE SPACE (four refutations, screens in .scratch/s94*.txt):\n(1) duration ceiling relaxed to REL_DUR[1]*max(pop_p50, 0.5*pop_max) - counts barely moved (house_18\n2207->2223, house_8 1182->1281) and the two houses that moved lost recall (eco_02 0.79->0.70, ukdale_1\n0.48->0.47), fridge deltas -0.09 on 7 houses;\n(2) event-path amp band high side lifted to the mined class ceiling - BIT-IDENTICAL output on all 7\nhouses, because the run-basis window already IS [0.8*mark, class_hi]: the two paths already share the\nsame amp window, so the dominant event path was never the binding constraint;\n(3) isolation level lifted from 3*mark to max(3*mark, 3*class_hi) - run-basis candidates doubled\n(107->305, 1164->1937, 1417->1410) but every fridge F1 was unchanged to 2dp: the added candidates\noverlap spans already lit, so the fridge's ~1900 missing GT cycles (house_8 R=0.30 at P=0.68) lie\noutside what the extractor/run detector can see at all;\n(4) the earlier REL_AMP 0.15/0.30 both-ways result stands.\n\nERROR-MODE DECOMPOSITION (seed 2026, per-pair P/R): the three device families fail oppositely. wm (15\npairs, mean 0.242) is OVER-emission in 7/15 pairs at 1.4-2.3x GT count with P always < R (lookalike\nadmission through hs_band's 0.75*min(hss) floor, which one low-heat mark window (hs 0.13) drags to\n0.10) plus 3 placement pairs; fridge (18 pairs, mean 0.339) is UNDER-emission in 8/18 at 0.44-0.73x\ncount WITH high precision (P 0.58-0.86), i.e. extractor-bound; dw is healthy (3 under, 0 over).\n\nBanked, not committed: run 91 (.auto/runs/91_single_block_span_condition.diff) and this run's state\n(.auto/runs/94_wm_median_ext.diff). They must travel together in the next bundle: the loop needs a\nco-gain of ~+0.005 before either can clear +0.01.","title":"wm median emission extension + run 91 dw bundle: pool 0.359446 (+0.0048)","summary":"wm mean->median extension lands +0.0013 (wm median 0.2423->0.2467, p10 up); with run 91's dw gain the bundle is +0.0048 - real but under the +0.01 keep bar.","timestamp":1790506419944,"segment":2,"confidence":2.6996102983453643,"asi":{"hypothesis":"The wm profile's emission extensions used the mean of per-mark offsets while the dw uses the median with a non-negative clamp; switching to the dw convention removes a placement collapse caused by one anomalous mark window.","evidence":"pool primary 0.359446 vs floor 0.354623 vs run 91 0.358165; p10 0.344277 (up from 0.343651); wm median 0.246657 vs floor 0.242345; no device median regressed. Gain concentrated in refit/house_10 wm 0.163 -> 0.25.","fridge_refutations":"duration ceiling -0.09 on 7 houses; event-path high-side amp lift bit-identical (run-basis already covers [0.8*mark, class_hi]); isolation lift max(3*mark, 3*class_hi) doubled run-basis candidates (107->305, 1164->1937) with zero F1 change, so missing fridge cycles are extractor-bound.","rollback_reason":"Primary +0.0048 over the kept floor, below the +0.01 keep threshold; also device_balanced_mean slipped 0.365867 -> 0.365435.","next_action_hint":"Single-house gate/band space is now measured closed on all four families (onset, admission width both ways, span ceilings, fridge band/isolation/duration). Stop margin surgery: the next lever must add information (B3 self-training over the unlabeled year, B1 cross-house encoder, B4 wm/dw phase grammar) and must bundle .auto/runs/91_single_block_span_condition.diff + .auto/runs/94_wm_median_ext.diff, which together bank +0.0048."}}
{"run":95,"commit":"2f0ee0f","metric":0.358233,"metrics":{"mean_device_f1_p10":0.341569,"transfer_mean_f1":0.151921,"median_kettle_f1":0.553975,"median_microwave_f1":0.263539,"median_fridge_f1":0.370963,"median_washing_machine_f1":0.246657,"median_dishwasher_f1":0.384353,"b1_events_mined":5260,"b1_enroll_top1_enc":0.84,"b1_enroll_top1_raw":0.65,"b1_cross_house_top1":0.21,"b1_gate_kettle_kept_frac":0.813,"b1_gate_mw_kept_frac":0.853,"b2_probe_mw_iso_mean":0.34,"b2_probe_iso_all_mean":0.61,"device_balanced_mean":0.359969,"house_1_v4_mean":0.540104,"v4_n_pairs":66,"v4_n_houses":20,"fridge_median_delta":0,"primary_delta":0.00361},"status":"discard","description":"WHAT: replaced the fragmentation switch's onset cliffs\n(`eb.dur_p50 <= 0.5*core_dur or eb.amp_p50 < 0.7*core_amp`) with the burst gate's own\nadmission test -- fire iff the mined population's median event falls outside the mark's\nREL_AMP amp band or REL_DUR duration band. Removes two magic literals and states the\nswitch's documented purpose exactly (a mark whose own core-stats gate cannot admit the\ndevice's own mined events).\n\nMECHANISM SCREEN (6 houses x seed 2026: refit/house_6,18,8,12 ukdale/house_1 refit/house_17):\nfiring count 2 -> 2 (identical lines: refit/house_12 kettle, refit/house_6 mw) and every\nMETRIC bit-identical (mean 0.366733 both). On seed 2026 the change is a no-op.\n\nDIAGNOSIS SURFACED: refit/house_12's kettle mark reads 115W/2184s while its OWN calibration\nwindow's mined event population p50 is 1110W/864s -- 10x amp, 2.5x duration. The press was a\nprogram appliance, so the ev_band path emits 1.1kW/14min wm-like heater runs as kettle\n(2223 preds vs 635 GT, P 0.03). Abstaining on that pair scores the same F1 (0.04), so no\nlabel-free per-house rule recovers it -- only cross-house evidence (B1) can.\n\nPOOL (95s, checks pass): median seed 3 = 0.358233; seed 2026 = 0.359446 BIT-IDENTICAL to run\n94; seeds 1/2/4 = 0.333426/0.360499/0.353784. p10 0.341569, device_balanced 0.359969,\nhouse_1 0.540104. Medians: kettle 0.553975 (-0.0012 vs run 94), microwave 0.263539\n(-0.0037), fridge 0.370963 (=), wm 0.246657 (=), dw 0.384353 (=).\nRun log firing count 16 -> 11 builds, i.e. the new test is NOT a superset: it stops the\nswitch on populations whose median event the mark gate already admits (dur_p50 in\n(1/3, 1/2] x core), and widening/keeping the wrong side costs the burst medians.\n\nVERDICT: the switch's arbitrary cliffs beat the gate-consistent test on the pool, so the\nfragmentation-switch family is closed in both directions; reverted. Banked bundle (runs\n91+94) is unchanged and still the incumbent at 0.359446 median / 0.359446 seed 2026.","title":"Fragmentation switch: gate-consistent firing test (inert on seed 2026)","summary":"Cliffs replaced by the mark gate's own bands; seed 2026 identical, median 0.358233 (-0.0012), mw median -0.0037 -> discard","timestamp":1790506958703,"segment":2,"confidence":2.702977580196371,"asi":{"hypothesis":"the switch's onset cliffs (0.5x core duration, 0.7x core amp) sit inside the gate's own REL_DUR/REL_AMP bands, so a population the mark gate provably rejects keeps the rejecting gate; the gate's own band as the firing test should recover mw recall","result":"not inert on other seeds: median 0.359446 -> 0.358233 while seed 2026 stayed bit-identical; mw median -0.0037, kettle -0.0012; log firing count 16 -> 11 builds","rollback_reason":"pool median fell 0.0012 below the run-94 state and 0.0064 below the +0.01 keep bar; the new test stops the switch where the mark gate already admits the population median, and keeps it (widening) where the population is longer than 3x core","next_action_hint":"burst admission width is at a local optimum in every direction (REL_AMP, firing condition, admission width) -- stop band surgery. refit/house_12 kettle is a mislabeled mark (10x amp mismatch with its own window population) and is not label-free fixable: it needs cross-house knowledge, so start the portfolio (B1/B3 learnable-across-homes) rather than more per-house gates"}}
{"run":96,"commit":"2f0ee0f","metric":0.359052,"metrics":{"mean_device_f1_p10":0.343538,"device_balanced_mean":0.365192,"house_1_v4_mean":0.540104,"median_kettle_f1":0.551845,"median_microwave_f1":0.267281,"median_fridge_f1":0.370963,"median_washing_machine_f1":0.246657,"median_dishwasher_f1":0.384353,"v4_n_pairs":66,"v4_n_houses":20,"primary_delta":-0.000394,"fridge_median_delta":0,"transfer_mean_f1":0.151921,"b1_events_mined":5260,"b1_enroll_top1_enc":0.84,"b1_enroll_top1_raw":0.65,"b1_cross_house_top1":0.21,"b1_gate_kettle_kept_frac":0.813,"b1_gate_mw_kept_frac":0.853,"b2_probe_mw_iso_mean":0.34,"b2_probe_iso_all_mean":0.61},"status":"discard","description":"B1 m4 (run 96): cross-house physical envelope for burst devices. Hypothesis: a mark that is physically impossible for its device type (kettle/microwave) is a calibration error; repair it from the cross-house event cache and stop the houses own mined population from overruling it, because _burst_event_bands mines the SAME K=5 windows, so a bad window makes both the mark and the population junk and only cross-house evidence can break the tie.\n\nImplementation (src/experiments/04_autoresearch/model.py, 71 new lines): _xhouse_burst_env() loads .auto/cache/b1_events_v1.npz (B1 m1 miner, 5260 events) and builds a per-device envelope = p10/p90 of peak_w and dur_s scaled by (0.4, 2.0); applied after the existing reader-floor re-anchor and before dur_ref; amp test only for flat-draw devices (a duty-cycled microwave peak_w is not comparable to its mark median draw); a repaired device drops ev_band[d]. Integrity: the cache holds only the 29 pretraining houses and the 7 v4 holdout houses are provably absent from it, so the prior is transfer-clean.\n\nOffline scope measured BEFORE writing any gate logic, over all 99 builds of the incumbent dump: exactly 4 outlier builds = ONE house x ~4 seeds, the kettle (99-111 W, 25.7-37.0 min, 10-25x outside the envelope); microwave 0, washing machine 0, dishwasher 0. The familys entire pool reach is therefore 1 of 66 pairs (refit/house_12 kettle).\n\nDesign variant, authoritative full pool, 5 seeds, 97.6 s, checks pass: primary 0.359052 vs incumbent 0.359446 (-0.0004); p10 0.343538 vs 0.344277 (-0.0007); medians kettle 0.551845 (-0.0033), microwave 0.267281, fridge 0.370963, wm 0.246657, dishwasher 0.384353 all unchanged; house_1_v4_mean 0.540104 unchanged; device_balanced 0.365192. Only firing pair refit/house_12 kettle seed 2026: 0.06 (P 0.03 R 0.19, 712/127) -> 0.00 (506/127).\n\nDuration-only probe (_XH_AMP_DEVS = (), seed 2026 full pool): 0.359239, that pair 0.01 (522/127) - also a loss, so the family is closed in both directions (amp repair and duration repair).\n\nDiagnosis: house_12s own reader threshold for kettle is <= 115 W, which is why the existing floor re-anchor never fired there, and its pretraining windows show a ~115 W channel with a ~36 min span. The mark is NOT a calibration error - the anomaly IS the labels evidence - so replacing it with a physically correct 1.9-4.1 kW prior removes the only overlap the pair had. This is the same wall as eco/house_02 vs eco/house_06 (near-identical marks, opposite outcomes): per-house label anomalies are not separable by label-free or cross-house physical rules.\n\nFile: .auto/runs/96_xhouse_burst_env.diff (12331 B, 156 insertions / 14 deletions = incumbent bundle 85/14 + 71). Next: resume the owner-ordered big-bet portfolio at B3; the B1 cross-house knowledge strand is now bounded by measurement - its only firing pair is a label anomaly, so cross-house physical priors cannot raise the pool.","title":"B1 m4 cross-house burst envelope: fires 1/66 pairs, loses there","summary":"Prior repairs the pool's only physical outlier (house_12 kettle 115 W/36 min): pool 0.359446->0.359052, pair 0.06->0.00 - the anomaly is the house's own evidence.","timestamp":1790507565217,"segment":2,"confidence":2.7063532727039847,"asi":{"hypothesis":"A mark physically impossible for its device type is a calibration error that a cross-house prior repairs; the mined population must not overrule the repaired mark because both come from the same bad windows.","rollback_reason":"The pool's only physical outlier (refit/house_12 kettle, 115 W / 36 min) is not a calibration error: its reader threshold is <= 115 W, so the house's own evidence corroborates the low-power long channel. Repairing it with the cross-house prior (2454 W / 138 s) or with the duration alone both lost that pair (0.06 -> 0.00 and 0.01).","next_action_hint":"Close the cross-house physical-prior sub-strand: measured scope is 1 of 66 pairs and it is a label anomaly, so no envelope variant can raise the pool. Resume the owner-ordered portfolio at B3 (self-training has no parametric learner here: B3 needs a learnable component, so scope it against the rule-based model or fold it into B4).","scope_measurement":"All 99 incumbent builds: 4 outlier builds = 1 house x 4 seeds, kettle only; microwave/wm/dw 0 outliers. Envelope family reach = 1 of 66 pairs.","variants":"amp+dur repair: pool 0.359052, pair 0.06->0.00. dur-only repair: pool 0.359239 (seed 2026), pair 0.06->0.01."}}
{"run":97,"commit":"2f0ee0f","metric":0.317427,"metrics":{"mean_device_f1_p10":0.311443,"device_balanced_mean":0.316232,"house_1_v4_mean":0.4472,"median_kettle_f1":0.409369,"median_microwave_f1":0.18647,"median_fridge_f1":0.370963,"median_washing_machine_f1":0.246657,"median_dishwasher_f1":0.384353,"v4_n_pairs":66,"v4_n_houses":20,"primary_delta":-0.042019,"fridge_median_delta":0,"transfer_mean_f1":0.151921,"b1_events_mined":5260,"b1_enroll_top1_enc":0.84,"b1_enroll_top1_raw":0.65,"b1_cross_house_top1":0.21,"b1_gate_kettle_kept_frac":0.813,"b1_gate_mw_kept_frac":0.853,"b2_probe_mw_iso_mean":0.34,"b2_probe_iso_all_mean":0.61},"status":"discard","description":"B3 m1 (self-training over the unlabeled year), reinterpreted for a rule-based model as one self-calibration iteration: the pre-span year is ALREADY mined at zero extra cost (ev_on/ev_off/ev_amp/ev_dur, 10880-15346 level-excursion events over 180 days vs the K=5 marks), so I pseudo-labeled it with a window 3x wider than the admission band (|ev-mark| <= SELF_AMP_WIN=0.6 x mark on amp, REL_DUR on dur, >=20 events) and re-derived the burst admission band from that population.\n\nVariant A (population p10/p90 becomes the band, duration kept at the mark's REL_DUR): full pool, 5 seeds, 110.8 s, checks PASS: primary 0.317427 vs incumbent 0.359446 (-0.0420); p10 0.311443; device_balanced 0.316232; house_1_v4 0.447200 (-0.0929); medians kettle 0.409369 (-0.146), mw 0.186470 (-0.081), fridge 0.370963, wm 0.246657, dw 0.384353 (all three bitwise unchanged).\nVariant B (population p50 as the CENTRE, the mark's REL_AMP as the width - isolating the width as the suspected killer): screen seed 2026 primary 0.311275, kettle 0.398901, mw 0.151593, house_1 0.420255 - worse than A, so the population CENTRE is bad too, not just the width.\n\nMechanism (clean like-for-like A/B, same 3 houses, GT identical in every pair): refit/house_17 kettle 574->1506 emissions over the SAME 590 GT, P 0.83->0.21, R 0.81->0.55; house_17 mw 104->392, P 0.39->0.10; ukdale/house_1 kettle 377->585, P 0.78->0.42, R 0.80->0.67; refit/house_12 mw 36->172, P 0.56->0.14. Widening/re-centring the band inflates emissions 2.6-4.8x, which raises false positives AND fragments downstream cycle assembly (recall falls too).\nThe population statistic is biased LOW, not merely noisy: mark -> population p50 = 1791->1710 W, 2676->2149 W, 1046->770 W, 115->67 W. Cause: any label-free amp window around a device necessarily contains far more sub-device excursions (other appliances) than the device's own events, so both the median and the p10-p90 envelope sit below the true draw. The K=5 marks are read on the submeter during a device-active press, so they are a strictly better amp estimator than any single-house aggregate statistic.\nrefit/house_12 kettle stays 0.06-0.07: its anomalous 115 W/36 min mark is the label's evidence (run 96, m31), so self-cal has nothing to fix there either.\n\nCONCLUSION for B3: self-training on ONE house's aggregate fails at the LABELING step, not the fitting step - the aggregate does not contain a device-pure population, so re-estimation drifts low. Any further B3 m needs a labeling function that is device-pure (cross-house training of a discriminative model, i.e. B1's trainable component, or B2's synthetic supervision), not a statistic of the target house's own aggregate. transfer_mean_f1 is CARRIED from run 96 (0.151921): the v3 track was not re-measured this run.","title":"B3 m1 pre-span self-cal: population amp is biased low, both lose","summary":"Both variants lose: p10-p90 band 0.317427, centre-only 0.311275 vs 0.359446 incumbent; fridge/wm/dw bitwise unchanged","timestamp":1790508175018,"segment":2,"confidence":2.702977580196371,"asi":{"hypothesis":"Pseudo-label the pre-span year with a wide window around the K marks and re-derive the burst admission band from the year-long event population (5 marks -> thousands of labels).","outcome":"REFUTED both ways: population p10/p90 band -0.0420, population centre with the mark's width -0.048. The population p50 is biased 4-30% LOW because the wide window is not device-pure.","rollback_reason":"Emissions inflate 2.6-4.8x (house_17 kettle 574->1506 over the same 590 GT, P 0.83->0.21) and recall falls too; the K=5 submeter marks are a better amp estimator than any single-house aggregate statistic.","next_action_hint":"B3 needs a device-pure labeling function: cross-house discriminative training (B1's trainable component) or B2's synthetic supervision, NOT a statistic of the target house's own aggregate. The zero-cost pre-span event set stays available for duration/prior use.","integrity":"GT counts identical in every A/B pair (GT is model-independent, bench_v4.py:177); fridge/wm/dw medians bitwise unchanged, so the blast radius is exactly the kettle/microwave gates."}}
