{"run":80,"commit":"703a591","metric":0.323427,"metrics":{"mean_device_f1_p10":0.317584,"transfer_mean_f1":0.151921,"median_kettle_f1":0.536898,"median_microwave_f1":0.266004,"median_fridge_f1":0.328763,"median_washing_machine_f1":0.224674,"median_dishwasher_f1":0.346705,"b1_events_mined":5260,"b1_enroll_top1_enc":0.84,"b1_enroll_top1_raw":0.65,"b1_cross_house_top1":0.21,"b1_gate_kettle_kept_frac":0.813,"b1_gate_mw_kept_frac":0.853,"b2_probe_mw_iso_mean":0.34,"b2_probe_iso_all_mean":0.61,"device_balanced_mean":0.332085,"house_1_v4_mean":0.542204,"v4_n_pairs":66,"v4_n_houses":20,"fridge_median_delta":0,"primary_delta":0.00146},"status":"discard","description":"Hypothesis: the zero-as-undefined class found in run 79 generalises - any order-statistic\nsentinel (idle_hi = 0 from a fully-heated mark window; dens_lo = 0 from a mark window whose\nextractor mined no events) silently disables a detector gate, so both should estimate their\nstatistic from the windows that measured it.\n\nEdits (src/experiments/04_autoresearch/model.py only, 3 sites):\n1. `idles.append(... if len(below) else 0.0)` -> `else None` and `'idle_hi': 2.0*max(idles)`\n   -> max over the non-None values (inf when none): dw L470/L500, wm L677/L697.\n2. `'dens_lo': 0.75 * min(denss)` -> `0.75 * min(nonzero denss)` (0.0 when all are zero).\n\nCONFIRMED (idle, upper bound): a 0-valued *upper* bound is strictly wrong - it rejects every\ncandidate. refit/house_10 dw 0.00 -> 0.1458 (n 1 -> 10, P=0.70, R=0.08); it is the only pool\nhouse with a 0-valued idle_hi, so the repair is scoped to one scored pair.\nREFUTED (dens_lo, lower bound): all six dead lower gates lifted as designed (0.000 -> 0.060,\n0.088, 0.121, 0.150, 0.205, 0.280) but the wm outcome is mixed-to-negative at 1 seed:\n  refit/house_13 wm P 0.27->0.40, F1 0.32->0.38 (+0.06)\n  refit/house_16 wm P 0.14->0.16, F1 0.19->0.21 (+0.02)\n  refit/house_7  wm P 0.27->0.31, F1 0.26->0.27 (+0.01)\n  refit/house_6  wm P 0.04->0.00, F1 0.04->0.00 (-0.04)\n  refit/house_1 wm emissions 105->77 with F1 flat 0.17; houses 10/18/21 unchanged (their\n  candidates already exceeded the new floor).\nThe 5-seed wm device median FELL 0.228634 -> 0.224674 (-0.003960).\nLESSON: an order-statistic sentinel is a bug only when the sentinel value CONTRADICTS the\nstatistic's role. A 0 upper bound is fatal (nothing can pass); a 0 lower bound is merely\npermissive, and the sparse window that produced it carries real information - the min-based\nfloor is protective, exactly as m11 found for the fridge duration floor. Same shape as m11:\nremoving a low order statistic costs BOTH precision and recall.\n\nMeasured (pool v4, 5 seeds, 111 s): primary 0.323427 (+0.001460 vs the 703a591 floor\n0.321967); p10 0.317584 (-0.000455); device_balanced 0.332085 (+0.003603); house_1 flat\n0.542204; kettle/microwave/fridge/dishwasher medians bit-identical (a gain on the lowest dw\npair cannot move the dw median 0.346705); washing_machine median -0.003960. Seed means 2026\n.323427 / 1 .321067 / 2 .328895 / 3 .331213 / 4 .315262. Verdict: discard - sub-bar with a\np10 drop and a (small) device-median drop; reverted.\n\nEmission-geometry census (seed 2026, emitted vs GT, measured directly) - rules several\ncandidate next steps in or out:\n- FRAGMENTATION IS ZERO: the fraction of emitted onsets with another emission within\n  TAU_ONSET_S is 0.00 for every device on every house measured (mw, fridge, wm, dw, kettle\n  over 6 houses). Near-duplicate emissions are not why precision is low, so de-duplication\n  is dead as a lever.\n- A systematic onset bias of -18 s sits on fridge/microwave/kettle (med d = -18, -18, -15 s)\n  and -400 s on wm - all INSIDE the per-device tolerance (120/60/600 s), so they are not the\n  F1 limiter; do not chase them.\n- MICROWAVE over-emits 2-4x with durations ~2x too short (house_18 274 em for 61 gt, median\n  duration 84 s vs 114 s gt; house_6 74 for 390; house_10 224 for 103) -> mw is a\n  precision+duration problem downstream of extraction, matching m7.\n- FRIDGE and WM are coverage-limited: matching cover is 175/1956 (house_10), 1080/4209\n  (house_18), 419/2165 (house_1), 487/2436 (house_6) for fridge and 14/61, 17/77, 1/37,\n  12/42, 1/22 for wm - the detectors miss most real cycles while emitting many others.\n- refit/house_6 is recall-dead house-wide (kettle F1 0.02 with 649 gt, microwave 0.04 with\n  390 gt) and its GT cycles are SHORT (median 90 s kettle and mw duration vs 150-250 s\n  elsewhere) -> a per-house smoothing/step-scale calibration problem, i.e. the owner-directed\n  per-house parameter fitting, not a sentinel.","title":"zero-as-undefined bundle: idle bound real, density floor refuted","summary":"pool 0.323427 (+0.0015), p10 -0.0005, wm median -0.0040; idle 0-bound fatal, dens_lo 0-bound protective","timestamp":1790497881509,"segment":2,"confidence":0.9394828697836768,"asi":{"hypothesis":"the zero-as-undefined sentinel class generalises to the density floor","outcome":"half-confirmed: the 0 upper bound (idle_hi) is fatal and its repair is real (house_10 dw 0.00->0.1458); the 0 lower bound (dens_lo) is merely permissive and raising it cost the wm median -0.00396; pool +0.0015, p10 -0.0005","rollback_reason":"sub-bar on the primary (+0.0015 << +0.01) with a p10 drop and a wm device-median drop","next_action_hint":"stop patching order statistics; batch the verified idle repair with a structural wm/fridge recall change (coverage is 10-45%) - e.g. the owner-directed per-house calibration from the K=5 marks, since refit/house_6 is recall-dead house-wide with 90 s GT cycles vs 150-250 s elsewhere","ruled_out":"emission de-duplication (frag<tau = 0.00 for every device/house measured); onset-bias chasing (-18 s fridge/mw/kettle, -400 s wm are inside tolerance)","diagnosis":"mw over-emits 2-4x with 2x-short durations; fridge/wm are coverage-limited; sentinel class now complete (only L408 candidate-side else 0.0 remains, which is correct)"}}
{"run":81,"commit":"703a591","metric":0.329025,"metrics":{"mean_device_f1_p10":0.323825,"transfer_mean_f1":0.151921,"median_kettle_f1":0.540554,"median_microwave_f1":0.266004,"median_fridge_f1":0.328763,"median_washing_machine_f1":0.228634,"median_dishwasher_f1":0.346705,"b1_events_mined":5260,"b1_enroll_top1_enc":0.84,"b1_enroll_top1_raw":0.65,"b1_cross_house_top1":0.21,"b1_gate_kettle_kept_frac":0.813,"b1_gate_mw_kept_frac":0.853,"b2_probe_mw_iso_mean":0.34,"b2_probe_iso_all_mean":0.61,"device_balanced_mean":0.338414,"house_1_v4_mean":0.545625,"v4_n_pairs":66,"v4_n_houses":20,"fridge_median_delta":0,"primary_delta":0.007058},"status":"discard","description":"Hypothesis: the run-80 sentinel class extends to COUNT gates - a calibration-derived\n'demonstrability' count that switches a whole device off is the same defect as a\ndegenerate order statistic, and the kettle carries exactly one.\n\nEVIDENCE (1-seed census, floor model): `kettle sustained marks: N/5 windows hold an\nisolated in-band run` over the 12 kettle pairs is 0/5 x2, 1/5 x2, 2/5 x3, 3/5 x4,\n4/5 x1 - i.e. 9 of 12 pairs sit BELOW KET_MARK_MIN=3 and the sustained-run path is\nsilently disabled house-wide on 75% of kettle pairs. The four houses at 3/5+ are\nexactly the top kettle F1s (0.76, 0.77, 0.82, 0.84); the disabled ones range 0.02-0.62.\nThe gate is a vote on the 5 marks, but every emitted candidate is ALREADY filtered\nindividually (span band, amp band, _iso_clear, no admitted-event overlap, no named\nspan overlap), so the count adds no per-candidate protection - it only punishes homes\nwhose electrical environment is busy (any >=1kW neighbour within +-600s breaks the\nmark's isolation test). refit/house_6 is the extreme: 235 mined kettle-band events,\ndur_p50 1.2 min against a 1.5 min GT, but 1/5 isolated marks -> kettle F1 0.02 with\n649 GT cycles.\n\nEDITS (model.py only, 5 hunks, git-diff verified):\n1. KET_MARK_MIN 3 -> 1, with the demonstrability rationale in the comment.\n2. the run-80 idle sentinel repair re-applied (L470 and L677 `else 0.0` -> `else\n   None`; L500 and L697 `2.0*max(idles)` -> max over the non-None values, inf when\n   none). The run-80 dens_lo change is deliberately NOT re-applied (m14 refuted it).\n\nRESULT (pool v4, 5 seeds, 106 s, 66 pairs, checks pass): primary 0.329025, +0.007058\nvs the 703a591 floor 0.321967. ALL GUARDS IMPROVED: p10 0.318039 -> 0.323825\n(+0.005786), device_balanced 0.328482 -> 0.338414 (+0.009932), house_1 0.542204 ->\n0.545625 (+0.003421). No device median fell: kettle 0.536898 -> 0.540554 (+0.003656),\nmicrowave 0.266004, fridge 0.328763, washing_machine 0.228634, dishwasher 0.346705 all\nbit-identical (the dw idle repair only touches refit/house_10, the LOWEST dw pair, so\nit cannot move the dw median 0.346705).\nPer-house at 1 seed: eco/house_02 kettle 0.34 -> 0.74 (P 0.52->0.71, R 0.25->0.77, n\n42->95) and ukdale/house_1 0.76 -> 0.79; the other ten kettle pairs bit-identical.\n\nWHY ONLY 2 OF 5 NEWLY-ENABLED PAIRS MOVED (new mechanism, worth recording): scoring\nmatches ONSETS. On three of the newly-enabled houses the net-new sustained candidates\nlanded adjacent to already-emitted kettle episodes, so they EXTENDED those episodes\nwithout creating a new onset - emission counts moved (house_6 28->33, house_12 684->712,\nhouse_21 280->301) while F1 did not move at all. Emission-count deltas are therefore\nnot evidence of scoring impact; only onset deltas are.\n\nVERDICT: discard - the primary gain (+0.0071) is under the +0.01 keep bar even though\np10, device_balanced and house_1 all improved and no median regressed. Reverted with\nthe 4th consecutive sub-bar discard of a guard-clean structural fix (runs 78-81).","title":"kettle demonstrability gate 3->1 + idle sentinel: +0.0071, sub-bar","summary":"pool 0.329025 (+0.0071), p10 +0.0058, house_1 +0.0034, no median drop; 9/12 kettle pairs had a disabled detector","timestamp":1790498194809,"segment":2,"confidence":1.1631193961038504,"asi":{"hypothesis":"calibration-derived count gates silently disable detectors, same class as run 80's sentinel","outcome":"confirmed: 9/12 kettle pairs below KET_MARK_MIN=3; gate 3->1 gives primary +0.0071 with p10 +0.0058, device_balanced +0.0099, house_1 +0.0034 and no device-median regression","rollback_reason":"primary gain +0.007058 < the +0.01 keep bar (guards all improved; the bar is the only reason)","next_action_hint":"re-apply this 5-hunk bundle (KET_MARK_MIN=1 + idle sentinel) and add a POPULATION-based demonstrability rule so the 2 pairs still at 0/5 (whose marks never demonstrate the pattern but whose span may hold isolated in-band runs) can enable too; expected +0.003-0.012, downside bounded because both are far below the kettle median","ruled_out":"nothing refuted here; emission-count deltas are NOT scoring evidence (adjacent candidates extend episodes without new onsets)","process":"4th consecutive sub-bar discard of a guard-clean structural fix (78,79,80,81) - verified progress cannot accumulate under a flat +0.01 bar; owner should decide whether structural fixes accumulate or the bar scales"}}
{"run":82,"commit":"703a591","metric":0.331443,"metrics":{"mean_device_f1_p10":0.325666,"transfer_mean_f1":0.151921,"median_kettle_f1":0.543172,"median_microwave_f1":0.266004,"median_fridge_f1":0.334602,"median_washing_machine_f1":0.228634,"median_dishwasher_f1":0.346705,"b1_events_mined":5260,"b1_enroll_top1_enc":0.84,"b1_enroll_top1_raw":0.65,"b1_cross_house_top1":0.21,"b1_gate_kettle_kept_frac":0.813,"b1_gate_mw_kept_frac":0.853,"b2_probe_mw_iso_mean":0.34,"b2_probe_iso_all_mean":0.61,"device_balanced_mean":0.340336,"house_1_v4_mean":0.545625,"v4_n_pairs":66,"v4_n_houses":20,"fridge_median_delta":0.005838999999999983,"primary_delta":0.009475999999999984},"status":"discard","description":"Fridge run-basis amp window repaired for contaminated passive marks, kettle gate made in-band, batched with the run-80/81 idle repair: +0.009476, every guard up, 0.0005 under the bar.\n\nRESULT (pool v4, 66 pairs, 20 houses, 5 seeds, checksPass=true, 105.044s): primary 0.321967 -> 0.331443 (+0.009476).\n  p10 0.318039 -> 0.325666 (+0.007627); device_balanced 0.328482 -> 0.340336 (+0.011854); house_1 0.542204 -> 0.545625 (+0.003421).\n  Device medians: kettle 0.536898 -> 0.543172 (+0.006274); fridge 0.328763 -> 0.334602 (+0.005839); mw 0.266004, wm 0.228634, dw 0.346705 all bit-identical. NO device median fell.\n  v4_n_pairs=66, v4_n_houses=20. Fifth consecutive guard-clean discard (78-82); closest yet.\n\nBUNDLE (6 hunks in src/experiments/04_autoresearch/model.py, each verified before batching):\n  1. kettle sustained-run gate: KET_MARK_MIN 3 -> 1, and the gate now counts marks holding an IN-BAND run (ket_inband) rather than only an ISOLATED one. Isolation is a per-candidate filter (_iso_clear on every emitted candidate), never a sensible vote on the five mark windows: a busy home has a >=1kW neighbour within +-600s of most marks.\n  2. the run-80 idle sentinel pair (idles None instead of 0.0; idle_hi = inf when all None) - a 0 upper-bound sentinel is fatal, a 0 lower bound merely permissive.\n  3. NEW: fridge run-basis amp window was 0.8x the PASSIVE MARK amp. When a neighbour load sits inside the passive window the mark is contaminated, 0.8x it lands ABOVE the mined band top and the window inverts: refit/house_17 passive 'fridge' mark = 932W / 0.3min (a 2kW neighbour) -> window [745W, 120W] -> literally 0 run-basis candidates for the entire 90 days. Guard clause: when 0.8*mark_amp > band_amp_hi, take the lo margin, the dur-lo margin and the isolation level from the MINED population band instead (0.8*band_lo, band_dur_lo/REL_DUR[1], 3*band_hi). No new constants, and bit-identical on every house whose mark is clean.\n\nPER-REPAIR EVIDENCE (1-seed census):\n  kettle gate: pairs running the path 10/12 -> 12/12. eco/house_02 kettle 0.34 -> 0.74 (P 0.52->0.71, R 0.25->0.77), refit/house_13 0.23 -> 0.25, other ten pairs bit-identical. The kettle lever is now EXHAUSTED: the full in-band gate adds only +0.02 to the summed kettle F1 over the isolated-count version (5.93 -> 5.95); ten of twelve pairs do not respond to the gate at all, their binding constraint is precision.\n  fridge repair: house_17 run-basis 0 -> 2372 candidates, emissions 107 -> 280, but P 0.29 -> 0.16 with R flat at 0.02 (F1 0.03 -> 0.04): the newly admitted candidates do NOT land on that house's GT cycles. Its real yield is the +0.0058 fridge median earned on OTHER contaminated-mark houses. house_17's fridge is a placement problem, not a demonstrability one.\n\nPROCESS: m15 recommended batching several sub-bar structural repairs and judging them once. This run did exactly that - three verified, guard-clean, individually-positive repairs - and still landed 0.0005 short. Each reverted fix must be re-applied by the next run before it can add anything, so the required batch grows while the bar stays fixed. Proposed rule for the owner: keep when primary rises >= 0.005 AND p10 rises AND device_balanced rises AND no device median falls. Runs 78-82 would all have been keeps and the floor would now be 0.3314.\n\nNEXT: refit/house_11 washing_machine emits 0 of 15 GT cycles while 37 candidates pass the wm run gates on the PRE span; emission reuses _dw30_runs on the EVAL span (model.py L1183), so a level gate calibrated on one 180-day window (idle <= 122W / mean_band / hs_band / dens) rejects every candidate in the other - the m10 'a level is not background-robust' lesson in the wm path. Diagnose per-gate pass counts on the eval span, then repair the dead gate. One pair 0.00 -> 0.4 is +0.006 pool primary, and wm has 15 pairs and the lowest device median (0.2286).","title":"Fridge contaminated-mark run window repaired; +0.0095, all guards up","summary":"Pool 0.321967->0.331443 (+0.009476): p10 +0.0076, device_balanced +0.0119, kettle median +0.0063, fridge median +0.0058, no median down; 0.0005 under the bar.","timestamp":1790498656874,"segment":2,"confidence":1.5004971237838223,"asi":{"hypothesis":"Calibration-derived quantities that silently disable a detector are one defect class - a 0/false sentinel (m14), a count gate (m15), and now a mark-contaminated lower bound that inverts the run window (m16). Fixing the class, not the threshold, moves guards.","rollback_reason":"Primary +0.009476 < the +0.01 keep bar, although p10, device_balanced, house_1 and two device medians all rose and nothing fell.","next_action_hint":"Re-apply the 6-hunk bundle then diagnose refit/house_11 wm (0 emissions vs 37 pre-span candidates): count per-gate passes of _dw30_runs on the EVAL span and repair whichever gate is dead.","bundle_recipe":"KET_MARK_MIN=1 + ket_inband gate; idles None + idle_hi inf; fridge fr_run guard clause on 0.8*mark_amp > band_amp_hi"}}
{"run":83,"commit":"703a591","metric":0.331443,"metrics":{"mean_device_f1_p10":0.325666,"transfer_mean_f1":0.151921,"median_kettle_f1":0.543172,"median_microwave_f1":0.266004,"median_fridge_f1":0.334602,"median_washing_machine_f1":0.228634,"median_dishwasher_f1":0.346705,"b1_events_mined":5260,"b1_enroll_top1_enc":0.84,"b1_enroll_top1_raw":0.65,"b1_cross_house_top1":0.21,"b1_gate_kettle_kept_frac":0.813,"b1_gate_mw_kept_frac":0.853,"b2_probe_mw_iso_mean":0.34,"b2_probe_iso_all_mean":0.61,"device_balanced_mean":0.340336,"house_1_v4_mean":0.545625,"v4_n_pairs":66,"v4_n_houses":20,"fridge_median_delta":0.005839,"primary_delta":0.009476},"status":"discard","description":"RUN 83 (discard; primary 0.331443, checksPass true, 106s, 66 pairs, 20 houses).\nBundle = m16's six verified hunks (kettle in-band gate, idle sentinels, fridge contaminated-mark guard) PLUS one new structural repair.\n\nNEW FINDING (m17): refit/house_11 wm emitted 0 episodes although the eval-span gates were fully live - 16 runs passed every _dw30_runs gate (spans 36-107min in [18,142], mean 330-495W in [149,664], hs 0.25-0.64 in [0.21,1.50], idle 54-148W vs idle_hi 122; pre span gave 37 candidates).\nMechanism: emission writes emit_w = mark_<dev>['mean_w'] into the output mask (dw L514, wm L710). house_11's wm mark is amp=215W dur=28.4min mean=30W - 30W is BELOW AMP_MIN_W=50W, the floor the harness event reader uses, so np.maximum(seg, 30) marked 16 spans with a value nothing could read. This is the SAME defect class as m14/m15/m16 (a calibration-derived quantity silently disables a detector) but at the write boundary rather than at a gate.\nRepair: emit_w = max(mark_<dev>['mean_w'], AMP_MIN_W) for dw and wm. Verified house_11 wm pred 0 -> 13.\n\nRESULT: pool primary 0.331443, bit-identical to run 82 (0.331443) - the clamp is metric-neutral because house_11's 13 wm emissions land 600s+ off its 15 GT cycles (F1 stays 0.00) and no other pool pair has a sub-50W wm/dw mark mean.\nvs floor 703a591: primary +0.009476, p10 +0.007627, device_balanced +0.011854, house_1 +0.003421, kettle +0.006274, fridge +0.005839; mw/wm/dw medians bit-identical; no device median fell.\n\nNEXT (recorded in m17): house_11's placement defect is the biggest clean prize. It emits 13/15 wm and 12/12 dw episodes with ZERO onsets inside tau_onset while its dense devices score (kettle 0.57/565 GT, fridge 0.25/1877, mw 0.23/91). Hypothesis H-shift: a fixed timebase offset between the model's eval-span grid and the GT mask destroys sparse-GT devices and barely dents dense ones. Test by dumping pred vs GT onsets for one house and printing the signed nearest-GT offset per device; repair the single arithmetic error, not per-house offsets.\n\nGUARDS: all clean; no device median regression; p10 and device_balanced both rose.\nSTANDING: sixth consecutive guard-clean run under the flat +0.01 keep bar (78-83); keep-rule proposal (>=0.005 AND p10 AND device_balanced up AND no device median down) still pending with the owner.","title":"run 83: emit_w floor-clamp (legibility) - metric-neutral, 0.0095 under bar","summary":"Mask writes below AMP_MIN_W=50W are invisible; clamping dw/wm emit_w flips house_11 wm 0->13 emissions but pool is bit-identical at 0.331443","timestamp":1790498952695,"segment":2,"confidence":1.937261464051987,"asi":{"hypothesis":"A detector that decides to emit but writes its mark below the reader's amplitude floor (AMP_MIN_W=50W) is silently disabled; clamping emit_w to the floor restores it without changing any gate.","bundle":"m16 six hunks + emit_w floor clamp (dw L514, wm L710)","mechanism_evidence":"house_11 wm: 16 eval-span runs pass every gate, 0 episodes before clamp, 13 after; mark mean_w=30W < AMP_MIN_W=50W","metric_neutral":"pool 0.331443 == run 82 exactly; house_11 wm F1 0.00 both ways (13 emissions are 600s+ off 15 GT)","next_action_hint":"H-shift: dump pred vs GT onsets on one house, print signed nearest-GT offset per device; sparse-GT devices (wm 15, dw 12 on house_11) die while dense ones survive, which a fixed timebase offset would explain.","rollback_reason":"flat +0.01 keep bar not cleared (+0.009476); the clamp is correct but metric-neutral, so the bundle as a whole still sits 0.0005 short.","keep_rule_proposal":"keep when primary rises >=0.005 AND p10 rises AND device_balanced rises AND no device median falls (runs 78-83 would all be keeps)"}}
