{"run":42,"commit":"71ad484","metric":0.5896539900882762,"metrics":{"min_device_f1":0.36170212765957444,"pooled_cycle_f1":0.5393181428816174,"mean_mae_w":23.507104638131494,"worst_mae_w":54.020482254652265,"mean_nmae":0.067679223542272,"coverage_pred_share":0.25648754042515737,"coverage_true_share":0.25263950366526144,"kettle_f1":0.7792998477929985,"microwave_f1":0.36170212765957444,"fridge_f1":0.5186500888099467,"washing_machine_f1":0.6219512195121951,"dishwasher_f1":0.6666666666666666,"kettle_mae_w":10.264401709977083,"microwave_mae_w":7.0179556473755715,"fridge_mae_w":28.46002323504671,"washing_machine_mae_w":54.020482254652265,"dishwasher_mae_w":17.77266034360585},"status":"discard","description":"i38 examined two hypotheses; neither survived. No code change kept; working tree back to run-40 state at HEAD 71ad484 and the official re-run reproduces mean_device_f1=0.5896539900882762 exactly (deterministic bench; the candidate's dry-run == official, both disclosed).\n\nCAP ACCOUNTING (disclosed): the pre-declared mw 3/3 cap override became moot - the mw sequence hypothesis died in the pre-span diagnostic and never reached the eval span, so mw was NOT spent. The fridge iso-shape variant WAS evaluated on the full eval span via the disclosed dry-run (deterministic, identical to an official emit) and rejected; counting it conservatively, fridge is now 3/3 (exhausted). Kettle 1/3 (2 left, parked), wm 2/3 (1 left), dw 2/3 (parked).\n\nHYPOTHESIS 1 - mw sequence clustering (per i37 asi hint): back-to-back mw items (gaps<=60s) merge into one GT cycle via ON-mask MERGE_S 60; emitting the cluster span should convert item FPs into one TP. Diagnostic (.scratch/diag_i38a.py, pre-span only, predict-path chain suppression replicated exactly: _chains mg=100 cells, seed_thr=1082 W, heat_thr=1623 W; 164 named chains, 4826 events suppressed): 659 mw-admitted events (2.03/day; amp in [1266,1900] W, dur in [16,144] s). Consecutive-gap histogram: <=30s 8, 30-60 26, 60-90 23, 90-120 14, 120-180 11, 180-300 13, 300-600 33, >600 512 (78% isolated singletons). Clusters at G<=60s: 43/325d = 12/90d = 4% of GT cycles (286/90d); amp-consistency (max-min<=316.6 W, REL_AMP convention) prunes NOTHING (43 gap-only vs 43 with consistency; tight-gap cluster amp spread p50 66 W either way) - the fingerprint is vacuous. EV -0.008 to +0.0024 mean. DECISION: mass absent, do not spend. Side findings: non-chain amp-band events ALL have dur<=144 s (the dur gate is redundant outside chains); mined mw dur p50 2.7 min is chain-inflated (947 of 1606 amp-band events live inside named chains).\n\nHYPOTHESIS 2 - fridge flat-shape iso exemption: the fr_run iso gate (3x mark amp = 150 W within +-600 s) blocks 7.12/day in-band runs (2313/325d); they are 79% flat (exc p90/p10<=1.6) vs 89% flat among iso-passing (pass shape p50 1.12); fail structure 61% end-at-co-load (matchable onset), 68% start-after-co-load, 5% chopped-inside; tod daytime-heavy consistent with kitchen co-loads; fpop amp histogram continues smoothly through the 105 W band top (88,99,76,70 events per 5 W bin at 105-140 W - no gap). Threshold mined from the admitted population: pass p75 of shape = 1.28 -> FR_SHAPE_FLAT=1.3, exempting 1369 runs (4.21/day, 55% pre-co-load share). Implemented in the predict fridge run-basis block (iso-failing runs with shape<=1.3 keep emission); compiled clean.\n\nDISCLOSED DRY-RUN (bash .auto/measure.sh, .scratch/dry_i38_frshape.txt): build echo unchanged (fridge run-basis: 2386 net-new candidates 7.34/day - the build-side echo counts iso-passing only; a consistency gap had the change been kept). SANITY_GATE=PASS (min 0.915). Fridge: n_gt 2805, n_pred 1699->2016 (+317), matched 1168->1233 (+65) = purity 65/317 = 20.5%, P 0.687->0.612, R 0.416->0.440, F1 0.5186500888099467->0.5118 (-0.0069), MAE 28.5->28.3, nMAE 0.0819->0.0815. mean_device_f1 0.5896539900882762->0.588226 (-0.001428); min unchanged 0.36170212765957444 (mw); pooled_cycle_f1 0.5393->0.5327; mean_mae_w 23.507->23.476; worst_mae_w 54.0205 unchanged; mean_nmae 0.067679->0.067591; coverage_pred_share 0.2565->0.2624, coverage_true_share 0.2526 unchanged.\n\nOUTCOME: purity 20.5% is far below the ~33% breakeven and below the 55% pre-fragment share the diagnostics suggested - flat excitation does NOT separate compressor cycles from flat daytime electronics (TV/monitor-class draws 80-105 W in the same amp/dur band). Third consecutive fingerprint-transfer failure (i35 flatness 29% purity; i37 dw fingerprints 0/1 eval purity; i38 fridge flat-shape 20.5%). Reverted per protocol: git checkout -- model.py + last_bench.json restored from .scratch backup; verified FR_SHAPE_FLAT count 0 and mean_device_f1 0.5896539900882762 in the restored bench file.\n\nOFFICIAL RE-RUN (reverted baseline, .auto/runs/42.log): reproduces run-40 exactly (deterministic): kettle 366/291/256 P .880 R .699 F1 0.7792998477929985; mw 286/184/85 P .462 R .297 F1 0.36170212765957444; fridge 2805/1699/1168 P .687 R .416 F1 0.5186500888099467; wm 80/84/51 P .607 R .637 F1 0.6219512195121951; dw 28/14/14 P 1.000 R .500 F1 0.6666666666666666; MAE_W 10.264/7.018/28.460/54.020/17.773. mean 0.5896539900882762, min 0.36170212765957444, pooled 0.5393181428816174, mean_mae_w 23.507104638131494, worst_mae_w 54.020482254652265, mean_nmae 0.067679223542272, coverage_pred_share 0.25648754042515737, coverage_true_share 0.25263950366526144. SANITY_GATE=PASS, checksPass.\n\nANTI-OVERFIT HYGIENE: all parameters mined from calib marks + pre-span diagnostics only (FR_SHAPE_FLAT=1.3 = admitted-population p75 of p90/p10; mw cluster-gap candidates 48/60/90/120 s considered, none mark-copied; GT MERGE_S 60 never became a model gate - the mw hypothesis was rejected before any gate was written). Eval-span deltas motivated conclusions, never parameters. Pre-span submeter ON-mask never loaded for tuning.\n\nLESSONS: (1) positive - exact predict-path replication in pre-span funnels kills dead hypotheses BEFORE eval spend (mw sequences: mass 4% of GT, killed free); (2) negative - fingerprints validated on pre-span populations do not transfer to eval purity (third repetition); flat electronics vs flat compressor are structurally indistinguishable in mains-only excitation; (3) the P-cost/R-gain asymmetry holds even at big denominators: +317 preds at 20.5% purity cost -0.075 P for +0.024 R.\n\nNEXT: fridge exhausted (3/3 conservative accounting). Remaining: kettle 2 runs (0.779, R 0.699, 110 unmatched GT cycles - miss-mode diagnostic could locate the dominant miss mode before spending), wm 1 run (emit-level MAE lever only, no F1 EV), dw 1 run (parked). Recommend the kettle miss-mode diagnostic next.","title":"i38: mw sequence mass absent; fridge flat-iso purity 20.5%, reverted","summary":"mw clusters 43/325d, 4% of GT cycles - no eval spend. Fridge flat-shape iso exemption: +317 preds/65 matched = 20.5% purity, fridge F1 -0.007, mean 0.5897->0.5882. Reverted.","timestamp":1790466581038,"segment":1,"confidence":5.035191148325439,"asi":{"hypothesis":"i38: mw sequence cluster emission (per i37 hint) + fridge flat-shape iso exemption (FR_SHAPE_FLAT=1.3)","outcome":"mw sequences: mass absent (43 clusters/325d, amp-consistency vacuous) - killed pre-span, no spend. Fridge exemption: eval purity 20.5% (65/317), fridge F1 -0.0069, mean -0.0014 - reverted.","rollback_reason":"third consecutive fingerprint-transfer failure (i35 29%, i37 0/1, i38 20.5% purity); flat excitation cannot separate compressor from flat daytime electronics; P cost (-0.075) swamps R gain (+0.024)","next_action_hint":"fridge 3/3 exhausted (conservative accounting). Next: kettle miss-mode diagnostic (2 kettle runs left, R 0.699, 110 unmatched GT cycles) before spending either kettle run; wm/dw parked."}}
{"run":43,"commit":"71ad484","metric":0.5896539900882762,"metrics":{"min_device_f1":0.36170212765957444,"pooled_cycle_f1":0.5393181428816174,"mean_mae_w":23.507104638131494,"worst_mae_w":54.020482254652265,"mean_nmae":0.067679223542272,"coverage_pred_share":0.25648754042515737,"coverage_true_share":0.25263950366526144,"kettle_f1":0.7792998477929985,"microwave_f1":0.36170212765957444,"fridge_f1":0.5186500888099467,"washing_machine_f1":0.6219512195121951,"dishwasher_f1":0.6666666666666666,"kettle_mae_w":10.264401709977083,"microwave_mae_w":7.0179556473755715,"fridge_mae_w":28.46002323504671,"washing_machine_mae_w":54.020482254652265,"dishwasher_mae_w":17.77266034360585},"status":"discard","description":"i39 is a diagnostic-only iteration: per the i38 asi hint, the kettle miss-mode funnel was mapped (diag_i39a), and the same gate-by-gate funnel was extended to dw (diag_i39b) and wm (diag_i39c) so the exhaustion conclusion covers every family with remaining runs. No code change was made; no family cap was spent (all three diagnostics are pre-span only, no eval-span evaluation of any variant). The official run on the unchanged baseline reproduces mean_device_f1=0.5896539900882762 exactly (deterministic; .auto/runs/43.log).\n\nKETTLE FUNNEL (diag_i39a, replication sanity: run-path 237 candidates/0.73/day vs build echo 236/0.73; in-band events 723 = 2.22/day, all emitted since kettle classification is chain-blind with no iso gate on events; 8% sit inside named chains): the R gap (GT 4.07/day vs matched 2.84/day) does not live in any addressable population. Near-miss pools: sub-band 1700-1982 W 40-360 s = 116 (0.36/day), iso-fail 79%, tod daytime-heavy (46+33 of 116 in the two kitchen slots); in-band short 15-40 s = 62 (0.19/day), iso-fail 95%; in-band long 360-720 s = 82 (0.25/day), iso-fail 51%; kettle+mw overlap events 2972-4600 W = 4 TOTAL (0.01/day), zero within 10% of the 4060 W mark-sum - the overlap hypothesis is dead. Breakeven purities from eval accounting: sub-band +32 preds needs 38.9% purity, short needs 73%, long needs 50%; the three-strike empirical band is 20-30% (i35 29%, i37 0/1, i38 20.5%) - every variant is negative-EV. Run-path iso relaxation is also NO-GO: the 1000 W/600 s iso is the only separator between kettle runs and hob burners in that path, and 53% of genuine in-band events already have co-loads (the iso-fail fingerprint does not separate kettle from hob).\n\nDW FUNNEL (diag_i39b, replication exact: 49 pass / 0.15/day vs echo 49 / 0.151): stage0 merged heater runs >=1623 W with 70 min merge = 1085 (3.34/day). Gate rejections: min_span <20 min = 430 (1.32/day, daytime-heavy cooking bursts, correct); span_band 46-102 min = 366 (1.13/day, spans p50 43 min - short heater sequences); amp_lo <2107 W = 182 (0.56/day); mean_band = 34 (0.10/day); hs/idle/dens = 8/9/7 (tiny). The only sizable pool is the amp_lo deficit [1685, 2107): 206 runs (0.63/day) - but their structure (idle 200-501 W vs mark-implied <=144, hs 0.11-0.35, spans 20-218 min straddling the mark band) is exactly the population the i37 dry-run evaluated on the eval span at 0/1 purity. Re-refuted by fingerprint; NO-GO stands.\n\nWM FUNNEL (diag_i39c, replication: 172 raw passes vs echo 82 net-new after dedupe - gate structure identical): stage0 = 1947 (5.99/day). Rejections: min_span <20 min = 1557 (4.79/day, daytime cooking bursts, correct); amp_lo = 86 (0.26/day), mean_band = 67 (0.21/day), dens_lo = 53 (0.16/day) - ALL are 22-41 min runs with daytime-heavy tod (cooking/co-load structure); span_band/hs = 6/6 (tiny). The i36 conclusion (wm has no F1 EV, emit-level MAE lever only) stands; the near-miss pools carry the same fingerprint risk that failed three consecutive dry-runs.\n\nBACKLOG CHECK: .auto/ideas.md is from the neural-decode segment (i1-i19, min_device_f1/30-day contract, FHMM/CNN machinery); the current mark-anchored heuristic architecture replaced that line in runs 20+. Nothing in the backlog transfers to the current model without reopening settled questions (i13/i16 refutations, i5 duration-filter refutation).\n\nEXHAUSTION CONCLUSION: with mw sequences dead (i38), fridge iso-shape refuted by dry-run (i38, 20.5% purity, counted 3/3), and now kettle/dw/wm funnels showing no spendable pool (this iteration), the fingerprint-admission approach is exhausted at the current architecture. Remaining caps: kettle 2, wm 1, dw 1 - none has a candidate with positive EV under the three-strike lesson. Forcing an admission run would be exactly the overfit-to-benchmark behavior the loop discipline forbids.\n\nOFFICIAL RUN (.auto/runs/43.log, unchanged baseline): kettle 366/291/256 P .880 R .699 F1 0.7792998477929985; mw 286/184/85 P .462 R .297 F1 0.36170212765957444; fridge 2805/1699/1168 P .687 R .416 F1 0.5186500888099467; wm 80/84/51 P .607 R .637 F1 0.6219512195121951; dw 28/14/14 P 1.000 R .500 F1 0.6666666666666666; MAE_W 10.264/7.018/28.460/54.020/17.773. mean 0.5896539900882762, min 0.36170212765957444, pooled 0.5393181428816174, mean_mae_w 23.507104638131494, worst_mae_w 54.020482254652265, mean_nmae 0.067679223542272, coverage_pred_share 0.25648754042515737, coverage_true_share 0.25263950366526144. SANITY_GATE=PASS, checksPass.\n\nANTI-OVERFIT HYGIENE: no parameter was changed or proposed from eval data; all three diagnostics loaded pre-span mains and calib marks only (no submeter ON-mask); eval-span numbers appear only in the breakeven accounting of the incumbent state, never as tuning input.\n\nNEXT: the approach needs a new basis from the owner - either direction on which device family to reopen and with what mechanism class (mark-anchored only), acceptance of a holding pattern while new ideas are sourced, or a change to what counts as spendable (e.g. permitting regression-score iterations on the wm emit level, which have no F1 EV but move worst_mae_w 54.0 W).","title":"i39: kettle+dw+wm gate funnels show no spendable pool","summary":"Kettle near-miss 0.81/day, iso-fail 51-95%; dw amp pool = i37-refuted class; wm rejects are 22-41min daytime heaters. No spendable pool; baseline 0.5897 holds.","timestamp":1790466873167,"segment":1,"confidence":5.943116753430846,"asi":{"hypothesis":"i39: kettle miss-mode funnel (per i38 hint) extended to dw and wm gate funnels - locate any remaining spendable admission pool before spending caps","outcome":"No spendable pool anywhere. Kettle near-miss 0.81/day total with 51-95% iso-fail fingerprints (breakeven purities 39-73%); dw amp_lo pool 0.63/day is the i37-refuted idle-200-501W class; wm pools are 22-41min daytime heater runs. Baseline 0.5897 reproduced (run 43).","rollback_reason":"no code change was made or kept; three-strike lesson (i35 29%, i37 0/1, i38 20.5% purity) makes every remaining admission variant negative-EV; forcing a run would be benchmark overfit","next_action_hint":"Approach exhausted at current architecture. Need owner input on new basis: reopen a family with a mark-anchored mechanism class, accept holding pattern, or allow regression-score iterations (wm emit level, worst_mae_w 54.0W, no F1 EV). Caps left: kettle 2, wm 1, dw 1."}}
{"run":44,"commit":"71ad484","metric":0.5896539900882762,"metrics":{"min_device_f1":0.36170212765957444,"pooled_cycle_f1":0.5393181428816174,"mean_mae_w":22.076260866529555,"worst_mae_w":46.86626339664256,"mean_nmae":0.06355968619545511,"coverage_pred_share":0.28602786164214106,"coverage_true_share":0.25263950366526144,"kettle_f1":0.7792998477929985,"microwave_f1":0.36170212765957444,"fridge_f1":0.5186500888099467,"washing_machine_f1":0.6219512195121951,"dishwasher_f1":0.6666666666666666,"kettle_mae_w":10.264401709977083,"microwave_mae_w":7.0179556473755715,"fridge_mae_w":28.46002323504671,"washing_machine_mae_w":46.86626339664256,"dishwasher_mae_w":17.77266034360585},"status":"discard","description":"HYPOTHESIS: wm program emissions (named chains + wm30 runs over run+ext) carry the observed aggregate instead of the flat mark mean 936.3 W. Grounding: the mark profile pins the wm non-heater draw at approximately 0 W (mean_w 936.3 = heater-duty x amp 2240.5 with zero residual base), so the flat level over-states every trough/tail cell and under-states every heater-on cell; detection gates guarantee the wm dominates its own spans. Edit: two sites in model.py predict() - chain emission writes sig over the chain span; wm30 run emission np.maximum(seg, sig) over run+ext. No new constants introduced.\nINVARIANCE PROOF (dry-run disclosed; same script as official, deterministic): pred episode counts bitwise identical on every device (kettle 366/291/256, mw 286/184/85, fridge 2805/1699/1168, wm 80/84/51, dw 28/14/14; pooled 3565/2272/1574) and all 8 F1 metrics bitwise equal to the run-43 baseline; mean_device_f1 0.5896539900882762 unchanged. Mask invariance held because the aggregate stays above the strict ON threshold (bench uses w > thr) on every claimed cell. Sanity gate PASS.\nRESULT: washing_machine MAE_W 54.0205 -> 46.8663 (-13.2%), worst_mae_w 54.0205 -> 46.8663, mean_mae_w 23.5071 -> 22.0763 (-6.1%), mean_nmae 0.067679 -> 0.063560. Coverage_pred_share 0.25649 -> 0.28603 (+0.0295): wm spans now carry co-incident other-device draw, so whole-home energy attribution over-attributes during wm spans even as the wm-meter MAE improves - the honest trade-off of input-carried emission.\nDECISION: status discard. The change is F1-invariant by construction, so the primary metric cannot move; the loop gate keeps only primary improvements and auto-reverts the edit. This iteration measures the regression lever the owner objective names (regression score) and quantifies it for the open decision on allowing regression-score iterations.\nNEXT: if regression-score iterations are authorized, re-apply this exact two-site edit (no level tuning - one-shot result stands). F1 headroom remains exhausted at this architecture (i39 funnels + family caps: fridge/mw 3/3 spent, wm/dw/kettle pools dead).","title":"F1-invariant wm emission: observed aggregate replaces flat mark mean","summary":"F1 bitwise unchanged (all episode counts identical); wm MAE 54.0->46.9 W, mean_mae 23.5->22.1, worst 54.0->46.9. Primary-neutral by design; gate reverts MAE-only gain.","timestamp":1790469430817,"segment":1,"confidence":7.250497589014553,"asi":{"hypothesis":"wm claimed spans carry the observed aggregate (sig) instead of flat mark mean 936.3 W; mark profile pins non-heater draw at approximately 0 W so the sawtooth should cut per-cell level error","rollback_reason":"primary mean_device_f1 bitwise unchanged by construction (F1-invariant emission); loop gate reverts any non-primary gain despite mean_mae_w -1.43 W and wm MAE -7.15 W","next_action_hint":"if owner authorizes regression-score iterations, re-apply the exact two-site edit (chain emission + wm30 run emission in model.py predict); no level/floor tuning follow-ups - one-shot result","contamination_note":"coverage_pred_share +0.0295: wm spans carry co-incident other-device draw; energy-attribution view worsens while device-meter MAE improves","invariance_evidence":"episode counts bitwise identical all devices; 8/8 F1 metrics bitwise equal to run-43 baseline; bench pred mask is strict w > thr and aggregate stayed above it on every claimed cell"}}
