{"run":105,"commit":"b4298ca","metric":0.366222,"metrics":{"mean_device_f1_p10":0.345909,"transfer_mean_f1":0.151921,"median_kettle_f1":0.561931,"median_microwave_f1":0.26721,"median_fridge_f1":0.387253,"median_washing_machine_f1":0.246163,"median_dishwasher_f1":0.384353,"device_balanced_mean":0.368482,"house_1_v4_mean":0.529428,"v4_n_pairs":66,"v4_n_houses":20,"fridge_median_delta":0,"primary_delta":0.000048,"kettle_median_delta":0.000881,"house_1_v4_mean_delta":0,"b1_events_mined":5260,"b1_enroll_top1_enc":0.84,"b1_enroll_top1_raw":0.65,"b1_cross_house_top1":0.21,"b1_gate_kettle_kept_frac":0.813,"b1_gate_mw_kept_frac":0.853,"b2_probe_mw_iso_mean":0.34,"b2_probe_iso_all_mean":0.61},"status":"discard","description":"Run 105: decouple the wm detector's heat level from the dishwasher's mark. REFUTED as a primary gain; recorded for its device-coupling finding.\n\nHYPOTHESIS: _wm30_profile mined its candidate runs at heat = PROG_HEAT_AMP_FRAC * min(mark_wm['amp'], dw_amp) - a CROSS-DEVICE coupling. In any house whose dw mark reads below its wm mark, the wm run-basis dropped onto the dishwasher's weaker heater excursions and mined dw-level runs as wm candidates, leaving their rejection entirely to the gates (the same gates whose density floor run 104 showed rarely binds). The wm's own mark is the physically correct anchor.\n\nCHANGE (model.py, 5 insertions / 1 deletion): heat = PROG_HEAT_AMP_FRAC * mark_wm['amp'], plus a 4-line rationale comment. ast-verified.\n\nSCREENS. seed 3 (the MEDIAN seed = the primary's own draw; base mean 0.366174): variant 0.366222 (+0.000048). Per-device: microwave 0.267210 -> 0.292094 (+0.024884), dishwasher 0.384353 -> 0.354751 (-0.029602), kettle 0.561050 -> 0.561931 (+0.000881), wm 0.246657 -> 0.246163 (-0.000494), fridge +0.000219, house_1 0.529428 -> 0.529074, device_balanced 0.368405 -> 0.368482. seed 2026: 0.373461 -> 0.373596 (+0.000135), with mw and dw BIT-IDENTICAL to base (0.263486 / 0.424824) and the movement in kettle (+0.000632), house_1 (+0.005652) and wm (+0.000088).\n\nPOOL (5 seeds): see metrics. The change fires (it is not inert like run 104's density trim) but its effects are a near-exact cancellation: at the median seed the microwave's +0.024884 is offset by the dishwasher's -0.029602, and at seed 2026 both devices are unchanged. Every aggregate stays within ~0.001 of the committed rule, i.e. noise, and nowhere near the 0.376174 bar.\n\nFINDING (the durable part). A wm change is NOT device-local. The wm30 runs are emitted as program spans and enter the shared prog_spans / dispute / named-chain machinery that gates the microwave, dishwasher and kettle, so editing the wm's candidate generation reorders the microwave and dishwasher medians by up to 0.03 in a single draw. Consequences for the standing work: (1) any wm-only hypothesis must be judged on the device medians of the OTHER devices too, never on the wm median alone; (2) a device-local-looking gain of ~0.025 in one draw can be a pure reallocation with zero net effect, which is why the primary (a median over seeds of the mean over 66 pairs) is the only admissible arbiter; (3) the run-102 program-span rule is the coupling channel, so any future change to it must be evaluated on all five device medians.\n\nSTATUS: discard. The tree reverts to the committed b4298ca (best-known 0.366174); bar stays 0.376174. The wm over-emission (median 0.2467) remains open and is now known to be un-attackable through the heat level, the admission floors (run 104) or the mark-statistic trim.","title":"wm heat level from the wm's own mark: mw/dw trade cancels","summary":"decoupling the wm's heat from the dw mark fires broadly but nets ~0: at the median seed microwave +0.0249 is offset by dishwasher -0.0296, and at seed 2026 both are unchanged","timestamp":1790513804137,"segment":2,"confidence":3.520375302383295,"asi":{"hypothesis":"The wm's run-basis heat level should come from the wm's own mark; the cross-device min with dw_amp made the wm mine the dishwasher's weaker heater excursions.","result":"Sub-bar and net-neutral: median-seed pool mean 0.366222 vs 0.366174, with microwave +0.024884 exactly offset by dishwasher -0.029602; at seed 2026 mw and dw are bit-identical to base. Bar 0.376174 untouched.","rollback_reason":"No primary gain (|delta| < 0.001, dominated by a cross-device cancellation), so nothing is kept; the committed blunt rule stays best-known.","next_action_hint":"Treat wm changes as non-local: they reach the mw/dw/kettle gates through the shared prog_spans/dispute machinery, so score them on all five device medians and trust only the pool primary. The wm over-emission is now closed against the heat level, the admission floors and mark-statistic trims - the remaining routes are candidate generation at the 30 s dwell/merge level, or B2 synthetic supervision (device-pure admission), which is also the last route to B3's labeling closure."}}
{"run":106,"commit":"b4298ca","metric":0.366174,"metrics":{"mean_device_f1_p10":0.345739,"transfer_mean_f1":0.151921,"median_kettle_f1":0.56105,"median_microwave_f1":0.26721,"median_fridge_f1":0.387253,"median_washing_machine_f1":0.246657,"median_dishwasher_f1":0.384353,"device_balanced_mean":0.368405,"house_1_v4_mean":0.529428,"v4_n_pairs":66,"v4_n_houses":20,"fridge_median_delta":0,"primary_delta":0,"kettle_median_delta":0,"house_1_v4_mean_delta":0,"b1_events_mined":5260,"b1_enroll_top1_enc":0.84,"b1_enroll_top1_raw":0.65,"b1_cross_house_top1":0.21,"b1_gate_kettle_kept_frac":0.813,"b1_gate_mw_kept_frac":0.853,"b2_probe_mw_iso_mean":0.34,"b2_probe_iso_all_mean":0.61},"status":"discard","description":"Run 106: cap the wm's idle ceiling at the level the run was detected at.\n\nEVIDENCE (full pool profile dump, seed 2026): _wm30_profile builds 'idle_hi': 2.0 * max(idles) where idles[i] is the MEDIAN of the sub-level phase inside the i-th merged run (L722 = float(np.median(below))). Since a merged run is by construction the 30 s grid at or above heat, EVERY idle value is below heat - the ceiling can only exceed the run-detection level through the 2.0 factor, and in the dump it does: idle<=2952 W and <=2914 W in two houses, and 263 W in a house whose own heat is 161 W (0.75 x its 215 W mark amp). A ~3 kW 'quiet level' test admits anything, so a gate meant to require a genuinely quiet pump/electronics phase between heater blocks is vacuous exactly where the wm over-emits (pool wm precision 0.245; 7/15 pairs under F1 0.2).\n\nCHANGE (model.py, +6/-1): 'idle_hi': min(2.0 * max(idles...), heat) - the same anchor the runs were mined at, no new constant, vacuity-proof by construction. Gate application (L414) untouched. wm only: the dw profile has the identical line but its heat variable is not in scope there.\n\nRESULT (5 seeds, pool; keep rule = primary >= 0.376174 and p10 not dropping): primary 0.366174 (base 0.366174), p10 0.345739 (base 0.345739), device_balanced 0.368405, house_1 0.529428, kettle 0.56105, mw 0.26721, fridge 0.387253, wm 0.246657 (base 0.246657), dw 0.384353. Status discard; the tree reverts to b4298ca on discard.\n\nNON-LOCALITY (from run 105): the wm30 runs become emitted program spans feeding the shared prog_spans / dispute machinery, so this is judged on all five device medians, not the wm alone.","title":"wm idle ceiling capped at its own run-detection level","summary":"pool 0.366174 vs 0.366174, p10 0.345739; wm median 0.246657 vs 0.246657 - a 3 kW 'quiet level' gate tightened to the level the run was mined at","timestamp":1790514037046,"segment":2,"confidence":3.960876043934951,"asi":{"hypothesis":"The wm idle ceiling 2.0*max(idles) is vacuous exactly in the over-emitting houses (up to 2952 W; 263 W where heat is 161 W), so capping it at heat removes a dead precision gate without inventing a constant.","result":"pool primary 0.366174 vs 0.366174, p10 0.345739, wm 0.246657 vs 0.246657, mw 0.26721, dw 0.384353, kettle 0.56105, fridge 0.387253, house_1 0.529428.","rollback_reason":"Sub-bar on the primary and/or a p10 regression; the committed rule stays best-known.","next_action_hint":"This is the first gate audited for VACUITY by construction rather than by tuning. If it moves, apply the same audit to dens_hi = 2*max(denss) (reaches 1.29/min in the dump), span_band (built from a 2-156 min min/max) and hs_band's 1.75*max. If it does not move, the wm over-emission is not gate vacuity but candidate generation - the merged-run construction itself (heater_gap_merge up to 78 min)."}}
{"type":"config","name":"WattWiser NILM segment 3: cross-home transfer learning (experiment 06)","metricName":"mean_device_f1","metricUnit":"","bestDirection":"higher","metricLabel":"Mean device F1 (pool, 66 pairs)","objectiveLabel":"Higher is better"}
