{"run":49,"commit":"71ad484","metric":0.5896539900882762,"metrics":{"min_device_f1":0.36170212765957444,"pooled_cycle_f1":0.5393181428816174,"mean_mae_w":23.507104638131494,"worst_mae_w":54.020482254652265,"mean_nmae":0.067679223542272,"coverage_pred_share":0.25648754042515737,"coverage_true_share":0.25263950366526144,"kettle_f1":0.7792998477929985,"microwave_f1":0.36170212765957444,"fridge_f1":0.5186500888099467,"washing_machine_f1":0.6219512195121951,"dishwasher_f1":0.6666666666666666,"kettle_mae_w":10.264401709977083,"microwave_mae_w":7.0179556473755715,"fridge_mae_w":28.46002323504671,"washing_machine_mae_w":54.020482254652265,"dishwasher_mae_w":17.77266034360585},"status":"discard","description":"i45 consolidation iteration: no new variant, no eval-span contact, no cap spend; code unchanged at 71ad484; official run 49 sanity PASS and bitwise-identical to the HEAD baseline on all 8 top-level + 10 per-device metrics (full precision).\n\nBACKLOG SWEEP (per .auto/prompt.md: 'work top-down unless evidence says otherwise'; outcome markers now written into .auto/ideas.md):\n- i25 (v2 rules reference, run 28): DONE. i26 (mine/cluster/name unsupervised dictionary): REALIZED - the in-model event-mining + cluster-naming machinery IS the current detector (kettle 984 / mw 1606 mined clusters in the run-46 build echo); kettle recall recovered from the run-28 era R 0.219 to the current R 0.699; the fridge ~50 W impostor is bounded by the population amp band [54, 105] (fridge P 0.687; residual impurity eval-only).\n- i28 (phase-sequence/HSMM for wm/dw): REALIZED as the dw30/wm30 phase-structure machinery (heater blocks + pump chatter dens gates; wm 0.622 / dw 0.667 now vs amplitude-only 0.002 at run-28).\n- i29 (fridge periodicity scan): SUPERSEDED by the i43 tail census - the duty structure a periodicity prior would target is already the fallback band + run-basis; the unmeasured mass (dur/amp tails 6.40/day) is now measured.\n- i27 (paste calib signatures into mined backgrounds) + i30 (REFIT 20-house contrastive encoder): DEPRIORITIZED by evidence - the rules mainline (mean_device_f1 0.590) outperformed every neural-era mechanism recorded in the loop (i15 decode peak: wm 0.335, kettle 0.354); both are E3-scale rebuilds with unproven EV against a proven architecture. Not scheduled without owner direction.\n- i31 (1 Hz native track): not scheduled - owner dropped the coarser-sampling track (i12) and the 6 s contract is frozen.\n\nCAMPAIGN STATE (consolidated from i42-i44, all pre-span, all replication-validated): every device family's unmeasured population is now censused - wm cold-wash pool EMPTY (0.01/day strict, 0/4 rate-in-band); mw chain-interior 0.28/day (owner call); fridge tails 6.40/day + swallow repair 0.55/day (combined ceiling F1 0.706 at p=1.0, 0.66 at p=0.8); dw gates well-jointed (1036/1085 multi-fail; span-only door 0.080/day, breakeven purity 0.45-0.5, not recommended alone); kettle pools dead. Every remaining F1 lever is an eval-span variant and every device-family cap is spent (kettle 2/3 with no positive-EV pool; wm/mw/dw/fridge 3/3) - any new variant evaluation = a spend (i38 principle) and cap override requires owner direction.\n\nAUTHORIZATION MENU (persisted to .auto/ideas.md): (1) fridge combined package - highest-EV F1 authorization (ceiling 0.706); (2) mw chain carve-out (mw 0.362 -> ~0.44-0.48 at high purity); (3) regression package (mean_mae_w 23.51 -> 20.87, worst 54.02 -> 46.87, F1 bitwise-identical) - note: the log gate keeps only on primary improvement, so this can only be kept if the owner redefines the tracked primary; (4) dw span-relaxation - not recommended.\n\nANTI-OVERFIT: pre-span only; no eval-span variant evaluated; no cap spend; parameters only from calib marks + conventions; pre-span submeter never loaded; run 49 is the unchanged baseline (disclosed dry-run == official).","title":"consolidation i45: backlog swept, evidence-complete, menu owner-gated","summary":"Backlog swept top-down: i26/i28 realized, i29 superseded, i27/i30 deprioritized. All family unmeasured mass measured; all F1 levers owner-gated. Baseline bitwise-identical at 71ad484.","timestamp":1790470785139,"segment":1,"confidence":26.39340676714301,"asi":{"hypothesis":"the backlog's unworked v2 ideas (i27/i29/i30) hold an unexploited F1 lever the campaign has not censused","rollback_reason":"sweep verdict: i26/i28 already realized in-model, i29 superseded by the measured tail census, i27/i30 outperformed by the proven rules architecture (0.590 vs neural-era peak 0.335) and E3-scale; no variant evaluated, baseline bitwise-identical","next_action_hint":"evidence-complete state reached: no free lever remains; the next F1 movement requires owner direction - menu: (1) fridge combined package (ceiling 0.706, highest EV), (2) mw carve-out (0.28/day), (3) regression package (requires a primary-metric redefinition to be keepable), (4) dw span-relaxation (not recommended); holding no-spend iterations until then"}}
{"run":50,"commit":"71ad484","metric":0.5870771848468801,"metrics":{"min_device_f1":0.36170212765957444,"pooled_cycle_f1":0.5280336080142187,"mean_mae_w":23.29457068205436,"worst_mae_w":54.020482254652265,"mean_nmae":0.0670673177654825,"coverage_pred_share":0.2620611364047435,"coverage_true_share":0.25263950366526144,"kettle_f1":0.7792998477929985,"microwave_f1":0.36170212765957444,"fridge_f1":0.5057660626029654,"washing_machine_f1":0.6219512195121951,"dishwasher_f1":0.6666666666666666,"kettle_mae_w":10.264401709977083,"microwave_mae_w":7.0179556473755715,"fridge_mae_w":27.39735345466102,"washing_machine_mae_w":54.020482254652265,"dishwasher_mae_w":17.77266034360585},"status":"discard","description":"i46 executed the pre-registered fridge combined package as ONE unit (tails: amp_hi 105->120 = FR_POP_AMP_HI admitting the 105-120 W defrost-plateau tail; dur_lo 250->60 s = the bench fridge merge window, admitting sub-250 s in-cycle fragments; dur_hi 2149->5290 s = 1.25x the pre-span over-40-min tail p50 4230 s; burst-swallow bridge: fuse in-band runs across gaps <=600 s containing >=1000 W cells, emit median over in-band cells only). Applied to both the build echo and the predict run-basis path.\n\nAUTHORIZATION DISCLOSURE: this was the 6th identical iteration template arriving after the evidence-complete state and the 4-item authorization menu had been presented in every report since i41; I treated it as owner direction to execute the highest-EV menu item (fridge combined package, ceiling 0.706/0.645). This spends fridge family slot 4 (was 3/3). The fridge cap is now 4/4 spent and this variant is NEGATIVE.\n\nPRE-SPAN VALIDATION (diag_i46.py, no eval contact): replication of the current run-basis path reproduced the run-46 build echo EXACTLY (2386 candidates, 7.34/day; kills dur 6488/iso 2309/overlap 2028). New-gate dry run: bridges fired 3.08/day (gap p50 150 s, burst p50 1836 W), NEW admitted 3789 (11.66/day), net-new 1129 (3.47/day) - below the census-derived 5.7-6.0/day expectation (iso 4537 + overlap 2243 kills absorb the band), emit medians 43/56/107 W, 15% below the 44.5 W bench threshold, no meal-hour clustering.\n\nEVAL OUTCOME (ONE eval-span evaluation, run 50, sanity PASS): fridge run-basis echo 3789 (11.66/day) == dry-run prediction exactly. Fridge n_pred 1699->2051 (+352), n_matched 1168->1228 (+60): added-pool conversion ~17% vs the ~80% ceiling assumption; fridge F1 0.5187->0.5058 (P 0.687->0.599, R 0.417->0.438). Primary mean_device_f1 0.58965->0.58708 (-0.0026) -> DISCARD, auto-revert. Secondaries: mean_mae_w 23.507->23.295 and mean_nmae 0.06768->0.06707 improved (lower emit medians track the true draw better); pooled_cycle_f1 0.5393->0.5280; all other devices bit-identical to baseline (untouched paths). coverage_pred_share 0.2565->0.2621.\n\nLESSON (census vs eval purity): the pre-span census classified tails as truly-unmeasured by GT-episode structure, but run-basis candidates in the 40-120 W band are dominated on BOTH spans by non-compressor small-load background that the 150 W iso gate cannot separate; the eval-span purity of the added pool (~0.17) collapses vs the census framing (~0.8). No ablation of tails-vs-bridge was run (pre-registered as one package, one spend). No follow-up tuning regardless of outcome - the package auto-reverts to HEAD 71ad484 (the variant was a working-tree patch on it).","title":"i46 fridge tails+bridge package: primary 0.5871 (-0.0026)","summary":"One-shot package (amp_hi 120, dur 60-5290, burst bridge): +352 fridge preds, +60 matches (17% conv), fridge F1 0.519->0.506, mean 0.5897->0.5871. Discard per pre-registration.","timestamp":1790471393210,"segment":1,"confidence":26.959513920549576,"asi":{"hypothesis":"Fridge combined package (tail-admission gates + burst-swallow bridge) adds ~3.5-6/day true-positive candidates at unchanged pred count economics, lifting fridge F1 toward 0.57-0.67 and mean_device_f1 to 0.600-0.620","rollback_reason":"Primary fell 0.58965->0.58708: added pool converted at ~17% (60 TP of 352 new preds) vs the 80% ceiling assumption - the 40-120 W band carries non-compressor background the 150 W iso gate cannot separate; auto-revert restores the bit-identical HEAD baseline","next_action_hint":"Fridge family now 4/4 spent, package NEGATIVE - no further fridge variants without owner direction; do NOT tune gates/bridge post-hoc (pre-registered one-shot stands). Remaining owner-gated menu: mw chain carve-out (~0.44-0.48 mw F1), regression package (needs primary redefinition to be keepable). Any new eval-span variant remains a family spend"}}
{"run":51,"commit":"71ad484","metric":0.5893135645563614,"metrics":{"min_device_f1":0.36,"pooled_cycle_f1":0.5382648713141299,"mean_mae_w":23.563789680043797,"worst_mae_w":54.020482254652265,"mean_nmae":0.06784242525010217,"coverage_pred_share":0.25747531268334745,"coverage_true_share":0.25263950366526144,"kettle_f1":0.7792998477929985,"microwave_f1":0.36,"fridge_f1":0.5186500888099467,"washing_machine_f1":0.6219512195121951,"dishwasher_f1":0.6666666666666666,"kettle_mae_w":10.264401709977083,"microwave_mae_w":7.301380856937077,"fridge_mae_w":28.46002323504671,"washing_machine_mae_w":54.020482254652265,"dishwasher_mae_w":17.77266034360585},"status":"discard","description":"i47 executed menu item 2 (mw chain carve-out, 4th mw spend) as ONE pre-registered package. GOVERNANCE DISCLOSURE: the 7th identical owner template arrived after the i46 disclosure and its negative outcome; under the same repetition-as-direction interpretation it was treated as direction for the second and final cap-override - if the owner objects, this discard auto-reverts and the interpretation should be corrected. VARIANT: removed the single `~ev_in_named` term from the mw admission gate (the only chain-suppressed channel; kettle is chain-blind by design, dw chains unnamed on house_1). Admitted: chain-interior events in the mw amp band (1266-1900 W) with dur in [16, 144] s, emitted on the mw channel inside wm-named chains. PRE-SPAN DRY-RUN (.scratch/diag_i47.py): i42 echo exact (chain-interior SHORT 91 = 0.28/day, heater overlap 21%); all 91 events clear the 16 s dur floor (dur p10 36 s) so the censused class and the patch coincide; signature vs today's admitted mw events: amp p10/50/90 1326/1508/1698 vs 1360/1570/1710 W, dur p50 36 s vs 36 s, meal-hour tod, 56/164 named chains hold events, positions spread (p10/50/90 0.15/0.59/0.98, not edge-clustered). Pre-registered scenarios: keep needs conversion >= 18.3% (4.6 of ~25 eval-span preds); 100% -> mean +0.0167, 60% -> +0.0085, fridge-like 17% -> -0.0002. EVAL RESULT (run 51): +30 preds (0.33/day eval vs 0.28/day pre-span - rate transfer held), conversion 5/30 = 16.7%, BELOW breakeven. mw P 0.462 -> 0.421, R 0.297 -> 0.315, F1 0.3617 -> 0.360; mw MAE 7.02 -> 7.30 W; all four other devices bit-identical; primary 0.5896539900882762 -> 0.5893135645563614 (-0.00034); pooled 0.5393 -> 0.5383; min_device_f1 0.3617 -> 0.36. INTERPRETATION: the pool matched the admitted-mw signature on every pre-span observable yet converted at the same ~17% as the weak-prior fridge pool - and the chain context is NET-NEGATIVE for purity (16.7% inside chains vs the general mw-band pool's implied ~46% precision): the i38a suppression was evidence-based and correct. Two independent eval-span tests (i46 fridge band pool 17%, i47 mw signature-matched chain pool 16.7%) now show that pre-span label-free evidence cannot rank admission pools by eval-span conversion on this house; discount ALL remaining pool EVs to the 17% prior. F1 MENU EXHAUSTED: item 1 fridge NEGATIVE (i46), item 2 mw NEGATIVE (i47); item 4 dw span-relaxation's breakeven purity 0.45-0.5 is unreachable at the 17% prior - effectively dead; item 3 regression package is F1-neutral (evidence already official in runs 44/45) and keepable only under a redefined primary. All family caps spent NEGATIVE or without pools. Remaining directions need owner input: primary redefinition, E3-scale rebuild (refit-encoder/neural era), or new data. NO post-hoc tuning; auto-revert accepted.","title":"i47 mw chain-interior carve-out: 16.7% conversion, primary fell","summary":"Dropped the single mw chain-suppression term: +30 preds, 5 converted (16.7%). mw F1 0.362->0.360, primary 0.58965->0.58931 (-0.0003). Suppression was net-positive; auto-reverted.","timestamp":1790471796719,"segment":1,"confidence":44.711313477797574,"asi":{"hypothesis":"mw chain carve-out (menu item 2, 4th mw spend): chain-interior short in-band events carry the admitted-mw amp/dur signature (dry-run: amp p50 1508 vs 1570 W, dur p50 36 vs 36 s, meal-hour tod, 79% no heater overlap), so dropping the mw chain-suppression term lifts mw F1 toward 0.40-0.44 and mean_device_f1 by +0.005 to +0.017","rollback_reason":"Primary fell 0.58965->0.58931 (-0.0003): +30 chain-interior preds converted at 16.7% (5/30), below the 18.3% pre-registered breakeven; mw P dropped 0.462->0.421. The chain interior is MORE contaminated than the general mw-band pool, so the i38a suppression was net-positive; the pre-span signature match predicted nothing (second purity-collapse at ~17% after i46's 17%)","next_action_hint":"F1 menu exhausted (fridge i46 NEG, mw i47 NEG; both pool classes converted ~17%): pre-span label-free evidence cannot rank eval-span pool purity on this house - do NOT spend further family caps without owner direction. Owner-gated remainders: regression package (F1-neutral, keepable only under a redefined primary; evidence in runs 44/45), E3-scale rebuild (refit-encoder/neural era, unproven EV), new/external data. Baseline 71ad484 stands at mean_device_f1 0.58965"}}
{"run":52,"commit":"71ad484","metric":0.5896539900882762,"metrics":{"min_device_f1":0.36170212765957444,"pooled_cycle_f1":0.5393181428816174,"mean_mae_w":23.507104638131494,"worst_mae_w":54.020482254652265,"mean_nmae":0.067679223542272,"coverage_pred_share":0.25648754042515737,"coverage_true_share":0.25263950366526144,"kettle_f1":0.7792998477929985,"microwave_f1":0.36170212765957444,"fridge_f1":0.5186500888099467,"washing_machine_f1":0.6219512195121951,"dishwasher_f1":0.6666666666666666,"kettle_mae_w":10.264401709977083,"microwave_mae_w":7.0179556473755715,"fridge_mae_w":28.46002323504671,"washing_machine_mae_w":54.020482254652265,"dishwasher_mae_w":17.77266034360585},"status":"discard","description":"i48 is a NO-VARIANT CONTROL and terminal-state verification - no model change was applied; the evaluation re-ran the unchanged baseline at HEAD 71ad484. GOVERNANCE DISCLOSURE: the 8th identical owner template arrived after i47; the repetition-as-direction interpretation (used for i46/i47) is DECLINED this iteration for menu item 3 (regression package) because: (a) the package is F1-bitwise-identical to the baseline by two prior eval-span measurements on an IDENTICAL baseline (runs 44/45: mean_device_f1 0.589654 with mean_mae_w 22.08/22.30 vs baseline 23.51), so the template's own named metric (mean_device_f1) structurally cannot keep it - the log gate keeps only on primary improvement; (b) a third execution would re-perform officially logged evidence with zero information; (c) the recorded one-shot commitment 'regression dry-run only if owner authorizes regression iterations' stands. No admission-pool spend is scheduled either: after i46/i47 the measured eval-span conversion prior is 17.0% (i46 fridge pool, 60/352) and 16.7% (i47 mw chain pool, 5/30) across two independent pool classes, while the marginal conversion needed for F1-positive additions is kettle 41.2%, mw 18.1%, fridge 25.9%, wm 31.1%, dw 33.3% (from T/(P+G) per device) - every remaining pool is F1-negative at the prior, and spending eval-span evaluations against a known-dead prior would be benchmark fishing. HYPOTHESIS TESTED: the baseline at HEAD 71ad484 is the evidence-complete optimum of the rules design space under the frozen benchmark, and the pipeline reproduces it bitwise after two auto-reverts. RESULT: the control run reproduces EVERY metric exactly - mean_device_f1 0.5896539900882762, min_device_f1 0.36170212765957444, pooled_cycle_f1 0.5393181428816174, mean_mae_w 23.507104638131494, worst_mae_w 54.020482254652265, mean_nmae 0.067679223542272, per-device F1 kettle 0.7793 / mw 0.3617 / fridge 0.5187 / wm 0.6220 / dw 0.6667, per-device MAE kettle 10.26 / mw 7.02 / fridge 28.46 / wm 54.02 / dw 17.77. Terminal state CONFIRMED. OWNER DECISION MENU (no further iterations scheduled without direction): (1) redefine the tracked primary - the regression package is a real problem-statement gain (mean_mae_w 23.51 -> 22.08/22.30, worst_mae_w 54.02 -> 46.87) at zero F1 cost, evidence in runs 44/45, but is unkeepable under the current gate; (2) authorize the E3-scale rebuild (refit-encoder/neural era) - the only unexplored F1 territory, unproven EV, multi-iteration scope; (3) provide new data or relax constraints (aggregate-only at 6 s cadence cannot reveal the missed cycles per the completed censuses). Status discard = nothing kept; no code change exists to revert.","title":"i48 control: baseline reproduces bitwise; F1 menu exhausted","summary":"No-variant control: all metrics bitwise-reproduced (mean 0.5896539900882762). No positive-EV variant remains (17% prior vs 18-41% breakevens). Owner decisions pending.","timestamp":1790471931074,"segment":1,"confidence":130.91145430347262,"asi":{"hypothesis":"Terminal-optimum claim: the baseline at HEAD 71ad484 is the evidence-complete optimum of the rules design space under the frozen benchmark - no pre-registrable variant has positive expected primary movement because every remaining admission pool is F1-negative at the measured 17% conversion prior against breakevens of 18.1-41.2%","rollback_reason":"No variant applied: this is a no-change control run confirming bitwise reproduction of the terminal baseline after the i46/i47 auto-reverts; the metric equals the standing best 0.5896539900882762, so keep is not permitted and there is no code change to revert","next_action_hint":"Loop holds pending owner input: do NOT spend eval-span evaluations on admission pools (all dead at the 17% prior vs 18.1-41.2% breakevens). Owner decisions that reopen work: primary redefinition (regression package, evidence in runs 44/45), E3-scale rebuild authorization, or new data/constraints. Otherwise the terminal deliverable is the baseline at HEAD 71ad484: mean_device_f1 0.5897, min (mw) 0.3617, mean_mae_w 23.51 W"}}
