{"run":63,"commit":"5857708","metric":0.421473,"metrics":{"mean_device_f1_p10":0.365932,"transfer_mean_f1":0.14619,"median_kettle_f1":0.652755,"median_microwave_f1":0.314592,"median_fridge_f1":0.514299,"median_washing_machine_f1":0.343919,"median_dishwasher_f1":0.3418,"b1_events_mined":5260,"b1_enroll_top1_enc":0.84,"b1_enroll_top1_raw":0.65,"b1_cross_house_top1":0},"status":"discard","description":"B1 MILESTONE m1+m2 (pre-registered .auto/ideas.md). Primary unchanged by design - model.py untouched; this run builds and gates the B1 components. Status discard = not an improvement to keep; all assets live in .auto/ which the loop preserves.\\n\\nPool integrity fixes (declared before any bet touched ctx['pretrain'], bench header documents both): dropped the 8 greend buildings (submeter channels but NO mains.parquet - no aggregate to mine, loader would crash) and eco/house_04 (mains.parquet has 0 rows). Usable pool 29 houses: kettle 17 / fridge 27 / microwave 18 / dishwasher 18 / washing_machine 22 coverage.\\n\\nm1 miner (.auto/b1_events.py, cached .auto/cache/b1_events_v1.npz): per-device union mask over sane mapped channels (thr <= 0.5*p50_on_W), cycles per bench_v2 rules, aggregate window [on-60s, off+60s] baseline-subtracted, resampled to 128 samples, capped 200/house/device (seeded). 5260 events: fridge 1800, wm 1165, dw 821, microwave 800, kettle 674. Signature stats: kettle peak p10/p50/p90 1865/2454/4070 W dur p50 138 s; wm 2491 W peak, 3912 s; fridge aggregate deltas range 1.4 W (tiny fridge in noisy house) to 1718 W (coincident appliances) - contamination the matcher must tolerate.\\n\\nm2 encoder (.auto/b1_encoder.py): fixed 72-d features (64-sample normalized shape + 8 stats) -> linear 64-d projection, InfoNCE (positives same-device-different-house, negatives other devices, same-house pairs neutral), Adam 300 epochs, seed 0. Validation: 5 held-out houses (ukdale/house_3, refit/house_6/7, eco/house_01, redd/building_3).\\n\\nGATE RESULT (top-1 device retrieval):\\n- enroll geometry (gallery = K=5 same-house marks, the m3 deployment shape): raw .650 -> encoder .840 (kettle .940, fridge .880, dishwasher .780, washing_machine .760, microwave nan - no sane mw channel in val houses). ENCODER PASSES.\\n- cross-house invariance (gallery = other held-out houses): 0.000 encoder AND raw - FAILS; aggregate composition (baseline shifts, coincident loads, amplitude spread 1.4 W-1.7 kW fridge) dominates same-device structure across houses. Recorded as B1's open sub-goal; next levers: per-window z-normalization, amplitude-invariant correlation distance, duration-normalized shape matching.\\n\\nDecision: m3 (enrollment swap into the model for burst devices using the enroll geometry) is justified by the .840 gate; cross-house matching continues as a separate lever after m3. Bench contact run reproduced the floor exactly (median .421473, p10 .365932, transfer .14619) - bench untouched by B1 so far. Secondary metrics identical to run 62 (model.py untouched); b1_* tradeoff monitors added with force (proven valuable across B1's runs).","title":"B1 m1+m2: pool fix, event miner, contrastive encoder gate","summary":"Mined 5260 events/29 houses; enroll matching raw .650->enc .840 (kettle .94); cross-house invariance 0.000 - open. Model unchanged: 0.4215","timestamp":1790483707682,"segment":2,"confidence":null,"asi":{"hypothesis":"B1: aggregate event signatures can match calib marks to eval events by embedding nearest-example; encoder adds +0.19 over raw features in the enroll geometry","rollback_reason":"n/a - milestone, not a failed bet; assets in .auto/ preserved","next_action_hint":"B1 m3: wire enroll-mode nearest-example matching for burst devices (kettle, microwave) into model.py; bench will then measure it"}}
{"run":64,"commit":"5857708","metric":0.365149,"metrics":{"mean_device_f1_p10":0.318216,"transfer_mean_f1":0.126616,"median_kettle_f1":0.598553,"median_microwave_f1":0.241815,"median_fridge_f1":0.514299,"median_washing_machine_f1":0.343919,"median_dishwasher_f1":0.3418,"b1_events_mined":5260,"b1_enroll_top1_enc":0.84,"b1_enroll_top1_raw":0.65,"b1_cross_house_top1":0,"b1_gate_kettle_kept_frac":0.5,"b1_gate_mw_kept_frac":0.4},"status":"discard","description":"B1 m3 run 1 (of the 5-15 bet budget; one bad run is not a refutation). Wired the m2 encoder as an enroll-mode nearest-example gate into model.py (diff preserved at .auto/runs/b1_m3_model.diff since discard reverts src/): (1) kettle events, (2) microwave events, (3) kettle sustained runs. Candidate windows [on-60s, off+60s] baseline-subtracted (first ~8 samples), resampled 128, embedded with the frozen ctx-pretrain-pool encoder; galleries = the 5 embedded calib mark segments per device; admission needs own-gallery cosine >= 0.15 AND margin >= 0.05 over every other device's gallery. Constants fixed a priori from m2 top-1 behavior, NOT tuned on eval.\\n\\nRESULT (full v3, 76 s warm): median 0.365149 vs floor 0.421473 (-0.0563) - keep rule fails. p10 0.318216 (-0.0477). Device medians: kettle 0.598553 (-0.0542), microwave 0.241815 (-0.0728), fridge 0.514299 / wm 0.343919 / dw 0.341800 - EXACTLY the floor values. transfer_mean 0.126616 (-0.0196); all 15 non-gated transfer pairs bitwise-equal to the frozen floor values (bench integrity check passes).\\n\\nGate kill rates (first-span prints per seed): kettle events 26/206 to 193/225 kept (15-88% killed), microwave events 32/336 to 181/325 kept (40-90% killed), kettle runs 0-122/0-158 kept. Seed-2026 mean 0.5288 vs 0.5897 floor. Worst transfer pair: ukdale/house_2 microwave 0.0863 vs 0.3757 (-0.289); gains: refit/house_9 kettle +0.037.\\n\\nDIAGNOSIS: the gate is conceptually sound (untouched devices pass through unchanged) but the admission thresholds are miscalibrated for a distribution shift the m2 gate never tested: m2 validated on miner windows (union-mask cycle edges) while predict candidates are extractor-shaped (level-excursion event edges: fragments, mid-draw level breaks, baseline slop, coincident-load contamination). Also the margin competes a noisy eval window against 20 other-device marks including 3 h passive windows.\\n\\nNEXT (m3b, no eval tuning): calibrate gate constants on calib-only data - distribution of mark self-cosines vs pre-span extractor-shaped kettle/mw-band candidates' cosines (pseudo-positives, no labels needed); consider amplitude-invariant correlation distance on the 64-shape vector (drop the dur/peak features' influence) as an alternative gate score. Re-wire from the saved diff with recalibrated constants.","title":"B1 m3 run1: enroll gate kills true draws, primary -0.056","summary":"Embed gate wired at 3 sites kills 15-88% kettle/40-90% mw admissions; median 0.3651 (-0.056), transfer -0.019, guardrails untouched. Discard; calib-only recalibration next","timestamp":1790484102803,"segment":2,"confidence":null,"asi":{"hypothesis":"B1 m3: embedding confirmation gate on burst events improves precision enough to lift F1; run 1 says the gate as thresholded kills more true than false draws","rollback_reason":"primary -0.056 (keep rule fails); discard auto-reverts model.py to HEAD; wiring saved at .auto/runs/b1_m3_model.diff for m3b","next_action_hint":"m3b: calibrate ENROLL_MIN_COS/ENROLL_MARGIN (or switch to correlation distance) on calib-only distributions; never on eval"}}
{"run":65,"commit":"5857708","metric":0.416029,"metrics":{"mean_device_f1_p10":0.354172,"transfer_mean_f1":0.148407,"median_kettle_f1":0.622603,"median_microwave_f1":0.313397,"median_fridge_f1":0.514299,"median_washing_machine_f1":0.343919,"median_dishwasher_f1":0.3418,"b1_events_mined":5260,"b1_enroll_top1_enc":0.84,"b1_enroll_top1_raw":0.65,"b1_cross_house_top1":0,"b1_gate_kettle_kept_frac":0.813,"b1_gate_mw_kept_frac":0.853},"status":"discard","description":"B1 m3b (run 65, discard). REDESIGN of run 64's fixed-constants gate: admission thresholds calibrated PER BUILD on calib-only data - pseudo-positives = pre-span events inside the device's own amp/dur bands (extractor-shaped, carrying the window-convention shift run 1 exposed); t_min = max(0.05, p25(own)-0.05); margin test DROPPED after calibration showed pseudo-positive own-minus-cross margins at ~0 or negative at p10 (kettle-vs-microwave confusion: flat high draws are indistinguishable in-house - the margin criterion was run 1's true killer, killing 15-88%); duty/passive windows excluded from galleries. No eval data touches calibration (rng(0), subsample 400).\n\nRESULTS vs floor (run 62, median 0.421473 / p10 0.365932 / kettle 0.652755 / mw 0.314592 / transfer 0.146190):\n- house_1 v3 median 0.416029 (-0.0054) - keep rule needs +0.01: FAIL.\n- p10 0.354172 (-0.0118): FAIL.\n- kettle median 0.622603 (-0.0302): device guardrail FAIL. Gate keeps ~81% of kettle-band admissions (per-seed 0.77-0.87); the killed ~19% are mostly true draws scoring below the pseudo-positive p25 - fragmentation/coincidence windows the bands admit but the embedding scores low.\n- microwave median 0.313397 (-0.001, ~floor) despite killing 6-40% of mw admissions per seed - those kills were ~half false (precision gain offsetting recall loss).\n- fridge/wm/dw medians bitwise = floor (no code path touches them).\n- Transfer mean 0.148407 (+0.0022, flat). Movers: refit/house_9/kettle +0.0684, refit/house_3/kettle +0.0558, refit/house_2/kettle +0.0127 (real kettle gains from house_1 galleries); refit/house_5/kettle -0.0262, refit/house_2/mw -0.0278, ukdale/house_2 kettle/mw ~-0.011. 20 of 31 pairs bitwise floor.\n\nVERDICT: the enroll-mode nearest-example confirmation gate on top of amp/dur bands is refuted at 2 implementations (run 64 fixed constants; run 65 calibrated min-cos). The bands already capture the discriminative signal the 64-d embedding offers in-house; residual embedding signal (fine shape) does not separate true from false within-band candidates. B1 m3 gate sub-track CLOSED (2 of 5-15 budget used). B1 continues only via the cross-house retrieval sub-goal (m2: 0.000 top-1 - needs invariance levers). Next iteration: B2 m1 (mark-signature library) - program devices (wm/dw medians 0.34) are the weak flank and the gate evidence says bands+shape rules saturate there; synthetic supervision targets exactly that gap.\n\nIntegrity: no eval data in calibration; diffs saved (.auto/runs/b1_m3b_model.diff, 233 lines); full log .auto/runs/65.log.","title":"B1 m3b: calibrated min-cos gate still at floor","summary":"median 0.416029 (-0.0054 vs floor), p10 -0.0118, kettle -0.0302; transfer 0.148407 (+0.002, flat). Enroll-gate idea refuted at 2nd implementation; 2/5-15 runs used.","timestamp":1790484601983,"segment":2,"confidence":null}
{"run":66,"commit":"5318070","metric":0.459345,"metrics":{"mean_device_f1_p10":0.389235,"transfer_mean_f1":0.168197,"median_kettle_f1":0.766469,"median_microwave_f1":0.354041,"median_fridge_f1":0.512856,"median_washing_machine_f1":0.354683,"median_dishwasher_f1":0.458065,"b1_events_mined":5260,"b1_enroll_top1_enc":0.84,"b1_enroll_top1_raw":0.65,"b1_cross_house_top1":0,"b1_gate_kettle_kept_frac":0.813,"b1_gate_mw_kept_frac":0.853,"b2_probe_mw_iso_mean":0.3,"b2_probe_iso_all_mean":0.598},"status":"keep","description":"B2 m1+m2 probe verdict (run 66, keep). ROOT CAUSE (from the B2 synthetic probe, not the bench): _extract_events measured the fall magnitude and the post-fall level AT THE FALL-RUN START. A plateau drifting down by more than AMP_MIN_W (50 W) across the 6-sample step window turns stp negative BEFORE the cliff, creating a premature fall run: the run-start step is tiny (-81 W vs required >=590 W) and the level at start+STEP_H is still on the plateau - both checks fail and the event is dropped ENTIRELY. Seed-2026 microwave mark sig-0 (plateau 1708->1631) extracted nothing on every paste; real duty-cycled microwave draws (magnetron duty drift) hit the same pathology, so this was a live miss mechanism on the real eval too. Intermediate version of the fix (f_end = next run start - 1) was itself wrong for runs with gaps (overshoot to future falls, mag=-54 rejections) - caught on the probe, replaced by true contiguous-run ends via np.diff on is_fall positions; magnitude = level drop across the run, post-fall level sampled after the run's end. Clean single-sample runs produce bitwise-identical values to the old code.\n\nPROBE (m1+m2 diagnostic: calib mark signatures pasted into quiet pre-span house_1 backgrounds, 3 frozen seeds; eval-free by construction; THR used only for scoring): after the fix iso F1 = kettle 0.60-0.74, microwave 0.22-0.35, wm 0.52-0.88, dw 0.61-0.79 (mw was 0.06-0.35 pre-fix with the merged-event bug, 0.21-0.35 before that); mw event-band switch active on seeds 2026+1 (mark draw fragments in extractor: event p50 1420W/36s vs core 1486W/114s). Residual mw gap dominated by +/-3-sample smoothing-lag edge effects on 6-9-sample truth spans - a paste-engine artifact; bench GT spans are 20-30 samples so the probe understates real mw recall. Cross-fire observed: kettle event band admits mw chunks (0.31 on mw spans, seed 2), wm sustained path claims dw pastes (0.60, seed 1) - parked, no fix attempted this run.\n\nBENCH (all 10 frozen seeds, v3 protocol unchanged): median 0.421473 -> 0.459345 (+0.0379); p10 0.365932 -> 0.389235 (+0.0233); transfer_mean_f1 0.146190 -> 0.168197 (+0.0220). Device medians: kettle 0.652755 -> 0.766469 (+0.1137), microwave 0.314592 -> 0.354041 (+0.0394), fridge 0.514299 -> 0.512856 (-0.0014), washing_machine 0.343919 -> 0.354683 (+0.0108), dishwasher 0.341800 -> 0.458065 (+0.1163). Keep rule: median +0.01 PASS, p10 not down PASS, no device median drop >0.03 PASS. Largest single-run gain of the campaign; dw and kettle medians jumped most - consistent with the extractor fix unlocking fragmented/sloped draws for exactly the duty-cycled devices. Owner targets (house_1 median >= 0.70, transfer >= 0.50) remain distant; transfer dw ~0.02-0.21 and wm 0.00-0.15 still the weak flank.\n\nAlso in the tree (all derived from marks + synthetic evidence): event-band gates for the fragmentation-switch devices (mw/kettle bands from mark-extracted events: amp [0.8x min, 1.25x max], dur [1/3x min, 3x max] with min dur 12 s, events >= 0.3x segment p90); dw30 amp_lo 0.8x min(p90s) (wm30 parity; probe R 0.40 -> 0.80). b1_* metrics carried forward unchanged from run 65 (B1 closed; current build prints 12128 raw mined level-excursion events - different definition, not substituted).\n\nIntegrity: no eval data touched any rule; bench.py FROZEN and unchanged; probe evidence = calibration marks + pre-span quiet windows only; run log .auto/runs/66.log; diff visible in git history once the keep commit lands.","title":"B2 probe: extractor fall-run fix - biggest jump of campaign","summary":"median 0.459345 (+0.0379 vs floor), p10 +0.0233, transfer 0.168197 (+0.0220); kettle +0.114, dw +0.116, mw +0.039, fridge -0.001, wm +0.011. Keep rule 3/3.","timestamp":1790486118772,"segment":2,"confidence":6.9566495224099905,"asi":{"hypothesis":"B2 m1+m2: mark-paste diagnostic probe - the low mw/dw/kettle medians are partly an extractor defect (fall pairing measured at run start drops sloped-plateau events entirely), not a gate defect","root_cause":"fall-run magnitude + post-fall level sampled at run start; drifting plateaus (>50 W over 6 samples) create premature fall runs that fail both checks","fix":"split fall runs via np.diff; magnitude = level drop across run; post-fall level after run end; single-sample runs bitwise identical","next_action_hint":"B2 m3/m4: train-on-synthetic pipeline (paste marks into pre-span backgrounds as extra training supervision) then v3 eval; parked cross-fires (kettle-band-admits-mw-chunks, wm-claims-dw) and B1 cross-house retrieval sub-goal remain open"}}
{"run":67,"commit":"5318070","metric":0.467156,"metrics":{"mean_device_f1_p10":0.389495,"transfer_mean_f1":0.167804,"median_kettle_f1":0.766469,"median_microwave_f1":0.381962,"median_fridge_f1":0.512856,"median_washing_machine_f1":0.354683,"median_dishwasher_f1":0.458065,"b1_events_mined":5260,"b1_enroll_top1_enc":0.84,"b1_enroll_top1_raw":0.65,"b1_cross_house_top1":0,"b1_gate_kettle_kept_frac":0.813,"b1_gate_mw_kept_frac":0.853,"b2_probe_mw_iso_mean":0.347,"b2_probe_iso_all_mean":0.61},"status":"discard","description":"B2 m3 gate-fix bundle, all derived from calibration marks only (eval-free): (1) mw-side-only z-sum dispute - kettle keeps every event its gate admits (emission pre-dispute, bit-identical); the dispute suppresses the mw only when ket_z <= mw_z, z = |amp-anchor|/amp_hw + |dur-anchor|/dur_hw, anchors/hw from new _gate_anchor_hw (event-band p50s when switched, core stats x REL_AMP/REL_DUR otherwise). Rationale: bench dispute zone [1901, 2220] contains only kettle draws (real mw chunks <=1783), so mw suppression there is pure mw precision. Fixes seed-1 mix_burst mw cross-fire (kettle chunks admitted by the mw event band); case-verified: (2106,54) -> kettle z 0.44 vs mw 0.95 suppressed; (1888,108) mw chunk -> mw z 0.93 vs ket 1.01 -> mw suppressed, kettle keeps. (2) Merged-event dur ceiling in _burst_event_bands: dur_hi = 3 x max(dur_p50, max(durs)/2). Attribution: seed-2 kettle cross-fire = the merged mw paste event (2032 W, 294 s) admitted by the kettle event band [1753,2980] x [12,396] (3 x max(durs) = 396) while the mw core rejects it (2032 > 1910) -> kettle claims 0.865 of the mw span. The event is flat (p10/p90 0.89) but seed-2 kettle mark events are dip-y (flats 0.11-0.24) -> flatness discriminator dead; the event is genuinely ambiguous on (amp, dur) and only a dur ceiling separates it (a merged multi-chunk paste is foreign structure, not a longer draw; 3 x p50 alone risks the 2026-mw extraction variance, p50 36/max 108; the max(p50, max/2) floor keeps 1.5 x coverage for long-tailed populations like the seed-1 mw). (3) Fragmentation switch test inclusive (<=): seed-2 mw dur_p50 54 == 0.5 x core 108, the strict < missed the boundary -> the core gate rejected the paste's low chunks (mw iso R 0.13). Probe (seeds 2026/1/2): seed-1 cross-fire gone, seed-2 iso_kettle 0.72 restored (P0.74/R0.70), seed-2 mw iso 0.21->0.36, seed-2 mix_burst mw 0.43->0.67 (R 0.30->0.57), kettle mix_burst 0.40->0.50 (the 0.31 cross-fire gone), no regressions anywhere; b2_probe_iso_all_mean 0.598->0.610, mw_iso_mean 0.297->0.347. Bench v3 (10 seeds): median 0.459345->0.467156 (+0.0078), p10 0.389235->0.389495 (+0.0003), mw median 0.354041->0.381962 (+0.028), kettle/fridge/wm/dw medians bit-identical, transfer 0.168197->0.167804 (-0.0004, the seed-2 model change moves 10-seed transfer medians slightly). House-1 median straddles seeds 4/9 (0.4636/0.4708) so the seed-2 mw gain does not move it. VERDICT: discard - +0.0078 < the pre-registered +0.01 keep bar (0.469345), applied consistently after the two-fix stage was also judged a discard at +0.0035. The delta is a deterministic Pareto gain, but the bar is the discipline and the bundle rejoins the next bet: full patch preserved at .auto/runs/b2_m3_dispute_durceil_switch.diff (157 lines, apply with git apply; also in stash@{0}). b1_* metrics carried from run 66 - the B1 module (.auto/b1_events.py, b1_encoder.py) is untouched this iteration (mined-event artifact 5260 unchanged in b1_mine2.log). Next: m4 = apply the patch + train-on-synthetic pipeline (paste marks into pre-span backgrounds as extra training supervision) evaluated as ONE bundle against floor 0.4593 / bar 0.4693; residuals parked: dw collapse 0.03 on seeds 6/7/8 and wm 0.135-0.17 on seeds 4/1/8 (the bottom of the seed distribution - m4-scale levers), seed-2 mix_burst wm->0.91 (unscored device), seed-1 mix_prog wm->0.60 on dw spans.","title":"B2 m3: gate attribution fixes - z-sum dispute, dur ceiling, switch","summary":"median 0.467156 (+0.0078 vs floor, under +0.01 bar), p10 +0.0003, mw median +0.028, others bit-identical, transfer -0.0004; probe cross-fires fixed. Discard per keep rule.","timestamp":1790488303951,"segment":2,"confidence":1.7486379167051436,"asi":{"hypothesis":"B2 m3: the probe cross-fires are gate artifacts fixable with eval-free margins - mw-side z-sum dispute, merged-event dur ceiling 3x max(p50, max/2), inclusive fragmentation switch","rollback_reason":"median +0.0078 < the pre-registered +0.01 keep bar despite a deterministic Pareto delta (mw +0.028, others identical, p10 up); rule fidelity - the bundle is preserved at .auto/runs/b2_m3_dispute_durceil_switch.diff (157 lines) and stash@{0}, and rejoins the m4 bundle","next_action_hint":"m4: apply the patch + train-on-synthetic pipeline (paste marks into pre-span backgrounds as extra training supervision) as ONE bundle vs floor 0.4593/bar 0.4693; residuals parked: dw 0.03 on seeds 6/7/8, wm 0.135-0.17 on seeds 4/1/8, wm->0.91/0.60 cross-fires (unscored-device spans)"}}
