{"run":68,"commit":"025f41f","metric":0.494189,"metrics":{"mean_device_f1_p10":0.466497,"transfer_mean_f1":0.150839,"median_kettle_f1":0.766469,"median_microwave_f1":0.381962,"median_fridge_f1":0.512856,"median_washing_machine_f1":0.354683,"median_dishwasher_f1":0.522727,"b1_events_mined":5260,"b1_enroll_top1_enc":0.84,"b1_enroll_top1_raw":0.65,"b1_cross_house_top1":0,"b1_gate_kettle_kept_frac":0.813,"b1_gate_mw_kept_frac":0.853,"b2_probe_mw_iso_mean":0.347,"b2_probe_iso_all_mean":0.61},"status":"keep","description":"m4 bundle = preserved m3 patch (z-sum dispute fix, dur ceiling, inclusive gate switch) + dw onset-geometry fix: emission backtracks by the MEDIAN per-mark pre-heat offset measured directly from marks (window start -> first heater block, PRE_ROLL 60s pad + 30s jitter) instead of half the mean cycle-span gap; median robust to contaminated marks (seed 6 pre_offs 19/3/18/19/17.5min -> 18.0). Old symmetric ext was deflated by contaminated marks -> emitted onsets +606-642s after GT (outside 600s tol) -> dw F1 0.03 on seeds 6/7/8. New ext per seed: 2026 18.5min back/0.5min fwd, 6 18.0/0.0. Eval-free synthetic paste validator added (3 mark slices into quiet pre-span windows spaced past the heater merge gap, full dw30 pipeline on the assembly, emitted-vs-pasted onset deltas): 2026 [-30,-30,none], 6 [-30,-30,+30], median -30s, no correction - the mechanism is validated without eval data. Bench v3 (10 frozen seeds): median 0.459345->0.494189 (+0.0348, +0.0248 over the pre-registered +0.01 bar 0.469345), p10 0.389235->0.466497 (+0.0772). Per-seed means: 2026 0.6026 identical, 1 0.4694 (+0.020), 2 0.4856 identical, 3 0.5389 identical, 4 0.4571 (-0.0065: one no-pre-heat GT episode lost a 6s-margin match, diagnosed via forced-ext trace), 5 0.5301 identical, 6 0.4772 (+0.086), 7 0.5028 (+0.092), 8 0.4675 (+0.092), 9 0.5508 (+0.080). Device medians: kettle 0.766469 / fridge 0.512856 / wm 0.354683 bit-identical, mw 0.381962 (=m3 level), dw 0.458065->0.522727 (+0.065). KEEP rule passes all three pre-registered conditions: median +0.0348 >= +0.01 bar, p10 up, no device median down. Transfer 0.167804->0.150839 (-0.0170): dw backtrack overshoots on other houses' shorter pre-heat phases (ukdale h2 dw 0.036, refit dw pairs drop to 0); tracked, not gated; bounded downside as predicted (~-0.01). b1_* carried (B1 module untouched, artifact 5260). Probe re-measured (b2_probe_m4.log, seeds 2026+1): mw iso 0.33/0.35 (burst path bit-identical ~0.347), iso_all 0.610 unchanged (iso_dw 0.83/0.84 - unstretched probe pastes cleared 600s under the old ext too; the bench gain comes from stretched real cycles). Residuals parked for m5: transfer dw overshoot + seed-4 episode share one lever (per-run scan-back: walk back from the first heater block while exc stays above the idle floor - adapts per house, would rescue seed 4 and likely recover much of the transfer drop); ~11/28 GT dw episodes still lack a raw run within 1800s (merge/amp ceiling, separate lever).","title":"m4 dw onset geometry: median per-mark pre/post-offset ext + guard","summary":"median 0.4593->0.4942 (+0.035, +0.025 over bar), p10 +0.077, dw median 0.458->0.523, seeds 6/7/8/9 +0.08-0.09, other medians bit-identical/up, transfer -0.017","timestamp":1790490156129,"segment":2,"confidence":1.9200464723278403,"asi":{"hypothesis":"dw emission onsets: backtrack by the median per-mark pre-heat offset measured directly from marks (contamination-robust) instead of half the mean cycle-span gap; validated by an eval-free synthetic paste onset check","next_action_hint":"m5 = per-run scan-back (walk back from first heater block while exc above idle floor) to adapt ext per house/cycle: recovers the seed-4 episode AND the transfer dw overshoot; keep the median-offset ext as the fallback when scan-back hits a noisy floor","rollback_reason":"n/a - keep","transfer_note":"transfer -0.017 bounded as predicted; scan-back should recover most of it without touching house-1 seeds (per-run adaptive, not a constant)"}}
{"run":69,"commit":"025f41f","metric":0.481489,"metrics":{"mean_device_f1_p10":0.450521,"transfer_mean_f1":0.155647,"median_kettle_f1":0.766469,"median_microwave_f1":0.381962,"median_fridge_f1":0.512856,"median_washing_machine_f1":0.364393,"median_dishwasher_f1":0.448413,"b1_events_mined":5260,"b1_enroll_top1_enc":0.84,"b1_enroll_top1_raw":0.65,"b1_cross_house_top1":0,"b1_gate_kettle_kept_frac":0.813,"b1_gate_mw_kept_frac":0.853,"b2_probe_mw_iso_mean":0.34,"b2_probe_iso_all_mean":0.611},"status":"discard","description":"m5 dw streak segmentation - DISCARDED (growth rule failed: median 0.481489 < m4 floor 0.494189, p10 0.450521 < 0.466497, dw device median 0.522727->0.448413).\n\nCHAIN OF EVIDENCE:\n1. Scan-back hypothesis refuted by mark trace (.scratch/diag_scan_trace.py): dw pre-heat phase is electrically quiet (pre-heat exc p50 -82..+54W, p90 <=114W vs bg p50 27W; below-thr fractions 0.89-1.00 at thr 120-300W) - per-cycle onset scanning has no signal; m4 median-ext estimator stands. Bench-log pre_offs across all 50 marks: mass at 17.5-19min with contaminated outliers (84, 5, 3, 1.5, -1, -0.5min); median is the right robust estimator (seed 3 range-midpoint would be 42.75min - absurd).\n2. Recall attribution (.scratch/diag_dw_recall.py): the same 12 GT episodes fail the SPAN gate on every seed - raw merged runs of 8220-20880s (137-348min) vs span band 46-102min. 2 more fail mean (stacked loads, mean 1057-1528 vs <=943), 2 idle (96-124 vs <=92, seed 5).\n3. m5 change: merged dw runs longer than the longest mark-derived cycle span segmented at internal below-heat gaps (greedy pack to span-band max, cut at last block before overflow) + validator streak pass (two back-to-back pastes must recover both onsets).\n4. Validator: streak pass 4-6/6 recovered, deltas -72..+24s; single-paste check unchanged (median -30s). b2 probe: iso means unchanged (mw_iso 0.34, iso_all 0.611), mix_prog dw RECOVERED 0.00->0.99 (seed 2026) and 0.71->0.90 (seed 1) - synthetic clean streaks work.\n5. Bench: median 0.481489 (-0.0127), p10 0.450521 (-0.0160), dw median 0.448413 (-0.0743), wm median 0.364393 (+0.0097), kettle/mw/fridge identical. Per-seed means: 2026 0.600072(-0.0026), 1 0.459504(-0.0099), 2 0.468677(-0.0169), 3 0.559035(+0.0201), 4 0.450670(-0.0064), 5 0.538922(+0.0088), 6 0.475346(-0.0018), 7 0.487633(-0.0152), 8 0.449180(-0.0184), 9 0.534418(-0.0164). Transfer mean 0.155647 (+0.0048, tracked).\n6. Emission attribution (seed 7, .scratch/diag_dw_emis.py): 63 emitted episodes, 19 MATCH (deltas ~0, spans 96-103.5min), 44 FP. New FPs = segmentation slabs at non-cycle onsets (~25/seed): eval monoliths are NOT clean consecutive dw cycles - they are dw cycles bridged with foreign appliance activity (wm cross-fire, pre-existing ~14-17 FP/seed at m4 too) through the 70min merge gap. No mark-derived rule separates dw cycles from bridged foreign clusters: inter-cycle heater gaps 19-46min overlap intra-cycle wash gaps 20-56min; gap exc signatures seed-dependent (seed 1 pre-heat p50=99W is motor-like); cycle pitch drifts with unknown inter-cycle idle (0-27min).\n7. Side effect: wm30 profile consumes the dw run set for net-new candidates -> segmentation changed dw-owned spans -> seed-1 wm ext_fwd 26.5->53.2min, wm median +0.0097 (luck, not design).\n\nCONCLUSION: synthetic clean-streak validation is blind to the real failure mode (foreign bridging inside monoliths). Greedy slab cuts emit at non-cycle onsets. Discarded; auto-revert to run-68 state. m6 candidates: (a) dw FP reduction - wm cross-fire runs pass dw gates (dens/idle bands too loose on high-variance seeds), biggest P lever; (b) mean-gate stacked-load episodes (5-7/seed, mean 1057-2205 vs <=943) - robust mean variant, needs own diag; (c) wm residuals on seeds 4/1/8 (0.135-0.17) - wm30 geometry diag; (d) parked: transfer dw (no per-cycle electrical signal in pre-heat).","title":"dw streak segmentation: synth pass, eval monolith FPs","summary":"Synthetic streaks pass (mix_prog dw 0.00->0.99) but eval monoliths are dw+foreign bridged runs: pieces add ~25 FP/seed, dw median 0.523->0.448, primary 0.494->0.481. Discard; wm +0.010 side-effect.","timestamp":1790491649870,"segment":2,"confidence":2.8445244195826063,"asi":{"hypothesis":"overlong merged dw runs = consecutive-cycle streaks; segment at internal gaps to recover 12 span-fail episodes/seed","rollback_reason":"eval monoliths are dw+foreign bridged activity, not clean streaks; greedy slabs emit at non-cycle onsets (~25 FP/seed, P 0.48->0.30 on seed 7); synthetic validator structurally blind to foreign bridging","next_action_hint":"m6: dw precision lever - wm cross-fire runs pass dw gates on high-variance seeds; or robust-mean variant for stacked-load episodes; keep m4 estimator untouched"}}
{"run":70,"commit":"b6c3fd3","metric":0.505987,"metrics":{"mean_device_f1_p10":0.485922,"median_kettle_f1":0.766469,"median_microwave_f1":0.381962,"median_fridge_f1":0.512856,"median_washing_machine_f1":0.389216,"median_dishwasher_f1":0.522727,"transfer_mean_f1":0.151921,"b1_events_mined":5260,"b1_enroll_top1_enc":0.84,"b1_enroll_top1_raw":0.65,"b1_cross_house_top1":0,"b1_gate_kettle_kept_frac":0.813,"b1_gate_mw_kept_frac":0.853,"b2_probe_mw_iso_mean":0.34,"b2_probe_iso_all_mean":0.61},"status":"keep","description":"PRE-REGISTERED keep rule (declared before benching): keep iff median >= 0.504189 (m4 floor 0.494189 + 0.01), p10 >= 0.466497, no device median drop > 0.03. All three pass. \\n\\nBundle = two wm fixes from the m5/m6 attribution. (1) _wm30_profile window-skip: a mark window with no heater blocks no longer disables the sustained detector outright - it is skipped, and the detector disables only if <2 usable windows survive (bands would hang off one sample). Fixes seed 8 (mark window 3 empty -> wm ran on chains only, bench F1 0.173). (2) wm-side dw run-basis ownership removed: the old rule (suppress any wm-gated run overlapping a dw-gated run) cost 8-19 real wm cycles/seed on crossed-band calibrations. Diagnosed via seed-4 instrumentation: the dw marks' dens ceiling (1.053/min) EXCEEDS the wm marks' max (0.44), so the bands cross and no mark-derived rule can arbitrate a double claim - arbitration by emission order is a prior, not a measurement. Measured variants on the diag (seeds 8/4/1/2026, wm F1): baseline 0.227/0.208/0.220/0.629; double-pass (wm run must also pass dw gates) 0.351/0.224/0.264/0.629; ownership-off 0.390/0.330/0.276/0.629. Ownership-off dominates every seed; named-chain dup check retained (chains are mark-verified, unlike wide dw bands). \\n\\nBench v3 (10 frozen seeds): median 0.494189->0.505987 (+0.0118, bar was 0.504189), p10 0.466497->0.485922 (+0.0194). Per-seed means: 2026 0.6026 identical, 1 0.4694->0.4867 (+0.017), 2 0.4856->0.4893 (+0.004), 3 identical, 4 0.4571->0.4793 (+0.022), 5 identical, 6 0.4772->0.4909 (+0.014), 7 0.5028->0.5094 (+0.007), 8 0.4675->0.5026 (+0.035), 9 identical. Six seeds up, four bit-identical, none down. Device medians: kettle 0.766469 / mw 0.381962 / fridge 0.512856 / dw 0.522727 bit-identical (dw emission loop untouched); wm 0.354683->0.389216 (+0.0345). Transfer 0.150839->0.151921 (+0.0011). \\n\\nProbe (b2, seeds 2026+1): dw synth onset check passes; iso means hold (iso_all 0.61, mw 0.347). Seed-1 mix_prog shows the priced-in wm cross-fire on dw spans (0.60) with wm F1 still 0.75. \\n\\nCost accounting: wm now emits its own gated shots inside dw heater territory where the wm gates admit them (~+1 wm FP/seed on the diag; no bench seed-mean regression anywhere). \\n\\nResiduals parked for m7: (a) wm band-floor rejects from unrepresentative heavy marks (eval run means 473-866 vs mean_lo 702-775; dens 0.04-0.20 vs dens_lo 0.14-0.20; hs ~0.15 vs 0.18) - per-window-median mark stats or dropping lo floors on huge mark spread is the next lever; (b) wm FPs include dw cross-fire (2026: 8/27 FPs with gt_dw_overlap=1); (c) owner targets: house-1 median 0.506 vs bar 0.70; transfer 0.152 vs bar 0.50 - transfer needs its own campaign (m6 lever is house-1-specific). b1_* carried (B1 module untouched, artifact 5260).","title":"m6: wm30 window-skip + drop dw run-basis ownership on wm","summary":"median 0.494189->0.505987 (+0.0118 vs bar +0.01), p10 0.466497->0.485922, wm median 0.3547->0.3892, others bit-identical; transfer 0.150839->0.151921; 6 seeds up, none down","timestamp":1790493472084,"segment":2,"confidence":2.2315694972539064,"asi":{"hypothesis":"wm misses concentrate in fixable mechanisms: the seed-8 empty-mark-window disable, the over-broad dw run-basis ownership suppressing real wm cycles, and (residual) unrepresentative mark bands rejecting low-draw wm cycles","diagnosis":"window-skip + ownership removal passes all 3 pre-registered keep conditions; 6 seeds up, 4 bit-identical, none down; wm device median +0.0345; dw untouched by construction (ownership list was wm-side read-only)","next_action_hint":"m7: wm30 mark-stat robustification - derive dens_lo/mean_lo/hs_lo from per-window medians or drop lo floors when the mark spread is huge (seed 4: eval wm run means 473-866 vs mean_lo 702-775); validate on seeds 4/1/8 diag before benching; keep the crossed-band lesson: never arbitrate device disputes by emission order when bands cross"}}
{"run":71,"commit":"b6c3fd3","metric":0.505987,"metrics":{"mean_device_f1_p10":0.485922,"median_kettle_f1":0.766469,"median_microwave_f1":0.381962,"median_fridge_f1":0.512856,"median_washing_machine_f1":0.389216,"median_dishwasher_f1":0.522727,"transfer_mean_f1":0.151921,"b1_events_mined":5260,"b1_enroll_top1_enc":0.84,"b1_enroll_top1_raw":0.65,"b1_cross_house_top1":0.21,"b1_gate_kettle_kept_frac":0.813,"b1_gate_mw_kept_frac":0.853,"b2_probe_mw_iso_mean":0.34,"b2_probe_iso_all_mean":0.61},"status":"discard","description":"m7 candidate: in _extract_events the level-return test samples the post-fall level at f_end + STEP_H (18 s after the fall-run end), but a duty-cycled draw's magnetron off-gaps are 10-30 s wide, so the level is already back ON the draw there - every intra-draw fall fails, pairing walks forward to the draw-end fall, and the whole duty-cycled draw fuses into one monster event the burst dur gate then rejects (diagnosed on .scratch/diag_mw_iso.py: one proper chunk emitted per draw while the rest fused into dur=1770-6402 s events with gates=dur). FIX IMPLEMENTED: accept a fall as an excursion end if the level bounces back up (any stp[lo:hi] > 0.5*a with hi = min(lo + STEP_H + 2, n)) OR the plain level-return test.\n\nA/B on the b2 probe (uv run python3 .auto/b2_synth.py --seeds 2026,1), identical protocol pre-fix vs post-fix:\n  seed 2026 iso_microwave mw F1 0.33 -> 0.33 (P0.34/R0.32 bit-identical)\n  seed 1    iso_microwave mw F1 0.35 -> 0.35\n  seed 2026 iso_wm wm F1 0.67 -> 0.91 (R0.54 -> R0.94)\n  seed 1    mix_prog wm F1 0.75 -> 0.38 (P0.92/R0.63 -> P1.00/R0.23)\n  wm mark dens 0.30-0.56 -> 0.57-0.90/min (the rule also fragments real wm runs)\n\nVERDICT: the target metric does not move at all and one seed's wm recall collapses; net-negative, reverted before benching (bench not run - a change the probe already shows is net-negative does not deserve a bench read that implies otherwise). HEAD stays b6c3fd3, v3 floor unchanged at 0.505987.\n\nRULES OUT: (1) the mw iso recall loss is NOT intra-draw event fusion at the extractor - fragmentation demonstrably increases (the mw mark-fragment switch fires) yet mw F1 is bit-identical, so the mw ceiling is downstream of extraction: emitted span/amp geometry and the burst gate bands, not the pairing walk. (2) the bounce rule is not free: it fragments sustained wm runs and needs a wm-side guard before reuse.\n\nSEPARATE, KEPT: owner-directed B1 bug fix (.auto/b1_encoder.py:171). The cross-mode gallery filtered ev['dev'] != d, so a correct-device hit was impossible and 'cross-house invariance 0.000' was an artifact. Fixed (gallery = all devices of the other held-out houses, matching enroll mode) and re-ran the m2 gate: cross raw 0.225 / enc 0.210, enroll raw 0.650 / enc 0.840. Corrected cross-house retrieval is AT CHANCE (5 devices); the encoder's measured value is same-house K=5 enrollment, not cross-house invariance.","title":"m7 bounce rule refuted: mw unchanged, wm recall collapses","summary":"Extractor bounce rule left iso-microwave F1 bit-identical (0.33/0.35) and cut seed-1 mix_prog wm 0.75->0.38 (R 0.63->0.23); reverted pre-bench.","timestamp":1790494383962,"segment":2,"confidence":2.0229549398599707,"asi":{"hypothesis":"intra-draw magnetron off-gaps make the level-return test fuse whole duty-cycled draws into monster events rejected by the burst dur ceiling","outcome":"refuted as a mw lever; harmful to wm","rollback_reason":"iso-microwave F1 bit-identical pre/post (0.33 on 2026, 0.35 on 1) while seed-1 mix_prog wm fell 0.75 -> 0.38 and wm mark dens nearly doubled","next_action_hint":"mw ceiling lives downstream of extraction (emitted span/amp + burst gate bands); do not retry extractor fragmentation without a wm-side guard. Owner direction supersedes: bench v4 (per-home re-calibration), blocked on making model.py device-subset-robust","new_finding":"build_and_train hard-indexes all five devices (793-796, 813/818, 874, 918); no pool house has all five"}}
{"run":72,"commit":"5ad5980","metric":0.505987,"metrics":{"mean_device_f1_p10":0.485922,"median_kettle_f1":0.766469,"median_microwave_f1":0.381962,"median_fridge_f1":0.512856,"median_washing_machine_f1":0.389216,"median_dishwasher_f1":0.522727,"transfer_mean_f1":0.151921,"b1_events_mined":5260,"b1_enroll_top1_enc":0.84,"b1_enroll_top1_raw":0.65,"b1_cross_house_top1":0.21,"b1_gate_kettle_kept_frac":0.813,"b1_gate_mw_kept_frac":0.853,"b2_probe_mw_iso_mean":0.34,"b2_probe_iso_all_mean":0.61},"status":"keep","description":"Owner direction: make the process learnable across homes. Bench v4 must score any pool house, but build_and_train hard-indexed all five device classes and 16/20 pool houses have fewer than five present, so this refactor is the blocking prerequisite.\n\nChange (src/experiments/04_autoresearch/model.py): _name_program iterates only devices present in mark (an absent device must not own a chain); prog_amps + seed_thr/heat_thr take the min over the present program appliances and go to +inf when none is present; the dw30 and wm30 sustained-run detectors are only built when their device is marked, with the partner amp falling back to the device's own mark amp (the partner only ever sets heat = FRAC * min(partner, own)); the dur_ref loop is filtered to present devices; fridge_band is forced None when the fridge channel is absent; out is allocated over the new ALL_DEVICES tuple and narrowed to the house's own devices on both return paths; the predict gate branches for kettle/microwave/fridge became presence elif + zero-mask else; the kettle mining block and the wm30 call are wrapped in presence guards (ket_prof hoisted to None).\n\nEvidence (a) regression: bash .auto/measure.sh is BIT-IDENTICAL to run 70 - median 0.505987, p10 0.485922, device medians kettle 0.766469 / microwave 0.381962 / fridge 0.512856 / washing_machine 0.389216 / dishwasher 0.522727, transfer 0.151921, and all ten per-seed means match to six decimals (2026 0.602637). house_1 has all five devices, so every guard evaluates true and the output dict is re-keyed in the house's own device order: no behaviour change is possible on a full-device house.\nEvidence (b) new capability (.scratch/smoke_v4_subset.py, unique cache tag to avoid stale-window reuse): eco/house_03 (fridge only) and eco/house_01 (fridge only) build_and_train + predict without error and return exactly [fridge]; refit/house_17 (no dishwasher channel) returns exactly [fridge, kettle, microwave, washing_machine] and exercises the partner-amp fallback; ukdale/house_1 returns all five.\n\nNo metric claim: this run changes no behaviour on any house that has the full device set and was not expected to move the metric. DECLARED PROTOCOL EXCEPTION: logged as keep, not discard, because the plugin's discard path auto-reverts src/ and this is the owner-directed blocking prerequisite for bench v4; the metric is reported unchanged (0.505987) and is not presented as a gain.\nRule conflict flagged to owner: mean_device_f1 is about to be replaced by the bench-v4 pool primary (per-home re-calibration over 20 houses / 66 pairs), so any keep rule stated against the pool primary is not yet applicable and the v3 median is now a guardrail/dev readout only.","title":"v4 prereq: model.py device-subset-robust (bit-identical, no gain)","summary":"All guards true on house_1 -> bench bit-identical (median 0.505987, p10 0.485922, transfer 0.151921); 1-device and 4-device pool houses now build and emit exactly their own keys.","timestamp":1790494976292,"segment":2,"confidence":2.176456954495122,"asi":{"hypothesis":"a house with fewer than five canonical devices can be built and scored at all","outcome":"proved; not a metric lever - bit-identical on house_1, and subset houses now build and emit exactly their own device keys","keep_exception":"no metric gain; kept because discard auto-reverts src/ and this is the blocking prerequisite for bench v4 (owner-directed). The pool-primary keep rule is not yet applicable because bench v4 does not exist yet.","next_action_hint":"write .auto/bench_v4.py (per-home re-calibration over .auto/pool_v4.json, 20 houses / 66 pairs, 5 seeds), re-baseline HEAD, then launch parameter fitting and the B4 washing-machine phase model","new_finding":"v4 pool = 66 pairs / 20 houses; coverage kettle 12, microwave 11, fridge 18, washing_machine 15, dishwasher 10; fridge is 18/66 of the pair-mean so a device-balanced mean must be reported alongside it; holdout = 7 houses, scored once per claimed breakthrough"}}
