{"run":91,"commit":"2f0ee0f","metric":0.3581651989081585,"metrics":{"mean_device_f1_p10":0.3436511416642649,"transfer_mean_f1":0.151921,"median_kettle_f1":0.55514,"median_microwave_f1":0.267281,"median_fridge_f1":0.370963,"median_washing_machine_f1":0.242345,"median_dishwasher_f1":0.384353,"b1_events_mined":5260,"b1_enroll_top1_enc":0.84,"b1_enroll_top1_raw":0.65,"b1_cross_house_top1":0.21,"b1_gate_kettle_kept_frac":0.813,"b1_gate_mw_kept_frac":0.853,"b2_probe_mw_iso_mean":0.34,"b2_probe_iso_all_mean":0.61,"device_balanced_mean":0.36586712629491175,"house_1_v4_mean":0.5401041710856695,"v4_n_pairs":66,"v4_n_houses":20,"fridge_median_delta":0,"primary_delta":0.003542},"status":"discard","description":"CONTEXT. Run 90 was discarded only because the primary is the median over seeds of the per-seed 66-pair mean, and its median seed (2026) fell 0.0020 when an evidence-free 70-min merge fallback was replaced by 1. Follow-up diagnostics (m25) then refuted, one at a time, level/threshold, merge gap alone, the hs floor, and the density ceiling, and an additive gate census on refit/house_10's eval window (merge_n=10) isolated the gate:\n- all gates permissive: 176 runs admitted, 43/86 GT cycles touched\n- + span band 8-21 min: 176 -> 16 runs, 9/86 cycles\n- + amp>=1393W, + mean 1375-5022W, + hs 0-1.75, + dens<=0.588: no further change (16 runs, 9 cycles)\nGround truth: 86 dw cycles, 10.0-27.2 min (median 18.8), spacing 16.6 h; 86/86 reach the mark-derived 1393 W. The 5 dw marks are 14.4-17.6 min windows each holding exactly ONE block of 12.5-17.0 min with hs=1.0 - no internal pause, no partial duty. So the span band (0.6*min, 1.25*max of the mark spans) was a tolerance around one structureless example.\n\nCHANGE (src/experiments/04_autoresearch/model.py, dw profile only). When the marks contain no internal pause at all (max_gap == 0), the merged block IS the whole above-heater region and the mark-span spread carries no evidence about burst distribution. In that case the merge gap is derived from the mark span scale (merge_n = round(0.5 * 0.6 * min(spans) / DW30_GRID_S), i.e. bridge pauses up to half the shortest mark span) and the span tolerance is widened about the same centre (0.25*min(spans) to 3.0*max(spans)); the scale-tolerant gates (amp/mean/hs/idle/dens) keep arbitrating. Evidence-bearing houses are untouched because the branch is keyed on max_gap == 0. Built on the run-90 edits (merge fallback + dw hs floor) re-applied from .auto/runs/90_single_block_mark_fixes.diff.\n\nMEASURED (full pool, 20 houses, 66 pairs, 5 seeds, 111 s, checks pass).\nprimary 0.358165 vs floor 0.354623 (+0.003542, sub-bar); p10 0.343651 vs 0.336690 (+0.006961); device_balanced 0.365867 vs 0.358294 (+0.007573); house_1 v4 mean 0.540104 (unchanged); dishwasher median 0.384353 vs 0.346705 (+0.037648); microwave median 0.267281 (+0.001277); kettle 0.555140, fridge 0.370963, washing_machine 0.242345 all unchanged - no device median dropped.\nTargeted screen (refit/house_10, refit/house_13): house_10 seed 2026 dishwasher went F1 0.15 (n=10 preds) -> 0.36 (n=73 preds, R=0.34); house_13 dishwasher 0.46 (2026) / 0.38 (seed 1), the run-90 level. p10 rising more than the median is the expected signature of repairing dead tail pairs rather than the centre.\n\nVERDICT. Real, uniformly-signed gain with no device regression, but +0.0035 is below the +0.01 keep bar, so discarded. Diff preserved at .auto/runs/91_single_block_span_condition.diff for bundling (as m22/m23 were). The condition is structural (absence of pause evidence in the calibration marks), not keyed to any house or benchmark value.\n\nNEXT. (1) The same argument applies to the wm mirror, which is identical code: a wm whose marks show no pause gets the same treatment. (2) Per-pair attribution of this run was not re-dumped; the next run should run bench_v4.py --dump and diff per pair against .scratch/run90_base.csv to find which houses moved and which dead pairs remain. (3) Remaining dead pairs on the median seed: refit/house_10 fridge (P=0.04 on 1956 gt), refit/house_6 microwave (R=0.02 on 390 gt), refit/house_11 wm/dw, refit/house_7 dw.","title":"run 91: dw span band from mark scale when marks show no pause","summary":"Pool 0.358165 (+0.0035): p10 +0.0070, db +0.0076, dw median +0.0377; house_10 dw 0.15->0.36. Sub-bar, discarded.","timestamp":1790504740081,"segment":2,"confidence":2.615277498414071,"asi":{"hypothesis":"For a house whose calibration marks contain no internal pause (max_gap == 0), the dw span band fitted to those marks is a tolerance around a structureless example and must be relaxed to a scale tolerance, with the merge gap derived from the mark span scale.","gate_census_house_10":"permissive 176 runs/43 cycles; span band alone 16/9; amp, mean, hs, dens add nothing","refuted_this_run":["level/threshold (86/86 cycles reach 1393 W)","merge gap alone (best 16 admitted, 9/86 cycles)","dw hs floor as house_10 cause (identical counts)","density ceiling (0.588 to inf changed nothing)"],"measured_gain":"primary +0.003542, p10 +0.006961, device_balanced +0.007573, dw median +0.037648, no device median down","rollback_reason":"primary gain below the +0.01 keep bar; diff saved to .auto/runs/91_single_block_span_condition.diff","next_action_hint":"apply the same no-pause condition to the wm mirror; dump per-pair results and diff against .scratch/run90_base.csv; then target refit/house_10 fridge, refit/house_6 microwave, refit/house_11 wm/dw","trap":"the printed 'dw sustained runs: N pass run-basis gates' line reports the mining/pre span, not the eval window"}}
{"run":92,"commit":"2f0ee0f","metric":0.354655,"metrics":{"mean_device_f1_p10":0.337354,"transfer_mean_f1":0.151921,"median_kettle_f1":0.55514,"median_microwave_f1":0.267281,"median_fridge_f1":0.370963,"median_washing_machine_f1":0.215407,"median_dishwasher_f1":0.384353,"b1_events_mined":5260,"b1_enroll_top1_enc":0.84,"b1_enroll_top1_raw":0.65,"b1_cross_house_top1":0.21,"b1_gate_kettle_kept_frac":0.813,"b1_gate_mw_kept_frac":0.853,"b2_probe_mw_iso_mean":0.34,"b2_probe_iso_all_mean":0.61,"device_balanced_mean":0.359634,"house_1_v4_mean":0.533005,"v4_n_pairs":66,"v4_n_houses":20,"fridge_median_delta":0,"primary_delta":0.000032},"status":"discard","description":"TWO RESULTS, ONE MEASUREMENT.\n\n1) The planned next step is dead. m26 said to port run 91's no-pause condition to the wm mirror. The saved run logs show every wm profile carries heater_gap_merge = 17-89 min, i.e. the wm marks ALWAYS contain an internal pause (max_gap > 0), so that branch would never fire. The wm mirror is inert by construction and was not attempted.\n2) The real defect. Mining the floor's 330-pair table (.scratch/run90_base.csv) ranks the lost F1: the wm is the worst device (median-seed mean 0.242 over 15 pairs) and its failures are mostly over-emission - refit/house_11 F1 0.000 with 58 preds for 15 gt, refit/house_8 0.14 with 184/76, refit/house_21 0.08 with 63/42, refit/house_18 0.06 with 58/37; refit/house_17 is the opposite (0.09, 42/66). The wm span gate is span_band = (0.6*min(spans), 1.25*max(spans)) over the five mark windows, and the logged bands are 5-136, 4-44, 8-91 and 10-72 min - max/min from 3.4x to 30x.\n\nHYPOTHESIS. max(spans) is a maximum over five samples; when those spans are mutually inconsistent it is one window's width, not a device property, and the ceiling is vacuous, admitting eval runs far longer than any typical mark cycle. Change: when max(spans) > 3*min(spans), reference the ceiling to median(spans) at the same PROG_SPAN_HI = 1.25 margin; houses whose marks are consistent keep the original reference (branch inert for them), and the lower bound still hangs off min(spans) so shorter cycles stay admitted.\n\nMEASURED (full pool, 66 pairs, 20 houses, 5 seeds, 111 s, checks pass).\nprimary 0.354655 vs 0.354623 floor (+0.000032, i.e. nothing) and vs 0.358165 for the incumbent run-91 state (-0.003510). p10 0.337354 vs 0.343651 (-0.006297); device_balanced 0.359634 vs 0.365867 (-0.006233); house_1 v4 mean 0.533005 vs 0.540104 (-0.007099) - the first house_1 regression of the campaign. Device medians: washing_machine 0.215407 vs 0.242345 (-0.026938), dishwasher 0.384353, microwave 0.267281, kettle 0.555140, fridge 0.370963 unchanged. The rule fired broadly: wm bands tightened to 3-14, 4-14, 3-7, 8-29 min where they had been 8-91 and 5-136 min.\n\nWHY IT FAILED. The spread across the five wm mark windows is real device behaviour, not sampling error: the widest marked cycle IS a real cycle, and the max-based ceiling was carrying recall for exactly the houses and seeds that need it (house_1's wm among them). Tightening to the median removes true long cycles faster than it removes false ones. The min/max reference stands for the wm.\n\nVERDICT. Discarded. No gain over the floor, and worse than the run-91 dw change that is waiting to be bundled; the incumbent state remains recoverable from .auto/runs/91_single_block_span_condition.diff. This run's diff is kept at .auto/runs/92_wm_robust_span_ceiling.diff as the record of a refuted direction.\n\nNEXT. wm precision must not come from tightening its span ceiling. The remaining wm levers are the mean/density bands and, as the owner's B4 schedule says, a phase-program model; and the per-pair dump should be regenerated for the incumbent state so the next choice is attributed rather than aggregate.","title":"run 92: robust wm span ceiling (median vs max over marks)","summary":"Pool 0.354655: wm median -0.027, house_1 -0.007, p10 -0.006. Max over marks is real cycle spread, not an outlier. Discarded.","timestamp":1790505105853,"segment":2,"confidence":2.6431274433150866,"asi":{"hypothesis":"A wm span ceiling referenced to max(spans) over five mark windows is vacuous when the marks' spans are mutually inconsistent (max > 3x min); referencing it to median(spans) at the same margin should raise precision.","refuted":"primary fell 0.0035 below the incumbent run-91 state; washing_machine median -0.0269, house_1 -0.0071, p10 -0.0063, device_balanced -0.0062","why":"the max is real device spread for the wm: the widest marked cycle is a real cycle and the wide ceiling carries recall","dead_plan":"the wm mirror of run 91's no-pause condition is inert by construction: all logged wm profiles have heater_gap_merge 17-89 min, so max_gap > 0 always","saved":".auto/runs/92_wm_robust_span_ceiling.diff","rollback_reason":"no gain over floor (primary +0.000032) and worse than the incumbent; revert restores floor 2f0ee0f, run-91 state recoverable from .auto/runs/91_single_block_span_condition.diff","next_action_hint":"do not tighten the wm span ceiling; attack wm precision through the mean/density bands or the B4 phase-program model; regenerate a per-pair dump for the incumbent state before the next change"}}
{"run":93,"commit":"2f0ee0f","metric":0.355973,"metrics":{"mean_device_f1_p10":0.347888,"transfer_mean_f1":0.151921,"median_kettle_f1":0.558981,"median_microwave_f1":0.2845,"median_fridge_f1":0.370963,"median_washing_machine_f1":0.242345,"median_dishwasher_f1":0.384353,"b1_events_mined":5260,"b1_enroll_top1_enc":0.84,"b1_enroll_top1_raw":0.65,"b1_cross_house_top1":0.21,"b1_gate_kettle_kept_frac":0.813,"b1_gate_mw_kept_frac":0.853,"b2_probe_mw_iso_mean":0.34,"b2_probe_iso_all_mean":0.61,"device_balanced_mean":0.364009,"house_1_v4_mean":0.546212,"v4_n_pairs":66,"v4_n_houses":20,"fridge_median_delta":0,"primary_delta":0.00135},"status":"discard","description":"RUN 93 - two cheap screens refuted two whole families, then the surviving mirror-image change was measured pool-wide. Discard.\n\n1) SCREEN A (6 houses, seed 2026, ~40 s): the run-91 style fix for the four dead wm pairs. Hypothesis: the wm onset geometry uses np.mean(oss)/np.mean(oes) (model.py L728-729) while the dw path uses a median and documents why (run-67: an offset error past the 600 s tolerance collapses F1 to 0 with the right cycle count). Implemented a support-maximising aggregate (the offset the most mark windows agree on, grid-step tolerance 30 s, ties breaking to the sample median so agreeing windows reduce exactly to the incumbent median), applied to both _dw30_profile and _wm30_profile. RESULT: 25 of 26 pairs bit-identical; only refit/house_7 wm moved, 0.260 -> 0.230 (-0.030). The four dead wm pairs (house_11 33/15, house_18 43/37, house_21 63/42) did not move at all. REFUTED: the wm F1=0 pairs are not an onset-offset artifact; the per-window offsets were already consistent, consistent with the earlier refuted house_11 wm/dw placement work (m12).\n\n2) SCREEN B (same 6 houses): widen the shared burst admission margins, the direction that produced the campaign's only clean win (run 91 widened the dw span band) and that three recall-collapse pairs appear to ask for (refit/house_6 mw R=0.02, eco/house_06 fridge R=0.01, refit/house_8 mw R=0.08). Set REL_AMP 0.20 -> 0.30 and REL_DUR (1/3,3) -> (0.25,4). RESULT: 8 pairs moved, sum_delta -0.4900, and the damage is concentrated in the healthy pairs (refit/house_8 kettle 0.620 -> 0.440, ukdale/house_1 kettle 0.790 -> 0.620, house_1 mw -0.02, house_12 mw -0.07) while the recall-dead mw/fridge pairs did not respond (house_8 mw 0.110 -> 0.100, house_6 mw unchanged). REFUTED: the burst-recall collapse is not an admission-width problem. Only house_12 kettle gained (+0.010, P 0.04 R 0.24).\n\n3) RUN 93 (full pool, 66 pairs, 5 seeds, 112 s, checks pass): the mirror step on the one field run 92 established as defensible (amp is supply-driven and physically intrinsic, unlike the behavioural span bands that tightening ruined). REL_AMP 0.20 -> 0.15, single field changed for clean attribution.\n   primary 0.355973 (floor 0.354623 => +0.00135, sub-bar; incumbent floor+run91 0.358165 => -0.00219).\n   p10 0.347888 (incumbent 0.343651, +0.00424). device_balanced 0.364009 (incumbent 0.365867, -0.00186). house_1_v4_mean 0.546212 (incumbent 0.540104, +0.00611).\n   medians vs incumbent: mw 0.267281 -> 0.284500 (+0.01722), kettle 0.555140 -> 0.558981 (+0.00384), fridge/dw/wm unchanged (fridge 0.370963, dw 0.384353, wm 0.242345).\n   Screen-level detail (6 houses): house_8 kettle 0.620 -> 0.730 (+0.110, P 0.31 -> 0.71), ukdale/house_1 kettle 0.790 -> 0.820, house_1 mw 0.350 -> 0.360, house_8 mw 0.110 -> 0.120, house_7 kettle 0.130 -> 0.140, house_6 kettle 0.810 -> 0.800, house_6 mw 0.040 -> 0.020, house_12 mw 0.430 -> 0.340 (P 0.37 -> 0.52 but R 0.36 -> 0.25).\n\nINTERPRETATION: the amp margin is already near its optimum for the pool MEAN at 0.20. Tightening it raises the per-device MEDIANS and the standing-bar house and p10 (it removes ~90%-junk predictions: the burst pairs carry P 0.03-0.37) but loses more total F1 through a few large recall losses on houses whose mw/kettle draw is dispersed. Widening (screen B) is strictly worse (-0.49 over 8 pairs). So the margin-sensitivity curve is peaked at/near the incumbent value, and the mean-vs-median divergence is now measured rather than assumed: precision-leaning changes buy medians/p10/house_1 and pay the mean.\n\nCONSEQUENCE FOR THE PORTFOLIO: with the gate families now exhausted (this closes the admission-margin question alongside the refuted onset statistic, the refuted span ceilings of run 92, and the refuted fridge band repairs of m21/m22), the remaining dead pairs are mark-window/GT misassignment plus irreducible lookalike populations: refit/house_12 kettle admits 784 preds at 1110 W / 14.4 min against a mined cluster of n=1600 lookalikes, and its own mark window (115 W / 36.4 min) is the mislabeled side; refit/house_6 mw carries a mark of amp=786 W with mean=60 W (an idle-dominated window) against 390 GT cycles. No gate repair can recover those, which is exactly the case for the owner's B-series: B4 phase grammars to replace the span/density gate family for wm+dw, and B1/B3 cross-house and unlabeled-year supervision rather than more per-house band tuning.","title":"Run 93: burst amp margin 0.20->0.15 - medians up, pool mean down","summary":"pool 0.355973 (floor +0.0014, incumbent -0.0022); mw med +0.0172, kettle +0.0038, house_1 +0.0061, p10 +0.0042; house_12 mw -0.09 recall loss","timestamp":1790505779071,"segment":2,"confidence":2.671070305462933,"asi":{"hypothesis":"run 93 tested two cheap screens (wm onset aggregate; burst admission width) then the surviving mirror step: tighten the burst amp margin REL_AMP 0.20 -> 0.15, since screen B showed widening it costs -0.49 over 8 pairs and the burst pairs are precision-bound (P 0.03-0.37).","rollback_reason":"primary 0.355973 = floor +0.00135 (sub-bar) and -0.00219 vs the incumbent state (floor + run 91, 0.358165). The amp margin is already near-optimal for the pool mean: tightening buys medians (mw +0.0172), p10 (+0.0042) and the standing-bar house (+0.0061) but a few large recall losses on houses with dispersed mw/kettle draws cost more total F1.","next_action_hint":"Stop tuning per-house admission bands; the gate families are exhausted (onset statistic, admission width in both directions, span ceilings, fridge band repairs, crossed detectors, level/merge-gap/hs-floor/density-ceiling all refuted). Move to structure: implement the B4 phase grammar / HSMM for wm+dw to replace the span+density gate family, or the B1 cross-house encoder retrain, and give each 5-15 runs before judging.","screen_a_result":"wm onset support-maximiser: 25/26 pairs bit-identical, only refit/house_7 wm -0.030.","screen_b_result":"REL_AMP 0.30 + REL_DUR (0.25,4): 8 pairs changed, sum -0.4900, house_8 kettle -0.18, house_1 kettle -0.17.","run93_diff":".auto/runs/93_rel_amp_tighten.diff (135 lines, REL_AMP 0.20 -> 0.15)","dead_pair_evidence":"house_12 kettle: 784 preds, mark 115 W/36.4 min vs event p50 1110 W/864 s and a mined lookalike cluster of n=1600 at 9.4 min; house_6 mw: mark amp 786 W with mean 60 W, 390 GT cycles, R 0.02."}}
