{"run":10,"commit":"7e1d46c","metric":0,"metrics":{"mean_device_f1":0.062892,"pooled_episode_f1":0.006573,"mean_mae_w":29.4779,"worst_mae_w":62.5906,"mean_nmae":0.08595,"coverage_pred_share":0.437258,"coverage_true_share":0.258188,"kettle_mae_w":13.2,"microwave_mae_w":13.6,"fridge_mae_w":39.2,"washing_machine_mae_w":62.6,"dishwasher_mae_w":18.8,"kettle_f1":0.283,"dishwasher_f1":0,"washing_machine_f1":0.025,"microwave_f1":0.007,"fridge_f1":0,"ft_pretrain_val_mse_pre":0.14412,"ft_pretrain_val_mse_post":0.14412},"status":"discard","description":"EXP-10 v10 = v5 net (training identical, same seed) + factorial-HMM Viterbi decode in predict (research import: analog-problems.md S2.1 factorial HMM, S2.3 dwell priors, S4 step 4; user-directed backlog i15+i16). Per-sample gating replaced by: per-position mean posterior (same overlap scheme), logit shift by the SAME calib gate (v5 decision boundary preserved), exact joint Viterbi over 2^5=32 states with factorized transitions; emissions = per-chain log-liks + soft sum-to-aggregate Gaussian (sigma = 497 W, aggregate-minus-devices residual std on SOURCE houses); transitions = geometric dwell priors from SOURCE-house run-length MEANS; amplitudes = calib ON medians floored at 1.2x thr (kettle 2331, microwave 1588, fridge 90, wm 1778, dishwasher 122 W). All priors from source train split + calib only; eval span used only at inference.\n\nRESULT vs v5: min_device_f1 0.000000 vs 0.007188 (COLLAPSE - fridge and dishwasher both exactly 0); mean_device_f1 0.0629 vs 0.0829; pooled_episode_f1 0.0066 vs 0.1298; BUT mean_mae_w 29.48 vs 42.53 (-31%, best yet); worst_mae_w 62.59 vs 101.04 (best yet); mean_nmae 0.0860 vs 0.1240 (best yet); coverage_pred 0.437 vs 0.666 (true 0.258 - best energy accounting yet).\n\nPer-device (v10 vs v5): kettle F1 0.283 vs 0.214 (P 0.383 vs 0.162 - precision DOUBLED, matches 67, preds 175 vs 439), MAE 13.2 vs 25.2; microwave F1 0.007 vs 0.018 (32 preds, 1 match); fridge F1 0.000 vs 0.146 (185 preds, 0 matches); washing_machine F1 0.025 vs 0.007 (matches 44 vs 13, P 0.079, R 0.015 - 3.5x, decode's first real min-device-relevant gain); dishwasher F1 0.000 vs 0.030 (214 preds, 0 matches).\n\nMECHANISM DIAGNOSIS (why 0s): the dwell prior was fit on SOURCE-house run-length MEANS: E_on fridge 35.1, dishwasher 25.4, kettle 21.1, microwave 12.0, wm 4.5 samples. Predicted episodes are therefore ~2.5-3.5 min for fridge/dw, but the EXP-08 GT diagnostic showed eval GT episodes are blip-dominated (fridge p50 30 s = 5 samples, 83% <= 36 s; dw p50 30 s): duration ratio ~7 > the frozen band [1/3, 3] -> EVERY episode rejected. Root cause: heavy-tailed run-length distributions - the MEAN is set by rare long cycles while the GT-matching structure is the MEDIAN (house_1-pre audit: fridge run_p50 5 samples, wm 2). The geometric mean-fit is the wrong robust statistic, not a wrong mechanism: kettle (whose source mean happens to be closer to its GT median) and wm (E_on 4.5 ~= GT 4) improved exactly as the mechanism predicts.\n\nWHAT IS GENUINE AND KEEPABLE IN DESIGN MEMORY: (1) joint decoding + aggregate consistency produces the best energy accounting of any run (coverage 0.437 vs true 0.258; MAE -31%) - the sum constraint works; (2) precision improved where posteriors are good (kettle P 0.383 - the decoder suppresses v5's spurious flicker episodes 439 -> 175); (3) wm's first mechanism-level gain (13 -> 44 matches). The failure is ONE parameter: the location statistic of the dwell fit.\n\nNEXT (EXP-11, single knob): median-based dwell statistic - pool SOURCE-house run lengths per device, p_cont = 1 - 2^(-1/median) (median-matched geometric), fallbacks unchanged. Predicted episode lengths then track the blip-dominated GT structure (~2-6 samples) instead of the tail. No other changes.","title":"v10 FHMM Viterbi decode: coherent but durations 7x too long","summary":"Decode works: kettle F1 0.283, wm 0.025 (3.5x), MAE -31%, coverage 0.437. But fridge+dw F1 = 0: mean-fit dwell E_on 35/25 samples vs GT p50 ~5 -> duration band rejects all. Median-fit is the fix. Discard on primary 0.","timestamp":1790450381273,"segment":0,"confidence":14.376000000000012,"asi":{"hypothesis":"Exact factorial-HMM Viterbi decode with source dwell priors and sum-to-aggregate consistency improves episode F1 over per-sample gating","rollback_reason":"min_device_f1 collapsed to 0: mean-based dwell fit gives fridge/dw E_on 35/25 samples vs blip-dominated GT p50 ~5 -> duration band rejects every episode; but energy accounting (MAE -31%, coverage 0.437) and kettle/wm F1 improved - mechanism sound, one statistic wrong","next_action_hint":"v11: median-based dwell statistic p_cont = 1 - 2^(-1/median) on pooled source run lengths; expect fridge/dw episodes to shorten to GT-like 2-6 samples; no other changes"}}
{"run":11,"commit":"7e1d46c","metric":0.002147,"metrics":{"mean_device_f1":0.150116,"pooled_episode_f1":0.121577,"mean_mae_w":29.2581,"worst_mae_w":62.624,"mean_nmae":0.085309,"coverage_pred_share":0.436832,"coverage_true_share":0.258188,"kettle_mae_w":14.5,"microwave_mae_w":13.4,"fridge_mae_w":36.7,"washing_machine_mae_w":62.6,"dishwasher_mae_w":19.1,"kettle_f1":0.302,"dishwasher_f1":0.002,"washing_machine_f1":0.335,"microwave_f1":0.017,"fridge_f1":0.094,"ft_pretrain_val_mse_pre":0.14412,"ft_pretrain_val_mse_post":0.14412},"status":"discard","description":"EXP-11 v11 = v10's factorial-HMM Viterbi decode with ONE knob changed: the per-chain geometric dwell prior fit on pooled SOURCE-house run-length MEDIANS (p_cont = 1 - 2^(-1/median)) instead of means. Net/training identical to v5 (same seed, same pretrain curves). Priors: sigma 497 W; amps kettle 2331/microwave 1588/fridge 90/wm 1778/dw 122 W; med_on kettle 23.0/microwave 9.0/fridge 29.0/wm 2.0/dishwasher 14.0 samples; med_off 29-35. All from source train split + calib; eval span inference-only.\n\nRESULT vs v5: min_device_f1 0.002147 vs 0.007188 (regressed - min device switched from wm to dishwasher); mean_device_f1 0.1501 vs 0.0829 (+81%, best yet); pooled_episode_f1 0.1216 vs 0.1298 (-6%); mean_mae_w 29.26 vs 42.53 (-31%, best yet); worst_mae_w 62.62 vs 101.04 (best yet); mean_nmae 0.0853 vs 0.1240 (-31%, best yet); coverage_pred 0.437 vs 0.666 (true 0.258).\n\nPer-device (v11 vs v5): washing_machine F1 0.335 vs 0.007 (matches 806 vs 13, P 0.435, R 0.272 - the decode's headline: the wm head's \"blindness\" was a GATING artifact, not posterior absence; short dwell + aggregate consistency aligns its firing with the aggregate 866 W wm signature); kettle F1 0.302 vs 0.214 (P 0.348, R 0.268, MAE 14.5); fridge F1 0.094 vs 0.146 (P 0.412 vs 0.189 - precision 2.2x - but R 0.053 vs 0.119: 3623 preds of ~29-40 samples vs GT p50 5-sample fragments; recall still capped by cross-house dwell mismatch); microwave F1 0.017 ~ 0.018; dishwasher F1 0.002 vs 0.030 (510 preds, 2 matches: source med_on 14 samples vs house_1 dw GT ~5 samples, and the dw posterior fires at wrong times - v5's dw \"F1 0.030\" was 44 lucky matches from threshold-0.05 flicker, itself near-noise).\n\nWHY DISCARD: the frozen primary (30d min_device_f1) regressed 0.0072 -> 0.0021. Per the task's standing rule (keep only on genuine primary improvement; ties discard), a mechanism that improves 4/5 devices and every regression metric but lowers the min-device primary is still a discard. The decision-metric choice itself (min vs mean) is the user's to revisit - flagged, not acted on.\n\nDESIGN MEMORY (the decode family is now the strongest mechanism found): (1) joint decode + sum constraint = best energy accounting of all 11 runs (MAE -31%, coverage 0.437); (2) duration alignment via median dwell turned wm from worst device (0.007) to best (0.335); (3) remaining bottleneck = cross-house dwell-structure mismatch: SOURCE medians (fridge 29, dw 14) reflect source houses' threshold-relative channel structure, while house_1's channels fragment differently (audit: house_1-pre fridge run_p50 5, dw ~5) - the prior transfers only where structures match (wm: 2 vs 4 OK).\n\nNEXT (EXP-12, single knob): calib-corrected dwell prior - measure complete (edge-truncation-free) run lengths inside the 5 calib windows per device (house_1 PRE-split, the SAME sanctioned data budget as gates/amps); when >= 8 complete runs observed, use the calib median for that device's dwell prior, else keep the source median. Expect fridge/dw medians to drop toward house_1's ~5-sample structure, lifting fridge recall and dw F1. No eval-span data, no new data budget.","title":"v11 median dwell: wm F1 47x, MAE -31%, but dw min drops","summary":"Median-fit dwell fixed duration alignment: wm F1 0.007->0.335 (806 matches), kettle 0.302, fridge P 0.412, MAE 29.3 (-31%). But primary min = dishwasher 0.0021 < v5 0.0072 (source med 14 vs house_1 ~5). Discard per frozen metric.","timestamp":1790450500082,"segment":0,"confidence":8.224256292906173,"asi":{"hypothesis":"Median-based dwell statistic aligns predicted episode durations with the blip-dominated GT structure and lifts episode F1 across devices","rollback_reason":"Primary (min_device_f1) regressed 0.0072->0.0021: dishwasher F1 0.002 (source med_on 14 samples vs house_1 ~5; blind posterior). Improves 4/5 devices + all regression metrics but loses on the frozen min metric","next_action_hint":"v12: calib-corrected dwell prior - complete-run medians inside the 5 calib windows per device (>=8 runs threshold), else source median; expect fridge/dw medians toward house_1's ~5-sample structure"}}
{"run":12,"commit":"7e1d46c","metric":0.002147,"metrics":{"mean_device_f1":0.150116,"pooled_episode_f1":0.121577,"mean_mae_w":29.2581,"worst_mae_w":62.624,"mean_nmae":0.085309,"coverage_pred_share":0.436832,"coverage_true_share":0.258188,"kettle_mae_w":14.5,"microwave_mae_w":13.4,"fridge_mae_w":36.7,"washing_machine_mae_w":62.6,"dishwasher_mae_w":19.1,"kettle_f1":0.302,"dishwasher_f1":0.002,"washing_machine_f1":0.335,"microwave_f1":0.017,"fridge_f1":0.094,"ft_pretrain_val_mse_pre":0.14412,"ft_pretrain_val_mse_post":0.14412},"status":"discard","description":"EXP-12 v12 = v11 + calib-corrected ON dwell prior (complete edge-truncation-free run medians inside the 5 calib windows per device, >= 8 runs threshold; else source median). Implementation note: first attempt crashed (ctx['calib'][dev] is a DICT {'mains_win','device_win'} with a session axis, not a list of sessions - fixed to iterate the session axis; crash cost one failed bench, no log entry).\n\nRESULT: bit-identical to v11 on every metric (min_device_f1 0.002147, mean 0.150116, pooled 0.121577, MAE 29.2581 - all 6 decimals equal). Reason discovered post-hoc: calib medians came out kettle 8.5/microwave 2.0/fridge 4.0/wm 4.0/dishwasher 5.0 samples (all >= 8 complete runs, all USED), but p_cont = 1 - 2^(-1/median) gives 0.078/0.293/0.159/0.159/0.129 - ALL below the VP_PCONT_MIN = 0.5 clamp -> every ON-side transition = log(0.5), exactly as in v11 (source medians 23/9/29/2/14 -> 0.030/0.074/0.024/0.293/0.048, also all clamped). The entire dwell-prior mechanism has been INERT since v11; the Viterbi degenerated to a per-position joint MAP over emissions.\n\nATTRIBUTION CORRECTION (run 11 log overstated the dwell prior): v11's wm 47x / kettle +41% / precision gains came from the EMISSION design - logit-shifted posteriors (v5 decision boundary preserved) + soft sum-to-aggregate consistency + per-state constant amplitudes - with UNIFORM transitions. The v10->v11 change that mattered was UNDOING v10's sticky ON transitions (source mean-fit p_cont 0.97 -> clamped 0.5), not the median statistic per se. The dwell mechanism remains UNTESTED in its operative form.\n\nCALIB DIAGNOSTIC GOLD (calib-only evidence, for the amplitude decision): calib ON-watt p25/p50/p75/p90 - kettle 2302/2331/2361/2392 (tight); microwave 1571/1588/1602/1613 (tight); fridge 88/90/91/95 (tight); washing_machine 339/1778/1957/2004 (low-power mode at p25); DISHWASHER 121/122/2331/2360 - STRONGLY BIMODAL: the calib dw sessions caught both a ~122 W mode and a ~2360 W heating mode. The decode's dw amplitude (calib median 122 W) represents the low mode, so the aggregate constraint barely notices dw ON (122 W << sigma 497 W) - dw states are physics-unconstrained and its blind posterior fires 510 misaligned episodes (P 0.004). This is the concrete mechanism behind dw = min-device at 0.002.\n\nWHY DISCARD: primary unchanged from v11 (0.002147 < v5 0.0072); the intended knob never activated; the run's value is the clamp discovery + the dw amplitude diagnosis, not the metric.\n\nNEXT (EXP-13, single knob): make the dwell prior OPERATIVE - switch the parameterization to the geometric mean-matched form p_cont = 1 - 1/median (mean run length = calib median: kettle 8.5 -> p 0.882, dw 5 -> 0.8, fridge 4 -> 0.75, wm 4 -> 0.75, microwave 2 -> 0.5, OFF ~33 -> 0.97), all >= the 0.5 floor so nothing is clamped. Emissions unchanged -> clean A/B: any delta is purely temporal coupling. Watch: sticky OFF (entry cost -3.4 nats vs -0.69) may suppress weak microwave/dw firing; if so v14 isolates the OFF side back to 0.5. Also queued (v14+, calib-evidence-backed): dw amplitude from the calib ON p75 (2331 W heating mode) instead of the median (122 W) - one device, one statistic, calib-only.","title":"v12 calib dwell no-op: p_cont clamp masked the knob","summary":"Calib medians measured (fridge 4, dw 5, kettle 8.5) but 1-2^(-1/med) <= 0.293 < clamp 0.5 -> transitions identical to v11 -> bit-identical metrics. Discovery: v11 gains were emissions, not dwell.","timestamp":1790450868888,"segment":0,"confidence":6.951644100580269,"asi":{"hypothesis":"Calib-window complete-run medians correct cross-house dwell mismatch and lift fridge/dw episode alignment","rollback_reason":"No-op: p_cont = 1-2^(-1/med) <= 0.293 for all devices, clamped to 0.5 = v11's inert value -> bit-identical metrics; primary still 0.0021 < v5 0.0072. Value = clamp discovery + dw bimodal calib evidence","next_action_hint":"v13: operative dwell prior p_cont = 1 - 1/calib_median (mean-matched, nothing clamped); emissions unchanged; if OFF stickiness suppresses microwave/dw, v14 flips OFF side to 0.5; then v15 dw amp from calib ON p75"}}
{"run":13,"commit":"7e1d46c","metric":0,"metrics":{"mean_device_f1":0.0649,"pooled_episode_f1":0.00743,"mean_mae_w":29.4134,"worst_mae_w":62.5285,"mean_nmae":0.085762,"coverage_pred_share":0.38729,"coverage_true_share":0.258188,"kettle_mae_w":14.1,"microwave_mae_w":12.3,"fridge_mae_w":39.4,"washing_machine_mae_w":62.5,"dishwasher_mae_w":18.7,"kettle_f1":0.285,"dishwasher_f1":0,"washing_machine_f1":0.033,"microwave_f1":0.007,"fridge_f1":0,"ft_pretrain_val_mse_pre":0.14412,"ft_pretrain_val_mse_post":0.14412},"status":"discard","description":"EXP-13 v13 = v11/v12 decode with the dwell prior made OPERATIVE: p_cont = 1 - 1/median (geometric mean run length = median) on CALIB complete-run medians (all 5 devices used calib; on_p_cont kettle 0.882/fridge 0.75/wm 0.75/dishwasher 0.8/microwave 0.5) and SOURCE OFF medians (off_p_cont ~0.97). Emissions identical to v11/v12 -> clean A/B on temporal coupling alone.\n\nRESULT vs v11 (uniform transitions): min_device_f1 0.000000 vs 0.002147 (fridge AND dishwasher exactly 0 again); mean_device_f1 0.0649 vs 0.1501; pooled_episode_f1 0.0074 vs 0.1216; mean_mae_w 29.41 (unchanged - energy accounting insensitive to decode coupling); coverage_pred 0.387 vs 0.437.\n\nPer-device (v13 vs v11): kettle F1 0.285 vs 0.302 (178 preds vs 230); microwave 0.007 vs 0.017 (34 preds vs 88 - the predicted OFF-stickiness suppression of weak firing, exactly as flagged in the v13 docstring risk); fridge 0.000 vs 0.094 (252 preds of long episodes vs 3623 short - sticky ON re-extends the inverted fridge head's runs past the duration band, v10's failure mode); washing_machine 0.033 vs 0.335 (589 vs 1853 preds - wm's 806 matches came from FREQUENT SHORT episodes, which stickiness destroys); dishwasher 0.000 vs 0.002 (221 vs 510).\n\nMECHANISM CONCLUSION (3-regime comparison, now closed): (a) v10 sticky-ON source-mean (p 0.97): fridge/dw 0, pooled 0.0066; (b) v11/v12 UNIFORM (all p_cont clamped to 0.5 -> per-position joint MAP): fridge 0.094, wm 0.335, pooled 0.1216 - BEST; (c) v13 operative both-sided: fridge/dw 0, pooled 0.0074. The gate-shifted posterior + aggregate-consistency emissions fire in GT-like blips on their own; ANY temporal stickiness lengthens episodes beyond the frozen duration band [1/3, 3]. The dwell/kinetics prior idea (analog-problems S2.3, backlog i16) is REFUTED for this benchmark in both directions; the factorial joint MAP (i15) is VALIDATED as the vehicle. Do not revive dwell priors without a changed emission scale (e.g., unclamped posteriors would rebalance entry/exit costs).\n\nWHY DISCARD: primary collapsed to 0. The run's value is closing the dwell-prior question with a clean single-knob A/B.\n\nNEXT (EXP-14, single knob on the WINNING configuration): v14 = v11/v12 uniform-transition decode + DISHWASHER AMPLITUDE FIX - amp statistic for all devices = calib ON-watt p75 instead of median (calib-only evidence from run 12's diagnostic: dw calib ON watts are BIMODAL 121/122/2331/2360 - the median 122 W is the low mode, leaving dw states physics-unconstrained by the aggregate penalty (122 W << sigma 497 W) and its blind posterior fires 510 misaligned episodes; p75 = 2331 W forces dw episodes to align with ~2.3 kW aggregate steps). Tight devices barely move (kettle 2361, microwave 1602, fridge 91); wm 1778->1957. Expected: dw P rises sharply; watch dw MAE (episodes now carry 2331 W - wrong-time firing is 19x more expensive) and the kettle/dw state aliasing (both amps ~2331 - only posteriors can separate them).","title":"v13 operative dwell prior refuted: sticky both sides -> 0s","summary":"Operative dwell (ON 0.75-0.88 calib-matched, OFF 0.97) collapses: fridge+dw F1 exactly 0 (long episodes again), wm 0.335->0.033, microwave suppressed. Uniform transitions (v11/v12) best of 3 regimes. Dwell prior refuted.","timestamp":1790450973993,"segment":0,"confidence":6.951644100580269,"asi":{"hypothesis":"Operative calib-matched dwell priors (mean-matched stickiness) improve episode coherence over uniform transitions","rollback_reason":"Sticky transitions (either direction) lengthen episodes past the GT duration band: fridge/dw exactly 0, wm 10x worse - uniform transitions (v11/v12) are the best of 3 regimes; dwell prior refuted for this emission scale","next_action_hint":"v14: uniform-transition decode + amp statistic median->calib ON p75 (dw 122->2331 W low-mode fix, aggregate-constrains dw episodes); watch dw MAE and kettle/dw aliasing"}}
