{"run":6,"commit":"7e1d46c","metric":0.008065,"metrics":{"mean_device_f1":0.057538,"pooled_episode_f1":0.020791,"mean_mae_w":75.0692,"worst_mae_w":120.8998,"mean_nmae":0.218883,"coverage_pred_share":1.202627,"coverage_true_share":0.258188,"kettle_mae_w":30.4,"microwave_mae_w":60.3,"fridge_mae_w":58.7,"washing_machine_mae_w":105,"dishwasher_mae_w":120.9,"kettle_f1":0.15,"dishwasher_f1":0.015,"washing_machine_f1":0.008,"microwave_f1":0.096,"fridge_f1":0.018,"ft_pretrain_val_mse_pre":0.14412,"ft_pretrain_val_mse_post":0.14412},"status":"discard","description":"EXP-06 v6 = v5 + head-only ON-head calibration fine-tune (freeze encoder+power head; FT head_on ~2.3k params on 25 calib windows, per-device masked BCE, LR 1e-3, 60 epochs; gates re-derived from FT-ed head).\n\nMOTIVATION (source-channel audit + pre-FT source-val diagnostics): microwave ON head blind (sig ON p50 0.0), fridge NO separation even in-domain (ON p50 0.49 vs OFF p50 0.49), dishwasher ON/OFF overlap (0.99 vs 0.28), wm overlap (0.25/0.99 vs 0.02/0.63) - while kettle transferred (ON 1.0 vs OFF 0.0). Audit also KILLED two planned ideas with evidence: predict-side duration filter (wm/fridge ON labels are 2-sample-blip dominated in ALL houses: run_p50=2 samples, house_2 wm p50_on_w=272W, house_5=498W, house_1-pre=245W -> GT episodes are short; a duration filter would destroy recall) and calib threshold sweep (calib windows are session-centered/ON-heavy, sweep inherits that bias).\n\nRESULT: catastrophic secondary collapse. Post-FT source-val sigmoid saturates - fridge/wm/dishwasher OFF p50 = 1.0/1.0/1.0 (pre-FT: 0.49/0.02/0.28); calib_bce 12.47 -> 0.55 (memorization regime). Gates recalibrated to kettle 0.88 / microwave 0.86 / fridge 0.85 / wm 0.95 / dishwasher 0.85 (v5: 0.43/0.05/0.23/0.77/0.05).\n\nPer-device (v6 vs v5): kettle F1 0.150 vs 0.214, MAE 30.4 vs 25.2; microwave F1 0.096 vs 0.018, MAE 60.3 vs 12.6 (THE one genuine gain: R 0.237, 62/1032 - head FT did repair microwave); fridge F1 0.018 vs 0.146, MAE 58.7 vs 43.2 (R 0.119 -> 0.010, preds 17564 -> 2488 at gate 0.85); washing_machine F1 0.008 vs 0.007, MAE 105.0 vs 101.0 (matches 14 vs 13 - the entire nominal primary improvement is +1 episode); dishwasher F1 0.015 vs 0.030, MAE 120.9 vs 30.7 (preds exploded 1750 -> 12404, P 0.008). nMAE: kettle 0.089, microwave 0.176, fridge 0.171, wm 0.306, dishwasher 0.353.\n\nAggregates (v6 vs v5): min_device_f1 0.008065 vs 0.007188; mean_device_f1 0.0575 vs 0.0829; pooled_episode_f1 0.0208 vs 0.1298 (-84%); mean_mae_w 75.07 vs 42.53 (+76%); worst_mae_w 120.9 vs 101.0; mean_nmae 0.2189 vs 0.1240; coverage_pred 1.2026 vs 0.6664 (predicts MORE watts than the aggregate - physically impossible); coverage_true 0.2582 (unchanged).\n\nWHY DISCARD DESPITE PRIMARY NOMINALLY IMPROVING: +0.0009 min_device_f1 = one extra matched wm episode (13 -> 14 of 2966) - statistical noise; every tracked secondary regressed. Keeping would overfit the single primary number and enshrine a strictly worse model (user constraint: do not overfit to the benchmarks). Mechanism not invalidated - execution was.\n\nROOT CAUSE: calib FT reused PRETRAIN pos_weight (wm/microwave capped 50 for source rarity) on CALIB positions where fridge is 76% ON / wm 72% ON / dishwasher 84% ON -> head pushed toward constant-ON -> sigmoid saturation; 60 epochs x LR 1e-3 on 25 windows amplified it; gate recalibration then amplified the saturated head's damage.\n\nGUARDS HONORED: calib = target-house pre-split sessions only; power head frozen during FT (val_mse_full 0.14412 at pretrain end == post-FT by construction); 30d min_device_f1 unchanged as decision metric; no eval-span-derived parameters anywhere; no duration filter / threshold sweep shipped (audit-refuted).\n\nNEXT (EXP-07): re-run head-only FT correctly - per-device pos_weight computed on CALIB positions (kettle ~5.3, microwave ~10.1, fridge/wm/dishwasher -> 1.0), LR 3e-4, <=15 epochs, weight decay, early-stop saturation guard (any device source-val OFF-sig p50 > 0.5 -> stop); recycle microwave mechanism; keep v5 gates for kettle if its calibration degrades.","title":"v6 head-only ON FT saturates; pooled F1 collapses","summary":"Head-only ON FT saturated: source-val sig OFF p50=1.0, gates 0.85-0.95, fridge R 0.010, MAE 75.1W, cov 1.20x. min_f1 +0.0009 = 1 extra match (noise). Discard.","timestamp":1790449331705,"segment":0,"confidence":null,"asi":{"hypothesis":"Head-only ON-head calibration fine-tune (freeze encoder+power head) repairs the three ON heads that are uncorrelated with house_1 truth without the v3 whole-net drift","rollback_reason":"Primary gain is noise-level (+1 matched wm episode); pooled F1 -84%, MAE +76%, coverage 1.20x of aggregate; FT saturated (source-val sig OFF p50 1.0) because pretrain pos_weight (up to 50) was applied to ON-heavy calib positions","next_action_hint":"EXP-07: same head-only FT but per-device pos_weight from CALIB positions (kettle 5.3, microwave 10.1, others 1.0), LR 3e-4, <=15 epochs, weight decay, early-stop when any source-val OFF-sig p50 > 0.5; microwave repair (F1 0.018->0.096) is real and worth recycling"}}
{"run":7,"commit":"7e1d46c","metric":0.006154,"metrics":{"mean_device_f1":0.069385,"pooled_episode_f1":0.072273,"mean_mae_w":44.9415,"worst_mae_w":94.7869,"mean_nmae":0.131038,"coverage_pred_share":0.701845,"coverage_true_share":0.258188,"kettle_mae_w":29.3,"microwave_mae_w":20.3,"fridge_mae_w":44,"washing_machine_mae_w":94.8,"dishwasher_mae_w":36.4,"kettle_f1":0.183,"dishwasher_f1":0.023,"washing_machine_f1":0.006,"microwave_f1":0.054,"fridge_f1":0.081,"ft_pretrain_val_mse_pre":0.14412,"ft_pretrain_val_mse_post":0.14412},"status":"discard","description":"EXP-07 v7 = v5 + GUARDED head-only ON FT (the v6 fixes applied): per-device pos_weight from CALIB positions (kettle 4.7, microwave 8.8, fridge/wm/dishwasher 1.0 - vs v6's pretrain pos_weight up to 50), AdamW LR 3e-4 + weight decay 1e-4, saturation guard = trip when head weight norm > 2.5x init OR any device's calib OFF-sigmoid p50 rises > 0.15 over its pre-FT base; restore last-passing snapshot; pre-FT head = safe fallback.\n\nGUARD BEHAVIOR: init head norm 1.72, cap 4.30; calib OFF p50 base [0.0, 0.0, 0.27, 0.88, 0.0]; calib_bce epoch 0 = 3.18 (v6 started at 12.47 - the pos_weight fix worked); TRIP at ft epoch 7 on fridge off-p50 (0.42 > cap 0.42); snapshot from epoch ~6 restored (norm 1.71). Guard fired correctly - no v6-style saturation (post-FT source-val OFF p50: kettle 0.0, microwave 0.01, fridge 0.75, wm 0.01, dishwasher 0.51 - vs v6's all-1.0).\n\nRESULT vs v5: min_device_f1 0.006154 vs 0.007188 (REGRESSED - decision metric); mean_device_f1 0.0694 vs 0.0829; pooled_episode_f1 0.0723 vs 0.1298; mean_mae_w 44.94 vs 42.53; worst_mae_w 94.79 vs 101.04 (best so far); mean_nmae 0.1310 vs 0.1240; coverage_pred 0.702 vs 0.666.\n\nPer-device (v7 vs v5): kettle F1 0.183 vs 0.214, MAE 29.3 vs 25.2 (gate 0.43->0.47); microwave F1 0.054 vs 0.018, MAE 20.3 vs 12.6 (SECOND independent confirmation: head FT reliably repairs microwave - 15 matches vs 3, 298 preds vs 73; though the post-FT head is calib-blind sig 0/0/0, eval improved anyway); fridge F1 0.081 vs 0.146, MAE 44.0 vs 43.2 (THE regression: FT raised fridge calib OFF p50 0.27->0.40 (still inverted sigOFF>sigON) -> gate 0.23->0.36 -> R 0.119->0.060, matches 3325->1680); washing_machine F1 0.006 vs 0.007 (gate 0.76, unchanged pathology); dishwasher F1 0.023 vs 0.030 (matches 51 vs 44 but preds 3063 vs 1750).\n\nWHY DISCARD: primary regressed; the guard contained saturation but could not contain CALIBRATION DRIFT - 7 full-batch steps at LR 3e-4 sufficed to move the fridge head's OFF distribution +0.13, and the midpoint gate rule amplified that into a 2x recall loss. Net reshuffle: microwave +0.036 vs fridge -0.065.\n\nMECHANISM INSIGHT (carries to EXP-08): the gates are hyper-sensitive to head changes because they are derived from the head's own calib quantiles; any head repair necessarily moves those quantiles. Changed assumption for retry: anchor the FT-ed head to its PRE-FT source-val sigmoid outputs (distillation-style consistency term L = BCE_calib + lambda * MSE(sig_ft(x_val), sig_pre(x_val)), lambda ~ 5, anchor subset ~2000 val windows) so the head nudge is calibration-preserving - v6 failed via saturation, v7 failed via drift; the anchor targets exactly that degree of freedom. Microwave's cross-run-consistent gain (0.018 -> 0.054-0.096) is the prize worth anchoring for.\n\nGUARDS HONORED: calib = target-house pre-split sessions only; power head frozen (val_mse_full 0.14412 pre == post by construction); no eval-derived parameters; audit-refuted ideas (duration filter, calib threshold sweep) still not shipped.","title":"v7 guarded head FT: drift moves gates, fridge recall halves","summary":"Guard tripped at ft epoch 7 (fridge off-p50); snapshot restore kept drift that pushed gate 0.23->0.36, fridge F1 0.146->0.081. min_f1 0.0062 < v5 0.0072. Discard.","timestamp":1790449477511,"segment":0,"confidence":8.196123147092367,"asi":{"hypothesis":"Guarded head-only ON FT (calib pos_weight, LR 3e-4+wd, norm/off-p50 tripwires) repairs ON heads without v6 saturation","rollback_reason":"Primary regressed 0.007188->0.006154; guard contained saturation but 7 steps of calibration drift moved fridge gate 0.23->0.36 and halved fridge recall; gate rule amplifies any head change","next_action_hint":"EXP-08: anchor-FT - L = BCE_calib + 5*MSE(sig_ft(x_val_anchor), sig_pre(x_val_anchor)) on ~2000 source-val windows so head repair is calibration-preserving; keep gate rule; microwave gain is cross-run consistent (0.018->0.054 in v7, ->0.096 in v6)"}}
{"run":8,"commit":"7e1d46c","metric":0.008436,"metrics":{"mean_device_f1":0.062254,"pooled_episode_f1":0.051804,"mean_mae_w":45.2282,"worst_mae_w":93.4662,"mean_nmae":0.131874,"coverage_pred_share":0.707471,"coverage_true_share":0.258188,"kettle_mae_w":29.8,"microwave_mae_w":20.6,"fridge_mae_w":44.1,"washing_machine_mae_w":93.5,"dishwasher_mae_w":38.1,"kettle_f1":0.175,"dishwasher_f1":0.021,"washing_machine_f1":0.008,"microwave_f1":0.05,"fridge_f1":0.057,"ft_pretrain_val_mse_pre":0.14412,"ft_pretrain_val_mse_post":0.14412},"status":"discard","description":"EXP-08 v8 = v5 + ANCHORED head-only ON FT: kept v7's guard set (calib pos_weight kettle 4.7/microwave 8.8/rest 1.0, AdamW LR 3e-4 wd 1e-4, norm 2.5x + off-p50 +0.15 tripwires, snapshot restore) and added distillation anchor L_ft = BCE_calib + 5.0 * MSE(sig_ft(x_anchor), sig_pre(x_anchor)), x_anchor = 2000 source-val windows, sig_pre = frozen pre-FT sigmoids.\n\nANCHOR RESULT: anchor_mse stayed 0.0004 (epoch 0) - the source-val sigmoid map barely moved - YET the fridge calib off-p50 still rose 0.27 -> 0.45 (trip at ft epoch 6, same tripwire as v7) and the restored snapshot still moved the fridge gate 0.23 -> 0.38. MECHANISM (closes the head-FT family): the anchor pins the head on SOURCE-house inputs, but calib windows are TARGET-house (house_1) inputs - out-of-distribution for the anchor - and the gates are derived from exactly those target-house calib quantiles. No source-side regularizer can pin target-house head behavior; only target-house labels could, and we have just 25 windows of them (v3's whole-net FT showed they overfit when used aggressively).\n\nRESULT vs v5: min_device_f1 0.008436 vs 0.007188 (nominal best so far); mean_device_f1 0.0623 vs 0.0829; pooled_episode_f1 0.0518 vs 0.1298 (-60%); mean_mae_w 45.23 vs 42.53; worst_mae_w 93.47 vs 101.04 (best so far); mean_nmae 0.1319 vs 0.1240; coverage_pred 0.707 vs 0.666.\n\nPer-device (v8 vs v5): kettle F1 0.175 vs 0.214 (gate 0.43->0.48); microwave F1 0.050 vs 0.018 (3rd confirmation of the repair, but anchor dampened it: v6 0.096, v7 0.054, v8 0.050); fridge F1 0.057 vs 0.146 (gate 0.23->0.38, R 0.042, matches 1182 vs 3325); washing_machine F1 0.008 vs 0.007 (15 vs 13 matches - the entire nominal primary gain is +2 episodes); dishwasher F1 0.021 vs 0.030 (preds 4193 vs 1750). nMAE: kettle 0.087, microwave 0.060, fridge 0.129, wm 0.273, dishwasher 0.111.\n\nWHY DISCARD DESPITE NOMINAL PRIMARY GAIN: +0.00125 = 2 extra matched wm episodes of 2966 (noise); pooled F1 -60%, mean_device_f1 -25%. Third consecutive head-FT variant (v6 unguarded, v7 guarded, v8 anchored) redistributes F1 across devices while pooled F1 always drops and the primary wiggles at noise level. Family closed on mechanism: calib supervision (25 house_1 windows) is too weak to repair heads without breaking others, and the gate rule amplifies every head change. Keeping would enshrine a holistically worse model - exactly the benchmark-overfitting the task forbids.\n\nGUARDS HONORED: calib = target-house pre-split only; anchor = source-val only (no target leakage); power head frozen (val_mse_full 0.14412 unchanged by construction); no eval-derived parameters; audit-refuted ideas (duration filter, threshold sweep) still not shipped.\n\nNEXT (EXP-09): pivot away from head modification entirely. Diagnose the wm bottleneck structurally first (wm is the min device: F1 0.007, R 0.004, matches 13/2966 ~= chance-level onset alignment) - inspect the eval GT wm episode-duration structure (diagnostic only, no parameters from it) vs the source audit's 2-sample-blip domination (house_1-pre wm run_p50 = 2 samples, 34390 runs); then choose between (a) mechanisms that help ALL devices (i3 longer pretrain, i10 energy-balance) and (b) documenting a structural cap if wm GT is ~undetectable blip noise. No more head-FT retries without a genuinely new assumption.","title":"v8 anchored FT: anchor cannot pin target-house behavior","summary":"Anchor MSE 0.0004 on source val but fridge calib off-p50 still drifted 0.27->0.45, gate 0.23->0.38, fridge F1 0.146->0.057. min_f1 +0.0012 = wm +2 matches (noise); pooled -60%. Discard.","timestamp":1790449657254,"segment":0,"confidence":11.519230769230761,"asi":{"hypothesis":"Distillation anchor on source-val sigmoids makes the head-FT calibration-preserving so gates stay at v5 values while microwave repairs","rollback_reason":"Anchor pinned source behavior (MSE 0.0004) but calib is target-house and OOD for the anchor; fridge gate still moved 0.23->0.38, pooled F1 -60%; primary gain = 2 wm episodes (noise). Head-FT family closed after 3 mechanistic refutations","next_action_hint":"EXP-09 pivot: diagnose wm GT episode structure (eval GT 2966 episodes vs source-audit 2-sample blip domination) to establish whether wm is structurally undetectable; then i3 longer pretrain or i10 energy-balance; no head-FT retries"}}
{"run":9,"commit":"7e1d46c","metric":0.007565,"metrics":{"mean_device_f1":0.080388,"pooled_episode_f1":0.041373,"mean_mae_w":54.451,"worst_mae_w":119.179,"mean_nmae":0.158765,"coverage_pred_share":0.882247,"coverage_true_share":0.258188,"kettle_mae_w":16.8,"microwave_mae_w":10.7,"fridge_mae_w":50.4,"washing_machine_mae_w":75.2,"dishwasher_mae_w":119.2,"kettle_f1":0.32,"dishwasher_f1":0.015,"washing_machine_f1":0.008,"microwave_f1":0.017,"fridge_f1":0.042,"ft_pretrain_val_mse_pre":0.15197,"ft_pretrain_val_mse_post":0.15197},"status":"discard","description":"EXP-09 v9 = v5 with i3 (longer source fit): EPOCHS 12 -> 24, N_TRAIN_WINDOWS 40000 -> 80000. Everything else identical (same seed, LR, pos_weight cap 50, gates, calibration). No eval-derived parameters.\n\nTRAINING EVIDENCE: BCE kept descending 27.7 (e0) -> 5.97 (e23), ~2.4x lower than v5's end (8.38); val_mse_on fluctuates 0.003-0.006 (plateau region), val_mse_full noisy 0.13-0.19. So the source fit DID improve - the hypothesis was that better fit lifts all heads.\n\nRESULT vs v5: min_device_f1 0.007565 vs 0.007188 (nominal +5.3%); mean_device_f1 0.0804 vs 0.0829; pooled_episode_f1 0.0414 vs 0.1298 (-68%); mean_mae_w 54.45 vs 42.53 (+28%); worst_mae_w 119.18 vs 101.04; mean_nmae 0.1588 vs 0.1240; coverage_pred 0.882 vs 0.666 (now OVER-predicts energy by 3.4x of aggregate share).\n\nPer-device (v9 vs v5): kettle F1 0.320 vs 0.214, MAE 16.8 vs 25.2, matches 90 vs 71 (P 0.342, R 0.301) - GENUINE improvement, consistent with kettle being the best-transferring head (channel audit: kettle signature matches across houses). microwave F1 0.017 vs 0.018 (MAE 10.7 improved). fridge F1 0.042 vs 0.146, matches 798 vs 3325. washing_machine F1 0.008 vs 0.007, matches 13 vs 13 (IDENTICAL match count). dishwasher F1 0.015 vs 0.030, MAE 119.2 vs 30.7.\n\nWHY DISCARD: the primary gain is wm F1 arithmetic from FEWER predictions (651 -> 471 episodes, same 13 matches -> P 0.020 -> 0.028), not mechanism. Meanwhile pooled F1 -68%, MAE +28%, coverage 3.4x over. i3 hypothesis (better source fit lifts all heads) is REFUTED at 2x scale: 3 of 5 devices got worse.\n\nMECHANISM (why more training hurt): the pos_weight-capped BCE (up to 50) pushes rare-device ON-heads toward constant-ON with more optimization - calib diagnostics show wm head SATURATED (sigON p50 1.00, sigOFF p50 0.98, gate 0.95 vs v5's 0.77) and fridge separation collapsed (sigON p50 0.13, gate 0.18). The dishwasher POWER head nearly died (calib ON median 16 W vs v5's 228 W) - consistent with the channel audit: house_2 dishwasher 1984 W vs house_5 97 W signatures teach contradictory amplitude, and 2x more epochs amplify the conflict. GENUINE SIGNAL to keep in the design memory: kettle (well-separated, cross-house-consistent) benefits strongly from longer fit - future mechanisms that manage the fit-saturation tradeoff (weight averaging, per-head capacity, loss reshaping) could capture kettle's gain without the saturation damage.\n\nGUARDS HONORED: calib = target-house pre-split only; source val untouched for training; no eval-derived parameters.\n\nNEXT: user directed backlog expansion from docs/research/analog-problems.md + transfer-applicability-audit.md before next mechanism pick.","title":"v9 i3 2x epochs+windows: kettle up, rare heads saturate","summary":"Kettle F1 0.214->0.320 (real), but wm/dw heads saturate (wm sigOFF p50 0.98, gate 0.95; dw power head 16W median), pooled F1 -68%, MAE +28%. Primary +0.0004 = n_pred arithmetic. Discard.","timestamp":1790450007411,"segment":0,"confidence":14.376000000000012,"asi":{"hypothesis":"Doubling pretrain data+epochs improves source fit and lifts all device heads via the same gate rule","rollback_reason":"Nominal primary gain = wm n_pred arithmetic (13 matches both runs); pooled F1 -68%, MAE +28%; pos_weight-capped BCE saturates rare-device ON-heads with longer optimization (wm sigOFF p50 0.98)","next_action_hint":"Kettle gain is real: well-separated heads like more fit. Next mechanisms from research backlog (user-directed): onset/event-based heads, self-training on pre-split target, SWA/weight averaging to capture fit without saturation"}}
