{"run":98,"commit":"2f0ee0f","metric":0.35812,"metrics":{"mean_device_f1_p10":0.343328,"transfer_mean_f1":0.151921,"median_kettle_f1":0.55514,"median_microwave_f1":0.267281,"median_fridge_f1":0.366137,"median_washing_machine_f1":0.246657,"median_dishwasher_f1":0.384353,"b1_events_mined":5260,"b1_enroll_top1_enc":0.84,"b1_enroll_top1_raw":0.65,"b1_cross_house_top1":0.21,"b1_gate_kettle_kept_frac":0.813,"b1_gate_mw_kept_frac":0.853,"b2_probe_mw_iso_mean":0.34,"b2_probe_iso_all_mean":0.61,"device_balanced_mean":0.364557,"house_1_v4_mean":0.538205,"v4_n_pairs":66,"v4_n_houses":20,"fridge_median_delta":-0.004826,"primary_delta":-0.001326},"status":"discard","description":"RUN 98 (discard) - fridge fragment/duration-band family, three variants measured.\n\nMEASURED, GT-only, no model: on eco/house_06 emitting ALL 20W-floor fridge events scores F1 0.742 (P 0.837 R 0.666) while the incumbent amp+dur band keeps 221/2950 events for F1 0.013. The compressor's steady draw breaks rise/fall pairing into a median 4.0 min fragment (eval-span dur p10/50/90 = 0.7/4.0/28.3 min) and the per-fragment >= pop_dur_lo (10 min) test discards the pieces of a jointly 12-16 min cycle.\n\nVARIANT A - drop the per-fragment duration test (amp band only), pool 5 seeds: primary 0.347223 (seed-2026 screen). eco/house_06 fridge 0.01 -> 0.80 (P 0.88 R 0.74), but eco/house_02 fridge 0.79 -> 0.52 (n_pred 2672 -> 1878, R 0.73 -> 0.41) and pool -0.0122. REFUTED.\n\nVARIANT B - superset: admit a short fragment when its CHAIN fits the duration band, chain cap 0.25x the population's own median inter-cycle spacing. Primary 0.358889, fridge median 0.338061; eco/house_02 preserved 0.79, eco/house_06 only 0.02 (139 pred, chain cap too small to reunite the fragments).\n\nVARIANT C (logged) - same superset with the model's own CHAIN_GAP_S=600 s as the chain cap. Full 5-seed measure: primary 0.358120 (p10 0.343328), device_balanced 0.364557, house_1 0.538205, fridge median 0.366137, kettle 0.555140 / mw 0.267281 / wm 0.246657 / dw 0.384353 - every non-fridge device bit-identical, so the effect is cleanly fridge-only. eco/house_06 still 0.04; refit/house_6 fridge 0.07 -> 0.22; fridge median -0.0048 vs floor. Diff saved at .auto/runs/98_fridge_frag_chain.diff.\n\nMECHANISM (why no variant wins): the model's per-fragment duration test is a COUNTERWEIGHT to the bench's own cycle-merge scale. The bench merges on-cells across gaps at MERGE_S before scoring the cycle duration, and that merge is larger than any fragment chain the model can reconstruct without copying a bench constant. The test therefore splits the mask so distinct cycles never bridge (helps eco/house_02: 0.79) at the price of deleting the fragments of one cycle (hurts eco/house_06: 0.01 vs 0.742 achievable). Opposite per-house effects from one rule, no label-free statistic separates them (event amp p90 226 W vs 77 W, event dur p50 4.0 vs 16.0 min are the filter's own statistic = circular). The previous 'fridge is extractor-bound' verdict is right in OUTCOME (the filter is not a lever) but wrong in CAUSE (the raw events are excellent on eco/house_06).\n\nGT GROUNDWORK for the next device (microwave, worst device, median 0.267281): v4 GT mw cycles are SHORT duty chunks - duration p10/50/90 0.8/1.5/8.6 min on refit/house_6 and 1.0/3.0/7.4 on refit/house_8, with 11-19 percent of consecutive cycles less than 10 min apart; fridge GT is the opposite (12-16 min on / 44-50 min off, ~2400-2800 cycles per 90 days = ~27/day); wm GT 46-130 min and dw GT 90-100 min. So mw merged-event handling (splitting over-long merged events into mark-duration chunks, hypothesis N) is the live lever, not the fridge.","title":"Fridge fragment duration band -> chain at CHAIN_GAP_S (discard)","summary":"Dropping the per-fragment fridge duration test lifts eco/house_06 fridge 0.01->0.80 but costs eco/house_02 0.79->0.52; pool 0.35812 vs incumbent 0.35945.","timestamp":1790509016223,"segment":2,"confidence":2.7063532727039847,"asi":{"hypothesis":"The fridge's per-fragment duration test deletes the fragments of jointly-long compressor cycles; applying the duration band to the chain should recover them without bridging distinct cycles.","rollback_reason":"All three variants land at or below the incumbent (0.347/0.3589/0.3581 vs 0.359446) and below the 0.364623 bar: the fragment filter is a counterweight to the bench's cycle-merge scale, not a bug.","next_action_hint":"Close the fridge family. Take hypothesis N (microwave): GT mw cycles are 1-3 min duty chunks, so split over-long merged mw events into mark-duration chunks instead of rejecting them; refit/house_6 mw is 74 pred / 390 GT with P 0.12 (worst single pair family)."}}
{"run":99,"commit":"2f0ee0f","metric":0.359835,"metrics":{"transfer_mean_f1":0.151921,"b1_events_mined":5260,"b1_enroll_top1_enc":0.84,"b1_enroll_top1_raw":0.65,"b1_cross_house_top1":0.21,"b1_gate_kettle_kept_frac":0.813,"b1_gate_mw_kept_frac":0.853,"b2_probe_mw_iso_mean":0.34,"b2_probe_iso_all_mean":0.61,"mean_device_f1_p10":0.344273,"device_balanced_mean":0.365726,"house_1_v4_mean":0.540104,"median_kettle_f1":0.55514,"median_microwave_f1":0.268743,"median_fridge_f1":0.370963,"median_washing_machine_f1":0.246657,"median_dishwasher_f1":0.384353,"v4_n_pairs":66,"v4_n_houses":20,"fridge_median_delta":0,"primary_delta":0.000389},"status":"discard","description":"Run 99 tested the m34 lever (mw over-long merged events, ideas.md L1706). Three measurements, all sub-bar, incumbent restored.\n(1) CENSUS (temporary per-build print; .scratch/s99_census.txt): the mw gate's duration-rejected population is NOT merged multi-chunk cycles. Events rejected on duration but inside the amp band have dur p50 = 498-2124 s (8-35 min), p90 up to 6008 s (100 min) - foreign long loads - so splitting them (m34 M2) is refuted by measurement and the docstring's 'foreign structure' claim is confirmed on real data. Per-house dispositions (seed 2026, --workers 1): refit/house_10 eb=yes ceiling 450 s, amp_ok 431, dur_rej 134 (p50 1581 s), 202 preds vs 103 GT (1.96x); refit/house_18 eb=yes ceiling 171 s, amp_ok 471, dur_rej 137, 269 vs 61 (4.41x); refit/house_4 eb=no ceiling 540 s, amp_ok 216, dur_rej 19, 166 vs 314 (0.53x); refit/house_6 eb=no ceiling 306 s, amp_ok 171, dur_rej 47, 74 vs 390 (0.19x); refit/house_8 eb=no ceiling 882 s, amp_ok 802, dur_rej 111, 120 vs 298 (0.40x). The fragmentation switch (eb) therefore selects over- vs under-emission, and the residual excess is neither fragmentation (m23 fusion) nor event duration (this census).\n(2) RUN-SPAN ARBITRATION GUARD (refuted, -0.000152 at seed 2026, exact incumbent A/B 0.359446 in .scratch/s99_base.txt): model.py already suppresses mw inside NAMED chains because 'dw heater partial-duty draws sit in the mw amp band' (L1245-1250), but dw chains are never named, and the dw/wm sustained-run spans (L1222/L1274) were never recorded for that suppression. Recording the un-extended run spans and masking mw_ok with them moved only 4 of 11 mw pairs (house_11 +0.03, house_10 -0.01, house_17 -0.02, house_18 -0.01; house_18 plateau events 321->303, house_10 262->250): the over-emission is not program-phase draws. Variant file kept at .scratch/s99_iso_model.py.\n(3) ROBUST DURATION FLOOR (this discard's logged measurement, +0.000389): _burst_event_bands anchors its duration CEILING on the robust dur_p50 (3 x max(p50, max/2)) but its FLOOR on min(durs), which is near-vacuous because the mark-event filter only requires dur >= 12 s, so the floor lands near 4 s and admits 12-18 s sub-chunk residues. Mirroring the ceiling, dur_lo = (1/3) x min(p50, 2 x min) is parameter-free, cannot exclude any observed chunk class (2 x min caps it at 2/3 of the shortest observed chunk), and is bit-identical for kettle/wm/dw/fridge - the blast radius is the mw gate only, as designed. It removes 39 spurious short mw preds on refit/house_10 (202 -> 163, F1 0.19 -> 0.20) and 0-2 elsewhere: mw median 0.267281 -> 0.268743 (+0.0015), primary 0.359446 -> 0.359835, p10 0.344277 -> 0.344273 (no drop), device_balanced 0.365435 -> 0.365726, house_1_v4_mean 0.540104 unchanged, kettle/fridge/wm/dw bit-identical, all 5 seeds (99.1 s). Mechanism confirmed but magnitude is ~25% of one house's excess, so it cannot clear the 0.364623 bar.\nNEXT (m35): the mw residual excess on eb=yes houses sits at 60-171 s - inside the duration band - against GT counts of 61-103, so the amp band is the only remaining gate, and m32 shows why every single-house aggregate estimator of it is biased low. The device-pure route left (B3's own closure) is B2 synthetic supervision: paste mark signatures into real pre-span backgrounds and fit the admission band from the paste response, which is label-free and device-pure by construction.","title":"mw split refuted; robust burst dur floor +0.0004 (discard)","summary":"Census: dur-rejected mw events are 8-100 min foreign loads, not merged cycles. Run-span guard -0.0002. Robust dur floor +0.0004, mw-only.","timestamp":1790509886124,"segment":2,"confidence":2.9627526248444385,"asi":{"hypothesis":"the mw over-long events are merged multi-chunk cycles (split them) and/or program-phase draws (suppress inside dw/wm run spans); and the burst duration floor is vacuous because it anchors on min(durs)","measured":"census refutes the merge/split premise (rejects are 8-100 min foreign loads); run-span guard -0.000152; robust dur floor +0.000389 (mw-only, mw median +0.0015)","rollback_reason":"sub-bar: 0.359835 vs the 0.364623 loop bar; the floor gain is ~25% of one house's mw excess","next_action_hint":"mw amp band is the only remaining mw gate; single-house aggregate estimators of it are refuted (m32). Try B2 synthetic supervision: paste mark signatures into real pre-span backgrounds and fit the band from the paste response - device-pure, label-free"}}
{"run":100,"commit":"2f0ee0f","metric":0.360094,"metrics":{"mean_device_f1_p10":0.344839,"transfer_mean_f1":0.151921,"median_kettle_f1":0.55514,"median_microwave_f1":0.267281,"median_fridge_f1":0.370963,"median_washing_machine_f1":0.246657,"median_dishwasher_f1":0.384353,"b1_events_mined":5260,"b1_enroll_top1_enc":0.84,"b1_enroll_top1_raw":0.65,"b1_cross_house_top1":0.21,"b1_gate_kettle_kept_frac":0.813,"b1_gate_mw_kept_frac":0.853,"b2_probe_mw_iso_mean":0.34,"b2_probe_iso_all_mean":0.61,"device_balanced_mean":0.36566,"house_1_v4_mean":0.540104,"v4_n_pairs":66,"v4_n_houses":20,"fridge_median_delta":0,"primary_delta":0.000648},"status":"discard","description":"Run 100: pre-registered hypothesis - the declared device level in data/gold/thresholds.json (thr_on_W is exactly half p50_on_W in every pool house, so [thr, 2*thr] IS the device's declared own-power band) can serve as a burst gate band when the calibration mark's extractor population sits outside it.\nThresholds were read for all pool houses (refit/house_12 kettle 56.5 W, i.e. a declared 113 W kettle; microwave specs as low as 21.5 W on refit/house_6 and 59 W on refit/house_12; kettles 882-1473 W on house_4/6/7/8/11/13/17/19/20/21 and eco/house_01, eco/house_02, eco/house_06, ukdale/house_1).\nThree variants, screened at --seeds 2026 (screen value == full 5-seed primary, verified):\n(A) spec band for every burst device whose population is outside [thr, 2.5*thr] = 0.348631 (-0.0108 vs incumbent 0.359446); fired on 4 microwaves (declared 65-130, 90-179, 59-118 W) and 2 kettles; mw median 0.267 -> 0.191, kettle median 0.555 -> 0.568.\n(B) same restricted to continuous bursts (population >= 0.7 * mark core, i.e. the fragmentation switch's duty-chunk clause inverted) = 0.347608; the 4 microwave overrides still fire, so that clause does NOT separate a duty-chunked microwave from a contaminated kettle.\n(C) kettle-scoped spec band = full pool 0.360094 (+0.000648 over the incumbent), p10 0.344839 (+0.00056), device_balanced 0.365660, house_1_v4_mean 0.540104; all five device medians (kettle 0.555140, mw 0.267281, fridge 0.370963, wm 0.246657, dw 0.384353) bit-identical to the incumbent - the only pair that moves is refit/house_11... no, refit/house_12 kettle (P=0.03 R=0.19 n=712/127).\nMechanism established: a declared level BELOW the house's base-load structure turns the burst gate into a junk admission band (the 43-179 W microwave specs admit the base load), while the mark-observed population - even when it disagrees with the spec - remains the better gate, re-confirming m32. The apparent smoking gun (refit/house_12 kettle: declared 113 W, mark core 115 W, extractor events 1110 W) is real but is a single 0.03-magnitude pair, so its repair is worth only +0.0006.\nFamily closed: thresholds.json cannot supply a coherent gate - it carries powers but no durations, so a declared band paired with mark-derived durations is incoherent, and every variant that lowers a burst floor loses more than it gains. Discarded under the +0.01 bar (run 99's +0.0004 was discarded identically). Tree restored to the incumbent (85/14) after auto-revert.","title":"spec gate band refuted; kettle-only +0.0006 (discard)","summary":"Declared level [thr,2thr] as a burst gate costs mw (0.267->0.191, 4 houses) and gains kettle +0.007; kettle-scoped net +0.0006 - refuted.","timestamp":1790511462903,"segment":2,"confidence":3.2728188049413323,"asi":{"hypothesis":"thresholds.json's [thr, 2*thr] declared device level can gate a burst device when the calibration mark's population lies outside it","result":"refuted; mw median -0.076 with 4 low-spec microwaves, kettle +0.007, kettle-scoped net +0.0006 (sub-bar)","rollback_reason":"spec band lowers a burst amp floor to a declared level that can sit inside the house base-load structure; the mark-observed population is the better gate","next_action_hint":"stop mining device specs for gate bands; the remaining burst/fridge/wm deficits are duty-structure problems - B4's phase grammar is the instrument, not another static band"}}
{"run":101,"commit":"2f0ee0f","metric":0.363271,"metrics":{"mean_device_f1_p10":0.346289,"device_balanced_mean":0.366918,"house_1_v4_mean":0.540104,"v4_n_pairs":66,"v4_n_houses":20,"median_kettle_f1":0.55514,"median_microwave_f1":0.267281,"median_fridge_f1":0.387253,"median_washing_machine_f1":0.246657,"median_dishwasher_f1":0.384353,"transfer_mean_f1":0.151921,"b1_events_mined":5260,"b1_enroll_top1_enc":0.84,"b1_enroll_top1_raw":0.65,"b1_cross_house_top1":0.21,"b1_gate_kettle_kept_frac":0.813,"b1_gate_mw_kept_frac":0.853,"b2_probe_mw_iso_mean":0.34,"b2_probe_iso_all_mean":0.61,"fridge_median_delta":0.01629,"primary_delta":0.003825},"status":"discard","description":"PREREGISTERED HYPOTHESIS (run 101): the fridge emission band is fitted only on mined events with dur in DUTY_DUR_S=(600,2400)s (model.py L1073-1074), a fixed compressor-cycle prior. A home whose fridge recycles in ~4 min can therefore never enter the band: the fit sees only the >=600s tail, which is the MERGED long excursions. Re-mine the same (amp,dur) grid over the full sustained range and accept a materially shorter mode when a single 1-min duration bucket DOMINATES the in-window population (>=2000 events and >=50% of them) and the prior band floor is still pinned at the 600s prior.\n\nEVIDENCE (all pre-span only, no eval-span submeter read).\n1) eco/house_06 fridge, incumbent seed-2026 dump: P=0.081 R=0.005 F1=0.010 gt=1839 pred=123. GT dur p10/50/90 = 4.0/4.0/4.1 min at 20.4 cycles/day; model PR dur 10.9/22.1/38.5 min at 1.37/day. Its passive mark window is entirely zero (mark profile fabricated amp=30W dur=20.0min) so the fridge fell back to the mined population band amp=22-108W dur=10-36min (n=1460).\n2) ARITHMETIC THAT PINNED THE MECHANISM: the modelled miner's \"level-excursion events\" number 11185 over 164 pre-span days = 68/day, and the pre-span SUBMETER fridge mask gives 9965 cycles = 60.8/day at 4.0/4.1/4.1 min. The miner already resolves the individual cycles; only 1593 of 11644 in-window events (13%) survive the >=600s filter, and the 10-36min band is the duration distribution of that merged tail. The band, not the detector, was destroying the pair.\n3) DURATION BUCKETS (amp in 20-300W, dur >= 120s): eco/house_06 has n=8485 in the single 4-min bucket (73% of all in-window events, amp p50 50.1W); refit/house_10 spreads 2-12min (max bucket 15%); refit/house_1 spreads 2-18min (max 5%). So mode dominance separates the one broken home from the rest without touching them.\n4) The thermostat-interval regularity test the existing cell fit uses (DUTY_CV_MAX=0.6) is unusable here: a real fridge's inter-cycle interval varies, cv=0.691 on eco/house_06, so ALL 20 pool houses printed \"fridge fallback\" in every build - no cell has ever cleared 0.6. Recorded as a standing defect.\n5) SCREEN (--seeds 2026): one print fired, \"fridge short-cycle cell: p50=4.0min n=8485 dom=0.73 replaces the 10min-floor band\"; primary 0.359446 -> 0.372472 (+0.0130), fridge median 0.340104 -> 0.387868, every other device median bit-identical (kettle 0.561223, mw 0.263539, wm 0.247979, dw 0.424824). Blast radius = exactly the one intended pair.\n6) FULL POOL (5 seeds, 126.2s, checks PASS): primary 0.359446 -> 0.363271 (+0.003825). p10 0.344277 -> 0.346289 (+0.0020). device_balanced 0.365435 -> 0.366918. house_1_v4_mean 0.540104 unchanged. Fridge median 0.370963 -> 0.387253 (+0.0163). Kettle/mw/wm/dw medians bit-identical to the incumbent.\n\nVERDICT: DISCARD by the pre-registered keep rule (pool primary must reach floor+0.01 = 0.364623; 0.363271 misses by 0.00135). The gain is genuine but concentrated: seed 2026 gains +0.858 pair-F1 on eco/house_06 (~0.01 -> ~0.87) while the 4 pooled seeds average ~+0.10. That seed spread is the next question, not the mechanism. The rescue's inputs (mined events, fallback band) are seed-invariant, so the rescue itself fires for every seed; the spread must come from the seed-dependent mark window re-anchoring in the run-basis path.\n\nROLLBACK: src/ auto-reverted to the floor (2f0ee0f). Banked, NOT lost: .auto/runs/101_fridge_shortcycle.diff (+42/-1 on the incumbent, 127/15 cumulative). Tree restored to the best-known bundle = floor + 94_wm_median_ext.diff + 101_fridge_shortcycle.diff, i.e. pool 0.363271, so run 102 needs only +0.00135 more to clear the bar.","title":"fridge short-cycle band: one pair +0.86, pool +0.0038 (sub-bar)","summary":"600s mining floor hid eco/house_06's 4.1min fridge cycles (n=8485 dom cell); band fixed, pool 0.3633 < bar 0.3646","timestamp":1790511983713,"segment":2,"confidence":3.3568605644152325,"asi":{"hypothesis":"the 600s DUTY_DUR_S mining floor structurally hides short-cycle fridges; re-mine over the full sustained range and accept a dominant 1-min duration bucket","result":"mechanism CONFIRMED on eco/house_06 (one pair ~0.01 -> ~0.87 at seed 2026); pool +0.003825, sub-bar, banked","rollback_reason":"pool primary 0.363271 < pre-registered bar 0.364623","next_action_hint":"tree now holds the best-known bundle (0.363271): run 102 needs +0.00135 only. Investigate why the same seed-invariant rescue yields +0.858 on seed 2026 vs ~+0.10 on the other 4 seeds - suspect the seed-dependent mark re-anchor in the fridge run-basis path (model.py L1158-1167). Then attack refit/house_10 fridge (0.042, over-emission inside GT spans) for the remaining headroom."}}
