{"run":18,"commit":"8f54897","metric":0.005988,"metrics":{"mean_device_f1":0.159717,"pooled_episode_f1":0.212086,"mean_mae_w":33.7546,"worst_mae_w":47.9224,"mean_nmae":0.09842,"coverage_pred_share":0.475154,"coverage_true_share":0.258188,"kettle_mae_w":27.9,"microwave_mae_w":10.1,"fridge_mae_w":41.9,"washing_machine_mae_w":40.9,"dishwasher_mae_w":47.9,"kettle_f1":0.196,"dishwasher_f1":0.013,"washing_machine_f1":0.326,"microwave_f1":0.006,"fridge_f1":0.257,"ft_pretrain_val_mse_pre":0.12181,"ft_pretrain_val_mse_post":0.12181},"status":"discard","description":"EXP-18 v18 = two-channel input from the SAME raw window via one shared _prep2 helper used identically in pretrain (build_pool), calib and predict: ch0 = raw/INPUT_SCALE (the exact v16 level-bearing input), ch1 = (raw - centered rolling-median base BASE_WIN=51 ~ 5.1 min)/INPUT_SCALE (level-free step view). Net first conv in_channels 1 -> 2; everything else unchanged (seed, EPOCHS 12, 40k-window budget, decode family, routing). Scale consistency is structural - both channels derive from the same raw watts.\n\nFIRST, THE RUN-17 CORRECTION (record hygiene): run-17's collapse was confounded by a scale bug - build_pool scales pretrain windows by INPUT_SCALE itself, so the v17 _prep_win was applied to ALREADY-SCALED pretrain windows but to RAW watts in calib/predict (~1000x pretrain-vs-inference mismatch). Run-17's \"absolute-level features are load-bearing\" attribution is WITHDRAWN; the representation hypothesis was untested until now. This run is the clean test.\n\nRESULT: primary min_device_f1 0.005988 (v16 0.017910) -> DISCARD, but the strongest secondary profile of the whole campaign: pooled_episode_f1 0.212086 (v16 0.156664, +35%, best ever; v5 0.129835); fridge F1 0.257 (v16 0.146, +76%, best ever; 20711 preds/6275 matches vs 17564/3325 - both P 0.303 and R 0.224 up); washing_machine 0.326 (v16 0.335, held; MAE 40.9 vs 62.6 - big regression win); worst_mae_w 47.92 (v16 62.62, best since v5-family); mean_device_f1 0.159717 (v16 0.166073); mean_mae_w 33.75 (v16 32.69); mean_nmae 0.098420; coverage_pred 0.475154. val_mse_full 0.12181 (v16 0.14412) - the 2-ch encoder fits better. Per-device: kettle 0.196/27.9 (507 preds/79 matches - P 0.156, down from 0.348), microwave 0.006/10.1 (72 preds/1 match), fridge 0.257/41.9, washing_machine 0.326/40.9, dishwasher 0.013/47.9 (11893 preds - 6.8x v16's 1750 - P 0.007).\n\nCALIB READOUT: microwave head STILL DEAD on calib (sigON p05/p50/p95 = 0.00/0.00/0.00, on_p95 0.00) - the level-free channel did NOT revive it; routed direct as before. Dishwasher gate DEGENERATE: sigON 0.00/0.01/1.00 (huge variance) -> gate 0.05 -> over-fire 11893 preds. Kettle gate dropped to 0.39 (sigOFF p95 0.77 overlaps sigON p05 0.00) -> more FPs. Fridge/wm gates healthier than v16 (fridge 0.46 vs 0.49 sigOFF - borderline; wm 0.94 clean). Routing unchanged (vis identical - sigma/amps calib-derived; live F for mw only).\n\nMECHANISM READING: (1) the level-free channel genuinely helps LOW-AMPLITUDE devices - fridge is the only pure-continuity device and its detection is exactly what the base-shift was hiding; this is the audit's z-norm insight confirmed, now cleanly measured. (2) The channel also helps the aggregate fit (pooled 0.212, wm MAE) but HURTS kettle precision - the base-subtracted view makes mid-size kettle-like residual draws more confusable. (3) The min devices (mw/dw) are NOT representation-limited: mw is head-liveness-limited (dead on calib = needs target-distribution training, i19), dw is gate-liveness/gate-degeneracy-limited. Fixing representation again will not lift the min.\n\nWHY DISCARD: primary 0.0060 << 0.0179 (mw) and dw 0.013 << 0.030; the keep-rule is strict min_device_f1. The fridge/pooled gains are real design memory for a later combination.\n\nNEXT (ranked): (a) i19 self-training on pre-split aggregate for the dead mw head (root fix - target-distribution training; guardrails: freeze encoder, calib early-stop, gate-drift watch) - now even more attractive since the encoder quality is not the bottleneck; (b) 2-ch + a calib-only gate floor for degenerate-gate devices (dw gate 0.05 with sigON p50 0.01 - the gate midpoint rule fails when the calib distribution is degenerate; a floor like max(gate, quantile-derived) is calib-derived, no eval info); (c) re-run the 2-ch variant with kettle precision guard (e.g. kettle direct path instead of MAP) - only if (a)/(b) fail.","title":"v18 2-ch input: fridge +76%, pooled +34%, min regresses","summary":"Level+base-subtracted channels revive fridge 0.146->0.257, pooled 0.157->0.212, worst MAE 62.6->47.9; but kettle -35%, dw over-fires, mw head still dead; min 0.0060 < 0.0179.","timestamp":1790452042051,"segment":0,"confidence":13.718881654538496,"asi":{"hypothesis":"A level-free second channel (base-subtracted) revives dead low-amp heads without harming the level-bearing pathway","rollback_reason":"Primary regression: min 0.0060 (mw) < 0.0179; kettle -35%, dw over-fires 6.8x via degenerate gate 0.05. But fridge +76% and pooled +35% (best ever) - real signal for a later combination","next_action_hint":"i19 self-training for the dead mw head (root fix); then 2-ch + calib-only gate floor for degenerate gates; mainline stays v16"}}
{"run":19,"commit":"8f54897","metric":0.01791,"metrics":{"mean_device_f1":0.166073,"pooled_episode_f1":0.156664,"mean_mae_w":32.6934,"worst_mae_w":62.624,"mean_nmae":0.095326,"coverage_pred_share":0.509042,"coverage_true_share":0.258188,"kettle_mae_w":14.5,"microwave_mae_w":12.6,"fridge_mae_w":43.2,"washing_machine_mae_w":62.6,"dishwasher_mae_w":30.7,"kettle_f1":0.302,"dishwasher_f1":0.03,"washing_machine_f1":0.335,"microwave_f1":0.018,"fridge_f1":0.146,"ft_pretrain_val_mse_pre":0.14412,"ft_pretrain_val_mse_post":0.14412},"status":"discard","description":"EXP-19 v19 = synthetic context-mixing fine-tune of the dead microwave head (design in the model docstring): quiet backgrounds mined from the UNLABELED pre-split aggregate (.auto/cache/house_1_pre.npz 'mains' key ONLY - target GT channels never read, disclosed), source-house mw waveforms (sanctioned pretrain labels) injected scaled to the target calib ON amplitude, mw-only loss, encoder frozen. Implementation shipped a shape bug: the mw slices pm/om are (B,128) but the targets were stored (B,128,1) -> RuntimeError on the FIRST FT batch (512 vs 128 at dim 1), before any optimizer step.\n\nRESULT: the documented fallback engaged exactly as designed - the run is BIT-IDENTICAL to v16: min_device_f1 0.017910, mean 0.166073, pooled 0.156664, mean_mae_w 32.6934, worst 62.624, mean_nmae 0.095326, coverage_pred 0.509042; per-device kettle 0.302/14.5, mw 0.018/12.6, fridge 0.146/43.2, wm 0.335/62.6, dw 0.030/30.7; calib gates identical (0.43/0.05/0.23/0.77/0.05); routing identical. FT note printed: 'error:RuntimeError:...'.\n\nDIAGNOSTIC VALUE: (1) the fallback path is verified bit-exact (try/except + printed note); (2) the data-mining pipeline WORKS - the crash happened inside the FT training loop, so segs/quiet/high pools were non-empty and amp_cal > 0 (the guards passed); (3) a net.train() mode leak into the calib forward is harmless for this architecture (no BN/dropout - gates bit-identical anyway); the fix adds net.eval() to the except handler regardless. (4) The FT'd-head predictions could NOT be tested this run.\n\nFIX (run 20): store FT targets as (N,128) 2D (matching the (B,128) mw slices) instead of (N,128,1); no design change - the docstring pre-registration stands: if the head comes alive on calib, mw routes MAP and F1 should rise well above 0.018; if it stays dead, run ~ v16.\n\nWHY DISCARD: no new mechanism was tested - the run burned on an implementation bug; logging it keeps the append-only history honest. The v16 mainline is untouched (HEAD 8f54897).","title":"v19 FT crashed on shape bug; fell back to v16 bit-exact","summary":"FT loss crashed ((B,128) vs (B,128,1) target shapes) before any weight update; try/except fallback reproduced v16 bit-identically (all metrics+gates). Fix queued.","timestamp":1790452300910,"segment":0,"confidence":11.357006975269503,"asi":{"hypothesis":"Synthetic context-mixing (source mw waveforms into pre-split backgrounds) revives the dead mw head","rollback_reason":"No-op: FT loss shape bug crashed before any weight update; fallback reproduced v16 bit-exact","next_action_hint":"Run 20 = same v19 design with 2D FT targets; pre-registration unchanged"}}
{"run":20,"commit":"67ce270","metric":0.029649,"metrics":{"mean_device_f1":0.173872,"pooled_episode_f1":0.156676,"mean_mae_w":32.9102,"worst_mae_w":61.5,"mean_nmae":0.095958,"coverage_pred_share":0.511147,"coverage_true_share":0.258188,"kettle_mae_w":11.9,"microwave_mae_w":17.3,"fridge_mae_w":43.2,"washing_machine_mae_w":61.5,"dishwasher_mae_w":30.7,"kettle_f1":0.31,"dishwasher_f1":0.03,"washing_machine_f1":0.336,"microwave_f1":0.048,"fridge_f1":0.146,"ft_pretrain_val_mse_pre":0.14412,"ft_pretrain_val_mse_post":0.14412},"status":"keep","description":"EXP-20 = v19 fixed (run-19's shape bug: FT targets now (N,128) 2D matching the (B,128) mw slices; no design change). Mechanism: synthetic context-mixing fine-tune of the dead microwave head - quiet backgrounds mined from the UNLABELED pre-split aggregate, SOURCE-house mw waveforms (sanctioned pretrain labels) injected scaled to the target calib ON amplitude (1588 W), mw-only loss, encoder frozen, other filters receive exactly zero gradient. Data: FT note 'ok amp_cal=1588W segs=496 quiet=2626 high=330' - 496 source mw segments, 2626 quiet + 330 high-draw background windows mined. NO eval GT anywhere; no eval-derived parameters; pre-split npz read mains-key only (disclosed in docstring). Pretrain curves identical to v16 (val_mse_full 0.14412) - the FT runs after pretrain.\n\nRESULT vs v16 (8f54897): min_device_f1 0.029649 vs 0.017910 (+65.6%; the min device is now dishwasher 0.030, microwave rose above it). mean_device_f1 0.173872 vs 0.166073. pooled_episode_f1 0.156676 vs 0.156664 (flat). mean_mae_w 32.9102 vs 32.6934 (+0.22 W, negligible). worst_mae_w 61.50 vs 62.62 (better). mean_nmae 0.095958 vs 0.095326 (flat). coverage_pred 0.511147 vs 0.509042 (flat).\n\nPER-DEVICE: kettle 0.310/11.9 (v16 0.302/14.5 - slightly better F1 and MAE via joint-MAP perturbation), microwave 0.048/17.3 (v16 0.018/12.6; 234 preds/12 matches vs 73/3 - recall 0.011->0.046, 4x), fridge 0.146/43.2 BIT-IDENTICAL (17564 preds/3325 matches - exact, pre-registered), washing_machine 0.336/61.5 (v16 0.335/62.6 - held, 810 vs 806 matches), dishwasher 0.030/30.7 BIT-IDENTICAL (1750/46 - exact, pre-registered).\n\nPRE-REGISTRATION COMPARISON: (1) 'fridge/dishwasher bit-identical' - CONFIRMED EXACTLY (episode counts included), verifying the zero-grad/Adam-zero-step argument. (2) 'kettle/wm ~ v16 small perturbation' - CONFIRMED. (3) 'if the head comes alive on calib, mw routes MAP and F1 rises; if it stays dead the run reproduces v16' - PARTIALLY WRONG IN AN INFORMATIVE WAY: the mw head did NOT come alive on calib (sigON p95 still 0.00, live[mw]=False, mw stayed DIRECT), yet mw F1 rose 2.7x anyway through the direct path. The FT shifted the head's behavior on eval-like contexts (flat-base ~1.6 kW steps) while the 5 real calib mw sessions (noisier context) still do not cross the gate. FINDING: the calib-liveness readout is BLIND to this class of improvement - the 5 calib windows under-represent the contexts where the FT'd head now fires. Readout implication: liveness routing for mw stays OFF, which is currently fine (direct path works), but any future MAP routing for mw cannot rely on this readout.\n\nMECHANISM READING: target-distribution training works where decode-side repairs failed (runs 14/15) - the head needed to see house_1-like aggregate context, and synthetic mixing supplied it legally. The mw head now fires 3.2x more often on the eval span with 4x the true matches; precision is still low (0.051) - the head fires on ~1.6 kW steps that are not mw (residual attribution), the same failure mode as v15's MAP-mw but at much lower amplitude stakes on the direct path.\n\nWHY KEEP: genuine primary improvement (+66% min), every device >= v16, no secondary collapse (worst MAE better, mean MAE +0.22 W, pooled flat), mechanism-level change with a legal data path, pre-registered. New mainline = v19.\n\nNEXT (ranked): (1) 90d expanded-eval verification of THIS mainline (due for a +66% keep - the kettle 90d precision decay seen on v16 needs rechecking); (2) dishwasher is the new min (0.030): its gate is degenerate (sigON 0.00/0.00/1.00 -> gate 0.05) - the same synthetic context-mixing recipe applied to the dw head (its bimodal 122/2360 W amplitudes need two-class synthesis or low/high split) is the obvious next mechanism; (3) mw precision: confidence-filter the direct-path mw output or shrink the injection amplitude band.","title":"v19 mw context-mix FT: min +66% (0.0179->0.0296)","summary":"Source-mw-into-pre-split-backgrounds FT of mw head (encoder frozen): mw 0.018->0.048, min 0.0179->0.0296 (+66%), every device >= v16, fridge/dw bit-identical as pre-registered.","timestamp":1790452430144,"segment":0,"confidence":14.24063400576369,"asi":{"hypothesis":"Synthetic context-mixing (source mw waveforms into pre-split quiet backgrounds, mw-only head FT) revives the dead mw head","rollback_reason":"","next_action_hint":"90d expanded-eval on the new mainline (due for +66% keep); then the same context-mixing recipe for the dishwasher head (new min, bimodal 122/2360 W); then mw precision work"}}
{"run":21,"commit":"67ce270","metric":0.023754,"metrics":{"mean_device_f1":0.172814,"pooled_episode_f1":0.154517,"mean_mae_w":34.5183,"worst_mae_w":61.436,"mean_nmae":0.100647,"coverage_pred_share":0.543681,"coverage_true_share":0.258188,"kettle_mae_w":11.9,"microwave_mae_w":17.3,"fridge_mae_w":43.2,"washing_machine_mae_w":61.4,"dishwasher_mae_w":38.7,"kettle_f1":0.31,"dishwasher_f1":0.024,"washing_machine_f1":0.336,"microwave_f1":0.048,"fridge_f1":0.146,"ft_pretrain_val_mse_pre":0.14412,"ft_pretrain_val_mse_post":0.14412},"status":"discard","description":"EXP-21 = v20: v19's mw context-mix FT kept unchanged, PLUS the same recipe applied to the dishwasher head (now the min at 0.030). Design (docstring pre-registered): source dw ON sessions yield <=128-sample excerpts (2/session, half anchored at onset), scaled per-house by s_h = calib-high-median / source-high-median (house_2 102/2001 W -> ~1.17x, house_5 97/1662 W -> ~1.41x; lands low mode at 119/137 W vs target 122), injected into quiet pre-split backgrounds; high-draw (>=1900 W, majority kettle) negatives teach kettle-blip rejection; dw-only loss, encoder frozen, zero gradient elsewhere. FT note: 'ok hi_t=2339W segs=4446 quiet=2636 high=326'. Legal data path identical to v19 (pre-split mains key only, source GT, calib anchors; NO eval GT; no eval-derived parameters). Pretrain identical (val_mse_full 0.14412).\n\nRESULT vs v19 mainline (67ce270): min_device_f1 0.023754 vs 0.029649 (-20%). dw (the experiment): preds 1750->2520 (+44%), matches 46->46 (EXACTLY unchanged), P 0.026->0.018, R 0.034->0.034, F1 0.030->0.024, MAE 30.7->38.7. mean_device_f1 0.172814 vs 0.173872; pooled 0.154517 vs 0.156676; mean_mae_w 34.5183 vs 32.9102; mean_nmae 0.100647 vs 0.095958; coverage_pred 0.543681 vs 0.511147 (more over-coverage). worst_mae 61.436 ~ 61.500.\n\nPRE-REGISTRATION COMPARISON: (1) mw/fridge bit-identical to run 20 - CONFIRMED EXACTLY (mw 234/12 F1 0.048 MAE 17.3; fridge 17564/3325 F1 0.146 MAE 43.2 - all identical), the zero-grad argument holds through a SECOND sequential FT. (2) kettle/wm ~ run 20 small perturbation - CONFIRMED (kettle 210 vs 211 preds, same 79 matches; wm 1866 vs 1860, 811 vs 810). (3) dw: predicted 'if the cycle structure transfers, matches rise' - REFUTED: matches stayed exactly 46 while preds grew 44%. The extra firings are pure false positives (low-amplitude noise/fridge-level responses, plus more kettle-coincident firings). Calib readout: dw sigON still 0/0/1.00, sigOFF p95 0.00->0.01 (slightly degraded OFF discrimination), med_pred 228->290 W (amp r 0.53->0.50 worse).\n\nMECHANISM READING (design memory): dw low-mode detection from the aggregate is FEATURE-LIMITED, not representation-limited - a 122 W step inside a ~497 W residual is information the aggregate barely carries, and the FT can only teach what the input contains; the head responded by firing more broadly instead of more accurately. The cycle-structure injection did transfer the 'fire on ~2.3 kW' behavior but added no new discrimination. Corollary: dw progress must come from the HIGH-mode channel (precision vs kettle) or from information outside the raw aggregate, not from more low-mode teaching. Also: sequential head-FTs compose cleanly (mw FT results preserved exactly through the dw FT) - the mechanism is modular for future per-device FTs.\n\nWHY DISCARD: primary -20% with every secondary flat-or-worse; the pre-registered success condition (matches rise) failed exactly. Discard auto-reverts to v19 (67ce270).\n\nNEXT (ranked): (1) dw HIGH-mode precision via decode-level physical exclusivity - the dw FPs are kettle-coincident (kettle 2331 W ~ dw high 2360 W, indistinguishable in amplitude, but the kettle is MAP-routed with vis 4.69): veto dw direct-path firings where the kettle MAP chain is ON, or read the dw head on the aggregate MINUS MAP-routed devices' predicted draws (residual decode); risk: real kettle-during-dw co-occurrence truncated - needs a careful pre-registration; (2) mw precision (P 0.051 on 234 preds) via the same exclusivity logic (mw 1.6 kW vs kettle 2.3 kW - amplitude-separable, so why does mw fire on non-mw? diagnose first); (3) fridge periodicity (i21) - fridge is now the largest MAE contributor (43.2 W).","title":"v20 dw context-mix FT: dw 0.030->0.024, zero new matches","summary":"Scaled source-dw excerpts (high-mode anchor ~1.17x/1.41x) made the head fire +44% more on eval with ZERO new matches: dw 0.030->0.024 (min -20% vs v19), MAE +6 W. Discarded.","timestamp":1790452828804,"segment":0,"confidence":14.206516530905603,"asi":{"hypothesis":"Cycle-structure injection (scaled source dw excerpts incl. low mode) teaches the dw head the target's bimodal pattern","rollback_reason":"Head fired +44% more with zero new matches - dw F1 0.030->0.024 (min -20%); low-mode 122 W signal not learnable from the aggregate (feature-limited)","next_action_hint":"dw high-mode precision via kettle-exclusivity (decode-level veto or residual decode); else mw precision diagnosis; else fridge periodicity (i21)"}}
