{"run":88,"commit":"2f0ee0f","metric":0.354623,"metrics":{"mean_device_f1_p10":0.33669,"transfer_mean_f1":0.151921,"median_kettle_f1":0.55514,"median_microwave_f1":0.266004,"median_fridge_f1":0.370963,"median_washing_machine_f1":0.242345,"median_dishwasher_f1":0.346705,"b1_events_mined":5260,"b1_enroll_top1_enc":0.84,"b1_enroll_top1_raw":0.65,"b1_cross_house_top1":0.21,"b1_gate_kettle_kept_frac":0.813,"b1_gate_mw_kept_frac":0.853,"b2_probe_mw_iso_mean":0.34,"b2_probe_iso_all_mean":0.61,"device_balanced_mean":0.358294,"house_1_v4_mean":0.539774,"v4_n_pairs":66,"v4_n_houses":20,"fridge_median_delta":0,"primary_delta":0},"status":"discard","description":"Iteration goal: repair the fridge duty-cell path, which the run-87 rebuild-print census showed is dead pool-wide.\n\nCENSUS (every pool block of .auto/runs/87.log): `fridge mined cell: a50` 0 lines, `none regular enough` 0, `fridge fallback` 63 -> the mined cell path ran on NO block; every fridge-bearing block used the m16 population fallback. The gate `int(dm.sum()) >= DUTY_CELL_MIN` (300) is combinatorially impossible: a 10 W x 5 min bucket in a 280 W x 30 min box (~224 buckets holding 1.5-10k events) has tens of members, so the CV test was never reached. Also found: `named dw=0` on 61/61 blocks (deliberate; dw uses the sustained path), `kettle sustained marks` 87/180 windows (2 blocks 0/5), `mark re-anchor fridge` on 3 blocks.\n\nREPAIR ATTEMPTED (B3-style self-training on the home's own unlabeled pre-span): cell floor 300 -> 20 plus a new selection criterion, because interval-CV is a SECOND dead gate - consecutive-interval CV cannot survive the extractor's ~1/3 capture of the true cycles, so a periodic fridge reads as irregular. Replacement: Rayleigh phase folding (fold on-times modulo the cell's own median period, concentration R), floored by the home's own box population R_pop and the 1.7/sqrt(n) critical value. The m19 reader-draw re-anchor guard was deleted too, since a reachable cell path would activate it and apply the run-87-refuted reader-draw band.\n\nMEASURED RESULT (subset refit/house_10, refit/house_17, refit/house_6, ukdale/house_1, seeds 2026, workers 1): the path fires on 3 of 4 houses but every winner is a sparse day-scale cell - house_10 R=0.418 n=20 T=8264min, house_17 R=0.342 n=36 T=1769min, ukdale/house_1 R=0.364 n=34 T=4401min - while the box populations are Poisson-like (R_pop 0.006-0.017, cv_pop 0.92-3.31). Subset mean 0.364151 -> 0.347702, fridge median 0.257162 -> 0.183141. REFUTED and reverted.\n\nAUTHORITATIVE RUN after `git checkout -- src/experiments/04_autoresearch/model.py` (src diff empty, byte-identical to the floor): primary 0.354623, p10 0.336690, device_balanced 0.358294, house_1 0.539774, medians kettle 0.555140 / mw 0.266004 / fridge 0.370963 / wm 0.242345 / dw 0.346705, 66 pairs / 20 houses, 81 s, checksPass true. Identical to the floor, so the run is a discard.\n\nSTRUCTURAL CONCLUSION (third independent demonstration): narrowing the fridge's duration hypothesis space always loses - the wide m16 fallback band is a measured local optimum, the run-87 mark-derived window lost -0.063 fridge median, and the day-scale Rayleigh cells lost -0.074. The graded refit fridge cycles are 0.3-1.0min while DUTY_DUR_S = 600-2400s excludes them, and the 10-40min compressor-class box population is a near-Poisson mixture, not a duty device. Durable lessons in .auto/ideas.md m22, including the note to delete the m19 reader-draw guard before ever making the cell path reachable.","title":"Fridge cell gate dead pool-wide; Rayleigh repair refuted (flat)","summary":"Census: the fridge duty-cell path fires on 0 blocks. Making it reachable via Rayleigh folding fires but picks day-scale cells; fridge median -0.074.","timestamp":1790501574753,"segment":2,"confidence":2.0616187734790437,"asi":{"hypothesis":"The fridge duty-cell path is dead pool-wide because of a combinatorially impossible count gate plus an interval-CV criterion that cannot survive the extractor's ~1/3 subsampling; a Rayleigh phase-folding criterion with the home's own population as the regularity floor would give a selective, regular fridge band.","rollback_reason":"Reachable path selected sparse day-scale cells (T 29h to 5.7d, n 20-36) and lost 0.074 fridge median on the subset; reverted byte-exactly and the pool re-measured flat at 0.354623.","next_action_hint":"Stop editing the fridge band - the wide m16 fallback is a measured local optimum, confirmed three times. Delete the m19 reader-draw guard before any future attempt to make the cell path reachable. Start B3 (self-training) on a device whose weak median is not band-limited.","refuted_repairs":["count-gate-only repair (inert: interval CV is the second dead gate)","Rayleigh phase-folding cell selection with the home's own population floor"],"census_findings":{"fridge_cell_path_fired":0,"fridge_fallback_blocks":63,"named_dw_chains_all_blocks":0,"kettle_sustained_windows":"87/180"},"subset_screen":"refit/house_10,refit/house_17,refit/house_6,ukdale/house_1 seeds 2026 workers 1"}}
{"run":89,"commit":"2f0ee0f","metric":0.354848,"metrics":{"mean_device_f1_p10":0.340019,"transfer_mean_f1":0.151921,"median_kettle_f1":0.55514,"median_microwave_f1":0.267281,"median_fridge_f1":0.370963,"median_washing_machine_f1":0.242345,"median_dishwasher_f1":0.346705,"b1_events_mined":5260,"b1_enroll_top1_enc":0.84,"b1_enroll_top1_raw":0.65,"b1_cross_house_top1":0.21,"b1_gate_kettle_kept_frac":0.813,"b1_gate_mw_kept_frac":0.853,"b2_probe_mw_iso_mean":0.34,"b2_probe_iso_all_mean":0.61,"device_balanced_mean":0.359466,"house_1_v4_mean":0.540104,"v4_n_pairs":66,"v4_n_houses":20,"fridge_median_delta":0,"primary_delta":0.00022499999999997522},"status":"discard","description":"Iteration goal: attack a weak-median device that is NOT band-limited. Diagnostic unlock: `bench_v4.py --dump` yields per-pair precision/recall, so the whole pool was dumped for evidence.\n\nDIAGNOSIS (4-house subset dump, seeds 2026): AGGR kettle P=0.8079 R=0.8049 F1=0.8063; dishwasher P=0.7611 R=0.3733 F1=0.4575 (36 preds vs 127 gt -> recall-starved); fridge P=0.2997 R=0.2275; microwave P=0.2487 R=0.2410; washing_machine P=0.2335 R=0.2026. Kettle is healthy; every other device is precision- AND recall-poor, with house-specific collapses (refit/house_6 mw R=0.02 on 390 gt; refit/house_10 fridge P=0.04 on 1956 gt).\n\nCHANGE (model.py): (1) microwave plateau fusion - `predict` admits fragmented plateau events whose duration matches the mark's fragment band and then emitted one onset per event, so a duty-chunked magnetron cycle produced several onsets and score_episodes (one-to-one onset matching) counted each extra fragment as a false onset; fragments are now fused into one cycle span when the pause is inside 1.25x the marks' own fragment duration (eb['dur_p50'], the same margin convention as the wm/dw merge gaps), strictly conditional on ev_band so houses without extractor fragmentation are untouched. (2) ported the _wm30_profile mark-window rule to _dw30_profile: a window whose excitation never crosses the heater threshold is now skipped instead of disabling the whole dw detector, requiring >=2 usable windows. (3) corrected the dw disable message, which claimed 'mark windows produced no heater runs' when the real cause was simply no dishwasher mark.\n\nSUBSET SCREEN (refit/house_10, refit/house_17, refit/house_6, ukdale/house_1, seed 2026): mean 0.364151 -> 0.365202, mw median 0.223885 -> 0.228612, kettle/fridge/wm/dw bit-identical (the dw and message edits are provably inert on this pool, since the _dw30_profile all-or-nothing branch never fired in 61 blocks). Fusion print fired: 262 plateau events -> 204 cycles.\n\nAUTHORITATIVE POOL RUN: primary 0.354848 vs floor 0.354623 (delta 0.000225), p10 0.340019, device_balanced 0.359466, house_1_v4 0.540104, medians kettle 0.55514 / mw 0.267281 / fridge 0.370963 / wm 0.242345 / dw 0.346705, 66 pairs / 20 houses, checksPass true.\n\nFULL-POOL PER-PAIR EVIDENCE:\nEXIT=0\npairs parsed: 330\n  AGGR kettle           P=0.5187 R=0.6191 F1=0.5426 gt=20445 pred=28999 n_pairs=60\n  AGGR microwave        P=0.3305 R=0.2891 F1=0.2744 gt=9440 pred=10675 n_pairs=55\n  AGGR fridge           P=0.4299 R=0.3342 F1=0.3676 gt=189625 pred=150243 n_pairs=90\n  AGGR washing_machine  P=0.2426 R=0.2458 F1=0.2334 gt=4290 pred=5204 n_pairs=75\n  AGGR dishwasher       P=0.4330 R=0.3182 F1=0.3475 gt=2635 pred=1488 n_pairs=50\n--- per-device (median F1 over pairs, mean P, mean R, total pred, total gt) ---\nfridge           n= 90 medF1=0.300 meanP=0.430 meanR=0.335 pred=150243 gt=189625\nwashing_machine  n= 75 medF1=0.180 meanP=0.243 meanR=0.246 pred=  5204 gt=  4290\nkettle           n= 60 medF1=0.620 meanP=0.519 meanR=0.620 pred= 28999 gt= 20445\nmicrowave        n= 55 medF1=0.230 meanP=0.330 meanR=0.289 pred= 10675 gt=  9440\ndishwasher       n= 50 medF1=0.500 meanP=0.432 meanR=0.318 pred=  1488 gt=  2635\n\nVerdict: below the +0.01 keep bar; the mw fusion is a real but narrow gain (it can only touch the fragmented houses), and the per-pair table is the durable artifact.","title":"Mw fragment fusion: plateau onsets fused to cycle spans","summary":"Fuse duty-chunked mw plateaus into one cycle onset; subset mw median 0.2239->0.2286, pool primary 0.354848","timestamp":1790502284503,"segment":2,"confidence":2.295016972165646,"asi":{"hypothesis":"Duty-chunked magnetron cycles fragment into per-plateau events and were emitted as one onset each, so one-to-one onset matching counted extra fragments as false positives; fusing fragments whose pause is inside the marks' own fragment duration should recover mw precision where the extractor fragmented.","mechanism_confirmed":"Fusion print fired (262 plateau events -> 204 cycles) and the subset mw median rose 0.223885 -> 0.228612 with every other device bit-identical.","diagnostic_unlock":"bench_v4.py --dump prints per-pair P/R/F1 plus device aggregates; this is now the standard targeting tool.","device_structure":{"kettle":"P .81 R .80 - healthy","dishwasher":"P .76 R .37 - recall-starved, needs more detection not tighter gates","fridge":"P .30 R .23","microwave":"P .25 R .24","washing_machine":"P .23 R .20"},"worst_pairs":"refit/house_6 mw R=0.02 on 390 gt cycles; refit/house_10 fridge P=0.04 on 1956 gt and mw F1=0.19; refit/house_10 wm P=0.13 R=0.22","next_action_hint":"Use the full-pool dump table to target the collapses: house_6's microwave recall (0.02 on 390 gt cycles) is the single largest device-level hole, and dw needs recall (36 preds vs 127 gt), not gate tightening. The mw fusion is conditional and cannot help unfragmented houses.","inert_edits":["_dw30_profile window skip (the all-or-nothing branch never fired in 61 blocks)","dw disable message correction"]}}
{"run":90,"commit":"2f0ee0f","metric":0.352638,"metrics":{"mean_device_f1_p10":0.346326,"transfer_mean_f1":0.151921,"median_kettle_f1":0.55514,"median_microwave_f1":0.267281,"median_fridge_f1":0.370963,"median_washing_machine_f1":0.242345,"median_dishwasher_f1":0.388346,"b1_events_mined":5260,"b1_enroll_top1_enc":0.84,"b1_enroll_top1_raw":0.65,"b1_cross_house_top1":0.21,"b1_gate_kettle_kept_frac":0.813,"b1_gate_mw_kept_frac":0.853,"b2_probe_mw_iso_mean":0.34,"b2_probe_iso_all_mean":0.61,"device_balanced_mean":0.359112,"house_1_v4_mean":0.540104,"v4_n_pairs":66,"v4_n_houses":20,"fridge_median_delta":0,"primary_delta":-0.0019850000000000145},"status":"discard","description":"Goal (from m23): the per-pair dump showed two dishwashers dead on EVERY seed - refit/house_10 (0 of 86 GT cycles, all 5 seeds) and refit/house_13 (~1 of 73) - worth about +0.012 primary if both reached F1 0.4. Both were diagnosed as the SAME root cause: bands derived from a mark whose own run is structureless.\n\n(1) MERGE GAP. refit/house_10's profile printed heater_gap_merge=70min, and 70 min is exactly the `4200.0 / DW30_GRID_S` fallback, reached only when max_gap == 0, i.e. when the marks show no internal pause at all. Its hs lower margin of 0.75 means every mark run is fully ON (one block per window), so no gap is ever measured. In the eval window that evidence-free 70-min gap fuses distinct cycles into one long run, and the span band (8-21 min, from the marks' own runs) then rejects every one. With no pause evidence the honest gap is one grid step; a single-block mark also means a genuine cycle's heater is continuous, so nothing needs bridging. Applied to both mirrored profiles (_dw30_profile and _wm30_profile).\n\n(2) DUTY FLOOR. A mark run IS the merged region above the heater threshold, so hs = 1.0 minus whatever dips the merge bridged. When every mark run is fully ON the floor of 0.75*min(hss) = 0.75 carries no information and excludes genuinely partial-duty cycles: other houses' dw marks measure hs 0.22-0.64, and refit/house_10's eval cycles plausibly do too. The floor is now dropped (hs_lo = 0) only when min(hss) >= 0.999, so houses with real dip evidence keep their measured band.\n\nEffect on the target: refit/house_10 went from 0 to 10 runs passing the run-basis gates and its profile now prints hs=0.00-1.75 and heater_gap_merge=0min. But it still emits only 1 prediction against 86 GT cycles.\n\nSUBSET SCREEN (refit/house_10, house_17, house_6, ukdale/house_1, seed 2026): mean 0.365202 -> 0.357100, dw median 0.457500 -> 0.408889, all other devices bit-identical. Note the two screens (with and without a dw mark-window skip port) were bit-identical, so that port is inert; and refit/house_13, the other dead-dishwasher home, is NOT in the subset, so the subset cannot see the main benefit of these fixes. The pool is the only arbiter that can, which is why it was measured despite the subset drop.\n\nAUTHORITATIVE POOL RUN: primary 0.352638 vs floor 0.354623 (delta -0.001985), p10 0.346326 (floor 0.33669), device_balanced 0.359112, house_1_v4 0.540104, medians kettle 0.55514 / mw 0.267281 / fridge 0.370963 / wm 0.242345 / dw 0.388346, 66 pairs / 20 houses, checksPass true.\n\nFULL-POOL DEVICE AGGREGATES:\nEXIT=0\npairs parsed: 330\n  AGGR kettle           P=0.5187 R=0.6191 F1=0.5426 gt=20445 pred=28999 n_pairs=60\n  AGGR microwave        P=0.3305 R=0.2891 F1=0.2744 gt=9440 pred=10675 n_pairs=55\n  AGGR fridge           P=0.4299 R=0.3342 F1=0.3676 gt=189625 pred=150243 n_pairs=90\n  AGGR washing_machine  P=0.2447 R=0.2479 F1=0.2358 gt=4290 pred=5209 n_pairs=75\n  AGGR dishwasher       P=0.4730 R=0.3424 F1=0.3803 gt=2635 pred=1589 n_pairs=50\n\nDISHWASHER PAIRS (sorted) AND ALL SUB-0.02 PAIRS:\n(the target device) ---\nrefit/house_10     s2026  F1=0.000 P=0.000 R=0.000 n=1/86\nrefit/house_11     s2026  F1=0.000 P=0.000 R=0.000 n=12/12\nrefit/house_10     s1     F1=0.000 P=0.000 R=0.000 n=0/86\nrefit/house_10     s2     F1=0.000 P=0.000 R=0.000 n=0/86\nrefit/house_11     s2     F1=0.000 P=0.000 R=0.000 n=26/12\nrefit/house_10     s3     F1=0.000 P=0.000 R=0.000 n=2/86\nrefit/house_11     s3     F1=0.000 P=0.000 R=0.000 n=6/12\nrefit/house_10     s4     F1=0.000 P=0.000 R=0.000 n=0/86\nrefit/house_11     s4     F1=0.000 P=0.000 R=0.000 n=9/12\nrefit/house_7      s2026  F1=0.060 P=0.120 R=0.040 n=33/91\nrefit/house_11     s1     F1=0.070 P=0.070 R=0.080 n=15/12\nrefit/house_7      s3     F1=0.080 P=0.140 R=0.050 n=37/91\nrefit/house_7      s4     F1=0.100 P=0.120 R=0.080 n=56/91\nrefit/house_21     s1     F1=0.110 P=0.280 R=0.070 n=18/76\nrefit/house_6      s1     F1=0.130 P=0.120 R=0.150 n=17/13\nrefit/house_7      s1     F1=0.130 P=0.180 R=0.100 n=51/91\nrefit/house_7      s2     F1=0.180 P=0.310 R=0.130 n=39/91\nrefit/house_18     s3     F1=0.250 P=0.900 R=0.140 n=10/63\nrefit/house_21     s3     F1=0.420 P=0.520 R=0.360 n=52/76\nrefit/house_21     s2026  F1=0.440 P=0.390 R=0.490 n=94/76\nrefit/house_13     s2026  F1=0.460 P=0.460 R=0.450 n=71/73\nrefit/house_21     s4     F1=0.470 P=0.760 R=0.340 n=34/76\nrefit/house_21     s2     F1=0.500 P=0.460 R=0.540 n=89/76\nukdale/house_1     s2     F1=0.500 P=0.470 R=0.540 n=32/28\nrefit/house_16     s4     F1=0.500 P=0.450 R=0.570 n=73/58\nrefit/house_1      s1     F1=0.510 P=0.830 R=0.370 n=12/27\nrefit/house_13     s2     F1=0.510 P=0.600 R=0.440 n=53/73\nrefit/house_16     s1     F1=0.530 P=0.440 R=0.670 n=88/58\nrefit/house_16     s3     F1=0.530 P=0.630 R=0.450 n=41/58\nrefit/house_16     s2026  F1=0.540 P=0.520 R=0.550 n=61/58\nrefit/house_6      s3     F1=0.540 P=0.540 R=0.540 n=13/13\nrefit/house_18     s2026  F1=0.550 P=0.750 R=0.430 n=36/63\nrefit/house_1      s4     F1=0.550 P=0.490 R=0.630 n=35/27\nrefit/house_13     s4     F1=0.550 P=0.810 R=0.410 n=37/73\nrefit/house_6      s2026  F1=0.560 P=0.580 R=0.540 n=12/13\nrefit/house_16     s2     F1=0.560 P=0.510 R=0.620 n=70/58\nrefit/house_6      s2     F1=0.560 P=0.580 R=0.540 n=12/13\nrefit/house_13     s1     F1=0.570 P=0.720 R=0.470 n=47/73\nrefit/house_6      s4     F1=0.570 P=0.530 R=0.620 n=15/13\nrefit/house_13     s3     F1=0.580 P=0.770 R=0.470 n=44/73\nrefit/house_18     s4     F1=0.580 P=0.960 R=0.410 n=27/63\nrefit/house_1      s2     F1=0.600 P=0.620 R=0.590 n=26/27\nrefit/house_1      s2026  F1=0.620 P=0.640 R=0.590 n=25/27\nrefit/house_18     s1     F1=0.620 P=0.750 R=0.520 n=44/63\nukdale/house_1     s1     F1=0.630 P=0.750 R=0.540 n=20/28\nrefit/house_18     s2     F1=0.650 P=0.910 R=0.510 n=35/63\nukdale/house_1     s2026  F1=0.670 P=1.000 R=0.500 n=14/28\nrefit/house_1      s3     F1=0.670 P=0.930 R=0.520 n=15/27\nukdale/house_1     s3     F1=0.700 P=1.000 R=0.540 n=15/28\nukdale/house_1     s4     F1=0.700 P=1.000 R=0.540 n=15/28\n\nVerdict: below the +0.01 keep bar. The two fixes are individually well-founded and each removed a real blocker (house_10 now admits its own runs), but admission is not detection: the admitted runs collapse into a single cluster, so house_10's real cycles are still not being found at all - the blocker is upstream of the gate family.","title":"Single-block dw marks: drop 70min merge gap and the hs floor","summary":"Two dw bands were derived from structureless marks; pool primary 0.352638 (floor 0.354623), dw median 0.388346","timestamp":1790502982384,"segment":2,"confidence":2.5880083292503655,"asi":{"hypothesis":"refit/house_10 and house_13's dead dishwashers share one root cause: gate bands derived from a mark whose own run is structureless, specifically an evidence-free 70-min merge gap and a duty floor of 0.75*1.0.","confirmed":"house_10 went from 0 to 10 runs passing the run-basis gates; its profile now prints heater_gap_merge=0min and hs=0.00-1.75. The 70-min value was provably the else-branch fallback 4200/DW30_GRID_S, reachable only when max_gap==0.","refuted":"Admission is not detection. With 10 runs admitted house_10 still emits 1 prediction against 86 GT cycles, so the remaining blocker is upstream of the gate family: the admitted runs form a single time cluster rather than 86 cycles.","inert_edits":["dw mark-window skip port from _wm30_profile (bit-identical subset results with and without it, so it is genuinely inert on this pool)"],"next_action_hint":"Diagnose house_10 upstream of the gates: dump the eval-window exc trace against the GT cycle times and find why the per-cycle heater signature is not present as one run per cycle (heat threshold from PROG_HEAT_AMP_FRAC * min(wm_amp, mark amp)? marks single-block at hs=1.0 vs eval cycles partial duty?). Also confirm whether house_13 even has a dw mark. Do NOT keep widening the band family; two rounds of band repairs have now moved the pool by ~0.","subset_warning":"The 4-house subset cannot see house_13 and its dw subset median moved down; subset aggregates are not comparable to the pool."}}
