{"run":102,"commit":"b4298ca","metric":0.366174,"metrics":{"mean_device_f1_p10":0.345739,"device_balanced_mean":0.368405,"house_1_v4_mean":0.529428,"v4_n_pairs":66,"v4_n_houses":20,"median_kettle_f1":0.56105,"median_microwave_f1":0.26721,"median_fridge_f1":0.387253,"median_washing_machine_f1":0.246657,"median_dishwasher_f1":0.384353,"transfer_mean_f1":0.151921,"b1_events_mined":5260,"b1_enroll_top1_enc":0.84,"b1_enroll_top1_raw":0.65,"b1_cross_house_top1":0.21,"b1_gate_kettle_kept_frac":0.813,"b1_gate_mw_kept_frac":0.853,"b2_probe_mw_iso_mean":0.34,"b2_probe_iso_all_mean":0.61,"fridge_median_delta":0,"primary_delta":0.002903,"kettle_median_delta":0.00591},"status":"keep","description":"HYPO: a burst event lying inside a span already EMITTED as a program appliance (dw30/wm30 run-basis runs, named chains) is that program's own heater drawing, not a second device. The mw has applied exactly this principle to named chains since run 88 (ev_in_named); the emitted program spans were never part of it, so the kettle gate stayed chain-blind and admitted the dw/wm heater blocks as kettle boils (model.py L1334-1335 said so explicitly).\n\nIMPL (variant 1, kept): collect prog_spans = the emitted dw30 core run (stride*a30..stride*b30), the emitted wm30 core run (a6..b6) and the named chain spans; compute ev_in_prog = any(span overlaps event); add '& ~ev_in_prog' to BOTH kettle-gate branches (ev_band branch and mark-relative branch). Kettle keeps its own emission rule otherwise; the mw dispute paths are untouched. The suppression uses the CORE emitted run, not the pre/post-extended span (i1 = stride*b30 + ext_fwd6), because the extension is what swallows real boils.\n\nSCREEN (--seeds 2026, 19s): incumbent 0.372472 -> 0.373461 (+0.000989); kettle 0.561223 -> 0.566709 (+0.005486); device_balanced 0.377087 -> 0.378173; mw 0.263539 -> 0.263486; fridge/wm/dw bit-identical; house_1_v4_mean 0.540104 -> 0.532603 (-0.007501).\n\nPOOL (5 seeds, 165s, checks pass): primary mean_device_f1 = 0.366174 vs banked-tree 0.363271 (+0.002903) and vs the last KEPT floor 2f0ee0f 0.354623 (+0.011551) -> CLEARS the pre-registered bar 0.364623 (= floor + 0.01). Per-seed means: seed1 0.344694, seed2 0.366466, seed3 0.366174, seed4 0.347308, seed2026 0.373461 -> median (seed 3) = the reported primary; seed 2026, the top seed, is +0.0073 above it, so the reported number is NOT the screen's optimistic value. p10 = 0.345739 (floor 0.336690, +0.009; banked tree 0.346289, -0.00055, i.e. within seed noise). device_balanced 0.368405 (floor 0.358294, +0.010). House medians: kettle 0.561050 (0.555140, +0.005910), microwave 0.267210 (-0.000071), fridge 0.387253, washing_machine 0.246657, dishwasher 0.384353 - no device median down.\n\nCOST, recorded honestly: house_1_v4_mean 0.540104 -> 0.529428 (-0.010676, floor 0.539774). On ukdale/house_1 the kettle declares 1173 W (2350 W draw) which is at the same level as a wm/dw heater, so genuinely coincident real boils are suppressed there; it stays above the transfer/product bar of 0.50. This is the price of the pool-level win and the concrete next action (a level-aware test) is in asi.\n\nREFUTED THIS RUN (all three measured, then reverted): (a) the same suppression over the EXTENDED emitted span - kettle median collapses back to 0.561131 because the +ext_fwd6 extension (+-22 min) covers real boils; core runs only. (b) extending the principle to ev_in_named = ev_in_named | ev_in_prog (mw) and using prog_spans in the kettle sustained-run dedup - primary 0.372423 at seed 2026 (-0.000049 vs incumbent), mw 0.263346, kettle 0.561131, i.e. net-negative: the sustained path is already isolation-gated, so its runs inside a program span are genuine kettles. (c) the house-adaptive shared step floor amp_floor = min(AMP_MIN_W, 0.5 * min(2*thr)) - refuted decisively: seed-2026 primary 0.366660 (-0.0058 vs variant 1) with ALL five medians down (kettle 0.558881, mw 0.250467, wm 0.238822, dw 0.417393, fridge 0.387868). The moti-vating defect is real (code comment L91-92: FR_STEP_MIN_W exists because 'the pool's compressor steps are 22-91 W, i.e. all below AMP_MIN_W = 50 W'; house_6 mw declares 43 W, house_8 44 W, house_10 47 W, eco/house_03 kettle 17 W, so those devices' own levels cannot be extracted) but the sub-50 W event population is dominated by noise, not by those devices, so the mw/kettle pairs do not recover. The fix must be device-specific (like the fridge's mine), not a global floor.\n\nFRIDGE STRAND CLOSED (measurement): census of the (amp in 20-300 W, dur >= 120 s) duration buckets over all 18 pool fridge houses (.scratch/s102_buckets.py) shows eco/house_06 is the ONLY house with a dominant short-cycle mode (4 min bucket, 8485 of 11644 events, dominance 0.73). Every other house is flat - top bucket dominance 0.06-0.16, several 2/3/4-min buckets competing - with its >=600 s mode intact (10-24 min). So run 101's rescue window (DUTY_DUR_SHORT..300 s) fires exactly where it should and widening it is unjustified; there is no second short-cycle house to win.\n\nFILES: diff .auto/runs/102_kettle_progspan.diff (142 insertions / 15 deletions vs floor, i.e. floor + run 94 + run 101 + this change); full stdout .auto/runs/102.log; screens .scratch/s102_screen3/4/5.txt; census script .scratch/s102_buckets.py.","title":"kettle yields emitted program spans: pool 0.3662 clears bar 0.3646","summary":"a burst event inside an emitted dw/wm heater span is that program's draw, not the kettle: kettle +0.0059, pool 0.3633->0.3662 (bar 0.3646); house_1 -0.011","timestamp":1790512870237,"segment":2,"confidence":3.445332246229107,"asi":{"hypothesis":"a burst event lying inside a span already emitted as a dw/wm program run is the program's own heater, not the kettle - the same principle the mw already applies to named chains","result":"CONFIRMED: pool 0.366174 vs banked 0.363271 (+0.0029) and vs last kept floor 0.354623 (+0.0116), clearing the pre-registered bar 0.364623; kettle median +0.0059, p10 +0.009 vs the floor; kept. Price: ukdale/house_1 subset -0.0107 (real boils coincident with wm/dw heaters at comparable level).","next_action_hint":"Make the rule level-aware - suppress only when the program's own claimed amp can explain the event (prog amp >= event amp) - to recover ukdale/house_1's -0.011 while keeping the gain; the kettle's declared 1173 W is at wm/dw heater level, whereas the suppressed FPs elsewhere sit far below it. Also still open: refit/house_11 dw 0.000 (12 preds/12 GT, zero match), refit/house_7 dw 0.065 (33 preds/91 GT under-emission), the mw cluster (house_6 0.040 on 74/390).","refuted":"extended-span suppression; mw ev_in_named extension; kettle sustained-run dedup against prog_spans; house-adaptive global step floor (sub-50W population is noise); widening the fridge short-cycle rescue (census: eco/house_06 is the only short-cycle house)."}}
{"run":103,"commit":"b4298ca","metric":0.363341,"metrics":{"mean_device_f1_p10":0.346289,"transfer_mean_f1":0.151921,"median_kettle_f1":0.555389,"median_microwave_f1":0.267281,"median_fridge_f1":0.387253,"median_washing_machine_f1":0.246657,"median_dishwasher_f1":0.384353,"device_balanced_mean":0.366995,"house_1_v4_mean":0.540104,"v4_n_pairs":66,"v4_n_houses":20,"fridge_median_delta":0,"primary_delta":-0.002833,"kettle_median_delta":-0.005661,"house_1_v4_mean_delta":0.010676,"b1_events_mined":5260,"b1_enroll_top1_enc":0.84,"b1_enroll_top1_raw":0.65,"b1_cross_house_top1":0.21,"b1_gate_kettle_kept_frac":0.813,"b1_gate_mw_kept_frac":0.853,"b2_probe_mw_iso_mean":0.34,"b2_probe_iso_all_mean":0.61},"status":"discard","description":"Run 103: level-aware narrowing of the run-102 program-span yield rule (m39).\n\nCHANGE (model.py, 16+/5-): prog_spans entries carry the program's own claimed level; the kettle gate became ev_in_prog |= (on<c1)&(off>c0)&(amp<=lvl_p). Level source: dw30['emit_w'] / wm30['emit_w'] (the emitted mark mean) for the 30 s run-basis detectors, and the named chain's own measured span level `lvl` (mean above base, computed at L1282) for program chains. `prog_spans.extend(named_spans)` replaced by two explicit 3-tuple appends so named_spans keeps its 2-tuple form for the wm30 dup test and the kettle sustained-run dedup. CORE runs only, never the extension (the extension claims a level the program is not drawing - that was run 102's refuted variant 1).\n\nWHY: run 102's blunt version (suppress any event inside an emitted program span) was kept at 0.366174 but cost ukdale/house_1 -0.010676 on the house_1 subset (0.540104 -> 0.529428) because house_1's kettle declares 1173 W, at wm/dw heater level, so real coincident boils were suppressed. The hypothesis was that the two event populations separate on amp vs the program's OWN claimed level: a program heater's partial-duty draw should sit at or below the program's level, a real second load should exceed it.\n\nSCREEN (seed 2026, ~19 s): 0.372482 - vs the blunt rule's 0.373461 (-0.000979) and vs the pre-102 banked tree 0.372472 (+0.000010). house_1_v4_mean 0.540104 = EXACTLY the pre-102 value (full recovery, +0.010676 vs the blunt rule). But median_kettle_f1 fell 0.566709 -> 0.561279, i.e. essentially the whole kettle gain was given back (incumbent 0.561223, so +0.000056).\n\nPOOL (5 seeds, 156.3 s, checks pass): primary 0.363341 (median of seed means; seeds 0.346152/0.363341/0.365245/0.346495/0.372482) vs the committed blunt rule 0.366174 => primary_delta -0.002833, and vs the pre-102 banked tree 0.363271 (+0.000070). p10 0.346289 (blunt 0.345739, banked 0.346289). device_balanced 0.366995 (blunt 0.368405). Device medians: kettle 0.555389 (blunt 0.561050, delta -0.005661), mw 0.267281 (blunt 0.267210, +0.000071), fridge 0.387253, wm 0.246657, dw 0.384353. house_1_v4_mean 0.540104 (blunt 0.529428, +0.010676).\n\nINTERPRETATION - REFUTED, and by construction not salvageable by a margin. The events the blunt rule removes on the other houses are NOT at or below the program's level: they exceed it, so they are the program's own above-mean heater spikes, not partial-duty draws. Meanwhile house_1's real kettle sits at only ~1.18x the wm's emitted mean. The two populations overlap in the amp-vs-program-level ratio (FPs >1.0x, the true positive ~1.18x), so no threshold on this feature separates them: any margin >=1.18 suppresses house_1's kettle, any margin <1.18 re-admits the program spikes. The blunt rule's house_1 cost is therefore intrinsic to span-based yielding, not a tuning error - it buys +0.0060 of kettle median for -0.0107 of the house_1 subset, and on the pool primary the blunt trade is the better one.\n\nSTATUS: discard. src/ reverts to the committed blunt rule b4298ca (0.366174), which remains the best-known state; no banked diff is needed because the blunt rule is already committed. Bar for the next run stays 0.376174 (0.366174 + 0.01).\n\nRECORDED LEAD (not tested this run): the wm heat-share admission floor is structurally unstable across builds. hs_band = (0.75*min(hss), 1.75*max(hss)) with min/max taken over the usable mark windows, and in 3 of the logged builds hs_lo rounds to 0.00, i.e. one low-hs merged run disables the heat-share test for that whole house. It is entangled with merge_n (hs is measured over the MERGED run, so a build with a large max_gap yields long merged runs with low hs, which simultaneously loosens the floor and widens the merge). Any repair must treat hs and merge_n jointly; a trimmed-min floor alone would move both.","title":"level-aware program yield: house_1 back, kettle gain given back","summary":"pool 0.3633 vs 0.3662 blunt; house_1 subset 0.5294->0.5401 restored but kettle 0.5611->0.5554 lost - populations overlap in amp vs program level","timestamp":1790513192103,"segment":2,"confidence":3.3008768332454537,"asi":{"hypothesis":"A program-span-yield suppression should only remove events whose amplitude the program's OWN claimed level can explain (dw30/wm30 emit_w, or the chain's measured span level); then run-102's kettle gain survives while ukdale/house_1's real coincident boils (kettle 1173 W declared, at wm/dw heater level) are protected.","result":"Refuted. house_1 recovered exactly (0.529428 -> 0.540104) but the entire kettle gain was returned (0.566709 -> 0.561279 screen; pool kettle median 0.561050 -> 0.555389). Pool primary 0.363341 vs the blunt rule's 0.366174 (-0.002833). The suppressed FPs sit ABOVE the program's level while house_1's real kettle sits at only ~1.18x it, so the populations overlap and no margin on this feature separates them.","rollback_reason":"Regression on the pool primary (-0.002833) and far below the 0.376174 bar; the blunt committed rule b4298ca is strictly better on the primary and the house_1 cost is intrinsic to span-based yielding, so nothing here is worth banking.","next_action_hint":"Do not reopen amp-vs-program-level discrimination or any margin on it. The next +0.01 must come from a structural lever, not span ownership: (1) B2 synthetic supervision for a device-pure admission band (the only route left for B3's device-pure labeling); (2) the wm cluster (median 0.2467, 7/15 pairs <0.2, over-emission) - but treat the heat-share floor and merge_n jointly, they co-vary; (3) refit/house_11 dw 0.000 (12 preds/12 GT, zero match) and refit/house_7 dw 0.065 (33/91 under-emission) as the last two dw pairs below 0.2."}}
{"run":104,"commit":"b4298ca","metric":0.366174,"metrics":{"mean_device_f1_p10":0.345739,"transfer_mean_f1":0.151921,"median_kettle_f1":0.56105,"median_microwave_f1":0.26721,"median_fridge_f1":0.387253,"median_washing_machine_f1":0.246657,"median_dishwasher_f1":0.384353,"device_balanced_mean":0.368405,"house_1_v4_mean":0.529428,"v4_n_pairs":66,"v4_n_houses":20,"fridge_median_delta":0,"primary_delta":0,"kettle_median_delta":0,"house_1_v4_mean_delta":0,"b1_events_mined":5260,"b1_enroll_top1_enc":0.84,"b1_enroll_top1_raw":0.65,"b1_cross_house_top1":0.21,"b1_gate_kettle_kept_frac":0.813,"b1_gate_mw_kept_frac":0.853,"b2_probe_mw_iso_mean":0.34,"b2_probe_iso_all_mean":0.61},"status":"discard","description":"Run 104: the wm admission floors' fragility (m39's recorded lead) is NOT the over-emission mechanism. Both halves tested and refuted.\n\nMOTIVATION (from .auto/runs/102.log): _wm30_profile's two admission FLOORS are plain mins over the five usable mark windows - hs_band = (0.75*min(hss), 1.75*max(hss)) and dens_lo = 0.75*min(denss). In the logged builds the density floor reached 0.068-0.151/min, BELOW the 0.184/min dw30 run ceiling that the docstring says this floor exists to reject, and hs_lo rounded to 0.00 in 3 builds (making the heat-share test vacuous for that whole house). hs is measured over the MERGED run, so a build with a large max_gap yields long low-hs merged runs that simultaneously loosen the floor and widen the merge - merge_n and hs_lo co-vary. The file's own precedent for one anomalous window is ext_back_s using a median (L729-735).\n\nCHANGE (model.py, 9 insertions / 1 deletion as pooled): replace 0.75*min(x) with 0.75*(sorted(x)[1] if len(x) >= 3 else min(x)) for hs_band[0] and dens_lo - a trimmed min (second-weakest of five windows), plus a docstring correction of the 'the marks' min run density' claim.\n\nSCREEN (seed 2026, 19 s each): bundle (both trimmed) 0.372409 vs the blunt rule's 0.373461 (-0.001052), wm median 0.247979 -> 0.242229. Split: (A) density-trim only 0.373607 (+0.000146), wm 0.247885 (-0.000094), kettle 0.567582 (+0.000873), house_1 0.526951 (-0.002477); (B) heat-share-trim only 0.372577 (-0.000884), wm 0.243702 (-0.004277), house_1 0.532603 (+0.003175). So the HEAT-SHARE trim is the harmful half and the density trim is noise at this draw.\n\nPOOL (5 seeds, 150.2 s, checks pass, variant A = density trim only): primary 0.366174 - BIT-IDENTICAL to the committed blunt rule on every reported aggregate (p10 0.345739, device_balanced 0.368405, house_1 0.529428, kettle 0.561050, mw 0.267210, fridge 0.387253, wm 0.246657, dw 0.384353). The change therefore fires only in the seed-2026 calibration draw; since the primary is the median of the five per-seed means (and the other aggregates are medians over seeds), a single-draw effect cannot move any of them.\n\nINTERPRETATION. (1) The heat-share floor is a RECALL guard, not a precision guard: the low-hs merged runs it admits are real wm cycles with long pump phases, so trimming it costs 0.0043 of wm median - m39's lead was mis-framed, and the floor's looseness in 3 builds is protecting truth, not admitting lookalikes. Do not reopen it. (2) The density floor rarely binds at all on this pool: after trimming it, 4 of the 5 seeds are unchanged to the last digit, so the dw30-lookalike rejection is already achieved by the other gates (span/amp/mean/idle ceilings) wherever it matters. (3) METHOD: a seed-2026 screen is not a valid go/no-go filter for a change whose firing depends on the calibration draw - the primary is a median over seeds and seed 2026 is the top, most atypical draw (0.373 vs 0.346-0.366 for seeds 1-4). Before spending a 150 s pool run, check whether a change fires in a MID seed (e.g. --seeds 1 or 3), not only in 2026. This is the first run where the screen and the pool disagreed in sign (screen +0.0001, pool exactly 0.000000).\n\nSTATUS: discard. src/ reverts to the committed b4298ca (blunt rule, 0.366174) = the best-known state; nothing banked (a pooled delta of exactly 0.000 is not an improvement to preserve, and the density floor's non-binding is itself the evidence that this is not where the wm headroom is). Bar stays 0.376174.","title":"wm admission floors: heat-share trim hurts, density trim pool-inert","summary":"pool 0.366174 bit-identical to blunt rule; density trim fires only in the 2026 draw, heat-share trim costs 0.0043 wm median - floor fragility is not the over-emission mechanism","timestamp":1790513491019,"segment":2,"confidence":3.1680473816396133,"asi":{"hypothesis":"The wm admission floors hang off the single most extreme of the five mark windows (0.75*min(hss) went to 0.00 in 3 builds; 0.75*min(denss) fell below the dw30 lookalike ceiling), so trimming the min should raise wm precision on the over-emitting cluster.","result":"Refuted on both halves. Heat-share trim: wm median -0.004277 (screen) - the low-hs merged runs are real wm cycles, so the floor is a recall guard. Density trim: pool 0.366174, bit-identical on every aggregate - it fires only in the seed-2026 draw and the median-over-seeds primary cannot see it.","rollback_reason":"No pool-level improvement at all (exactly 0.000000 primary delta) and the sub-variant that does move the screen moves it negatively; far below the 0.376174 bar, so nothing is worth banking.","next_action_hint":"Stop treating the wm admission floors (hs_lo/dens_lo/merge_n) as the over-emission mechanism - the fp route must be candidate GENERATION (what merges into a run) or the program path. Also: screen changes on a mid seed (1 or 3), not only 2026, because the primary is a median over seeds and 2026 is the outlier draw - run 104 is the first case where the screen's sign did not transfer to the pool. The largest structural lever remains B2 synthetic supervision (device-pure admission band), which is also the last route for B3's labeling closure."}}
