{"run":45,"commit":"71ad484","metric":0.5896539900882762,"metrics":{"min_device_f1":0.36170212765957444,"pooled_cycle_f1":0.5393181428816174,"mean_mae_w":22.298077837281337,"worst_mae_w":54.020482254652265,"mean_nmae":0.06419831866764089,"coverage_pred_share":0.27077176612364545,"coverage_true_share":0.25263950366526144,"kettle_f1":0.7792998477929985,"microwave_f1":0.36170212765957444,"fridge_f1":0.5186500888099467,"washing_machine_f1":0.6219512195121951,"dishwasher_f1":0.6666666666666666,"kettle_mae_w":10.264401709977083,"microwave_mae_w":7.0179556473755715,"fridge_mae_w":28.46002323504671,"washing_machine_mae_w":54.020482254652265,"dishwasher_mae_w":11.727526339355062},"status":"discard","description":"HYPOTHESIS: replicate run 44's observed-aggregate emission on the dw family - dw30 run spans carry sig (the smoothed observed aggregate) instead of the flat mark mean 497.5 W. Grounding is the same mark algebra: dw mean_w 497.5 = heater-duty x amp 2164 (zero residual base), so the flat level over-states every trough/soak cell and under-states every heater-on cell. dw was the last flat mark-mean emission on an uncapped device (wm done in run 44; kettle/mw/fridge capped, kettle sustained runs already emit at observed levels). Single site edit in model.py predict() step 0 + comment; no new constants.\nMECHANISM SAFETY (why F1 risk is bounded, pre-registered): sig is the whole-home aggregate, so sig >= dw's own draw on every cell. On GT-mask cells the dw draws above its threshold (the GT ON-mask is submeter > thr), so sig stays above the strict pred threshold (bench uses w > thr) inside true cycles. Fragmentation is impossible inside true cycles: GT dw cycles are whole 46-102 min spans, so soaks are either <= 600 s (pred fragments re-merge via MERGE_S 600) or draw > 60.5 W (sig > 60.5). FP-span tails may trim where base+others dip <= 60.5 W; a trim only shortens over-extension past the GT fall, which can only keep or improve duration ratios. So every per-device F1 outcome is equal-or-better by construction; empirically verified below.\nINVARIANCE PROOF (dry-run disclosed, then official confirmed bitwise identical - deterministic bench): pred episode counts identical on every device (kettle 366/291/256, mw 286/184/85, fridge 2805/1699/1168, wm 80/84/51, dw 28/14/14; pooled 3565/2272/1574) and all 8 F1 metrics bitwise equal to the run-43 baseline; mean_device_f1 0.5896539900882762 unchanged. Sanity gate PASS (min 0.915), checks PASS.\nRESULT: dishwasher MAE_W 17.7727 -> 11.7275 (-34.0%); mean_mae_w 23.5071 -> 22.2981 (-5.1%); mean_nmae 0.067679 -> 0.064198. worst_mae_w unchanged 54.0205 (wm back at baseline after run 44's revert - wm remains the worst device). Coverage_pred_share 0.25649 -> 0.27077 (+0.0143): the same co-incident-draw contamination trade-off as run 44, smaller because dw spans are shorter and fewer. Kettle/mw/fridge/wm MAE bitwise unchanged - only the dw channel changed.\nGENERALIZATION EVIDENCE: the mechanism class is now measured on both program devices - run 44 (wm spans): MAE -13.2%; run 45 (dw spans): MAE -34.0%; F1 bitwise invariant both times. REGRESSION PACKAGE PROJECTION (disjoint channels, additive arithmetic): re-applying both edits gives wm MAE 46.8663 and dw MAE 11.7275 simultaneously -> mean_mae_w 20.8672, worst_mae_w 46.8663, at bitwise-identical F1. One combined disclosed dry-run verifies the projection before any official keep.\nDECISION: status discard. The change is F1-invariant by construction; the loop gate keeps only primary improvements and auto-reverts the edit. This iteration completes the regression-lever quantification the owner objective names (regression score) and strengthens the case for the open decision on allowing regression-score iterations.\nCAP ACCOUNTING (disclosed, conservative): dw family 2/3 -> 3/3 (exhausted by this run). wm 3/3 (run 44 counted). Kettle 1/3 (2 left) - but its near-miss pools are dead per the i39 funnels (breakeven purities 39-73% vs the three-strike empirical band 20-30%). Fridge/mw 3/3. NO F1-eligible cap remains with a positive-EV candidate; the primary metric is at its architectural ceiling (0.5897, mw guardrail 0.3617).\nNEXT: if regression-score iterations are authorized, re-apply the run 44 (two sites) + run 45 (one site) edits together, verify the projection with one disclosed dry-run, and log once. Otherwise the loop is in a documented holding pattern: all families exhausted, baseline 0.5896539900882762 stable.","title":"dw emission: observed aggregate replaces flat mark mean","summary":"F1 bitwise unchanged (all episode counts identical); dw MAE 17.8->11.7 W (-34%), mean_mae 23.5->22.3. i40 mechanism replicated; primary-neutral; discard.","timestamp":1790469641133,"segment":1,"confidence":9.100881969857184,"asi":{"hypothesis":"dw claimed spans carry the observed aggregate (sig) instead of the flat mark mean 497.5 W; run 44 mechanism replicated on the dw family - same zero-residual-base mark algebra (mean_w = duty x amp)","rollback_reason":"primary mean_device_f1 bitwise unchanged by construction (F1-invariant emission); gate reverts the MAE-only gain despite dw MAE -6.05 W and mean_mae_w -1.21 W","next_action_hint":"regression package complete: re-apply run 44 (wm, 2 sites) + run 45 (dw, 1 site) edits together if regression iterations are authorized; projected mean_mae_w 20.8672 / worst 46.8663 at bitwise-identical F1; verify with one combined disclosed dry-run before any official keep","generalization_evidence":"mechanism measured on both program devices: run 44 wm MAE -13.2%, run 45 dw MAE -34.0%; F1 bitwise invariant both times (8/8 metrics equal to run-43 baseline each run)","contamination_note":"coverage_pred_share +0.0143 (run 44 was +0.0295): dw spans shorter/fewer; same co-incident-draw trade-off - energy attribution over-attributes during dw spans"}}
{"run":46,"commit":"71ad484","metric":0.5896539900882762,"metrics":{"min_device_f1":0.36170212765957444,"pooled_cycle_f1":0.5393181428816174,"mean_mae_w":23.507104638131494,"worst_mae_w":54.020482254652265,"mean_nmae":0.067679223542272,"coverage_pred_share":0.25648754042515737,"coverage_true_share":0.25263950366526144,"kettle_f1":0.7792998477929985,"microwave_f1":0.36170212765957444,"fridge_f1":0.5186500888099467,"washing_machine_f1":0.6219512195121951,"dishwasher_f1":0.6666666666666666,"kettle_mae_w":10.264401709977083,"microwave_mae_w":7.0179556473755715,"fridge_mae_w":28.46002323504671,"washing_machine_mae_w":54.020482254652265,"dishwasher_mae_w":17.77266034360585},"status":"discard","description":"i42 diagnostic-only iteration (pre-span, free, no cap spend, no eval-span variant). Code unchanged at 71ad484; official run 46 bitwise-identical to the HEAD baseline (8/8 top-level + 10/10 per-device metrics, full precision).\n\nREPLICATION VALIDITY: .scratch/diag_i42.py rebuilds the exact predict path - verified line-by-line against model.py (chain naming 853-877 incl. mg=meta['merge_s']['wm']/cad=100 cells per line 550; wm30 funnel = model's own _dw30_runs 295-335; ownership = predict 888-905; mw admission = 936-938). Triple validation: (1) diag wm30 EMITTED 82 (0.252/day) == model build echo 'wm sustained runs: 82 net-new candidates (0.252/day)' in run 46 log; (2) == validated i39c echo; (3) Part B totals reconcile the i38 record exactly (1606 in-band = 659 admitted 2.03/day + 947 not admitted = 234 chain-suppressed + 713 long non-chain). Disclosure: the diag's wm30 ext print line had a x2 unit error (ext_*6 are 6 s cells); the coverage logic used the correct predict-line-906 arithmetic (back 3.0 min, fwd 53.2 min) - print-only, no effect on results.\n\nPART A - wm COLD-WASH PUMP-CLUSTER POOL (the only never-funneled wm population; pump-switching rate = the one discriminator with positive eval evidence, i36 71% purity on heater runs): mark anchor from the 4 wm marks' sub-heat events (n=199, amp p5/p50/p95 72/227/708 W - low end fridge-contaminated by construction; intra-window gap p90/max 100/972 s). Strict merge 1.25x max = 1215 s: 4 candidates in 325.1 d (0.01/day), ALL net-new (outside every emission span+ext) but 0/4 inside the heated-EMITTED sub-heat-rate band p25-p75 [0.22, 0.37]/min (candidate rates 0.18-0.55/min) - the i36 pump-rate discriminator rejects them. Loose merge 1.25x p90 = 124 s: 140 candidates (0.43/day) but only 38 net-new (0.12/day; 102 already covered by wm30 ext_fwd 53.2 min pump/spin tails, dw30 spans+ext, or named chains) and only 4 net-new rate-in-band. Heated EMITTED pool 82 runs: rate p25/50/75 0.22/0.28/0.37/min, pump-band-frac p50 0.78. CONCLUSION: no cold-wash headroom at any merge; owner question (i)'s concrete wm candidate class is CLOSED on mass - nothing left to mine in the wm family.\n\nPART B - mw CHAIN-INTERIOR SUPPRESSED MASS, DUR SPLIT (i38 never applied the split): chain-interior amp-band events 234 total = 143 LONG >144 s (0.44/day, dur p50 750 s, 97% heater-span-overlap - correctly suppressed heater artifacts) + 91 SHORT <=144 s (0.28/day, dur p10/50/90 36/36/78 s, amp p50 1508 W, only 21% heater-span-overlap, tod 89/91 in meal quarters q2-q6, held by 56 of 164 named chains). Mass ~25 episodes/90 eval days if pure; mw GT 286 -> plausible mw F1 0.362 -> ~0.44-0.48 at high purity, less at three-strike prior 20-30%. Purity is eval-only (no pre-span submeter loaded). This is the ONE live F1 candidate left, but mw cap is 3/3 -> requires owner authorization per i38 conservative counting.\n\nANTI-OVERFIT: both pools mined pre-span only; no eval-span variant evaluation of any kind (caps: wm 3/3, mw 3/3 exhausted); detector parameters only from calib marks + session conventions; no pre-span submeter data loaded.","title":"diagnostic: wm cold-wash pool empty; mw chain mass 0.28/day","summary":"Cold-wash NO-GO: strict 0.01/day, 0/4 rate-in-band; loose net-new 0.12/day, 4 in-band. MW chain-interior short in-band 0.28/day, meal-hour tod - owner call, caps exhausted.","timestamp":1790470062329,"segment":1,"confidence":12.21935915723024,"asi":{"hypothesis":"the two never-measured populations hold recoverable F1 mass: (A) wm cold-wash pump-cluster cycles invisible to heater-basis funnels; (B) genuine mw cycles suppressed inside named program chains","rollback_reason":"diagnostic-only: code unchanged at 71ad484, run 46 bitwise-identical to baseline; both pools pre-span only, no eval-span variant evaluated, no family cap spend","next_action_hint":"owner question (i) answered with evidence: wm cold-wash class CLOSED (0.01/day strict, 0/4 rate-in-band; loose net-new 0.12/day with only 4 in-band) - wm family has nothing left to mine; mw chain carve-out (0.28/day, meal-hour, dur<=144 s, 21% heater overlap) is the single live F1 candidate but mw 3/3 cap needs owner authorization; regression package (runs 44+45: mean_mae_w 20.8672 / worst 46.87 at bitwise-identical F1) still awaiting owner authorization"}}
{"run":47,"commit":"71ad484","metric":0.5896539900882762,"metrics":{"min_device_f1":0.36170212765957444,"pooled_cycle_f1":0.5393181428816174,"mean_mae_w":23.507104638131494,"worst_mae_w":54.020482254652265,"mean_nmae":0.067679223542272,"coverage_pred_share":0.25648754042515737,"coverage_true_share":0.25263950366526144,"kettle_f1":0.7792998477929985,"microwave_f1":0.36170212765957444,"fridge_f1":0.5186500888099467,"washing_machine_f1":0.6219512195121951,"dishwasher_f1":0.6666666666666666,"kettle_mae_w":10.264401709977083,"microwave_mae_w":7.0179556473755715,"fridge_mae_w":28.46002323504671,"washing_machine_mae_w":54.020482254652265,"dishwasher_mae_w":17.77266034360585},"status":"discard","description":"i43 diagnostic-only iteration (pre-span, free, no cap spend, no eval-span variant). Code unchanged at 71ad484; official run 47 bitwise-identical to the HEAD baseline (8/8 top-level + 10/10 per-device, full precision).\n\nREPLICATION VALIDITY: .scratch/diag_i43.py + diag_i43b.py rebuild the fridge machinery exactly with the model's own functions (_extract_events, _dw30_grid, _pband, _runs, _merge_runs, _iso_clear). (1) Fallback band replicated: amp 54.0-105.0 W, dur 606-2149 s, n=3977 == run-46 echo (the %.0f print rounds 35.8->36 min). (2) Mined-cell path verified to fail exactly as in the model: best cell cv=1.925 > DUTY_CV_MAX 0.60 -> fallback fired. (3) Run-basis replicated EXACTLY: 2386 candidates (7.34/day) == run-46 echo (amp_lo 40 = 0.8x passive mark amp 50 W, dur_lo 250 = mark 12.5 min/3, dur_hi 2149 = band p95, iso 150 W / 600 s).\n\nHEADLINE: the fridge emission gates are self-referential population p5-p95 percentiles (fpop = duty-window events amp<=120 W) - both dur tails and both amp tails are excluded BY CONSTRUCTION and were never counted anywhere in the campaign. The fridge is 82% of all pooled misses (1637/1991; R 0.416, F1 0.519) - this is the campaign's largest recall hole by far.\n\nTAIL CENSUS (pre-span, 325.1 d, uncovered-by-both-bases after exact coverage-map subtraction): T1a dur<250 s 4.50/day -> 3.31/day uncovered (dur p50 138 s, amp p50 71 W; invisible to both bases: event lo 606 s, run lo 250 s); T1b 250-606 s 2.61 -> 1.10 (run-basis absorbs 58%); T2a 2149-2400 s 0.53 -> 0.34; T2b >2400 s 4.76 -> 1.19 (run-basis absorbs 75% via mid-run mask breaks; dur p50 4230 s, amp p50 66 W, 71% have an in-band event within 45 min, nearest-gap p50 96 s - same compressor, definitively); T3 amp 105-120 W 0.60 -> 0.25; T4 amp 40-54 W 0.58 -> 0.21. TOTAL truly-unmeasured: 2081 events = 6.40/day vs admitted 10.18 (event) + 7.34 (run-basis). Context: >=1000 W bursts occupy 2.9% of wall-clock; 13.1% of in-band events overlap bursts (swallowing risk secondary).\n\nEV (eval-only purity disclosed; conservative accounting uses uncovered-only): +576 candidate episodes/90 d against the fridge miss budget 1107 (12.3/day). Fridge F1 projection at p purity: p=0.5 -> 0.57, p=0.6 -> 0.60, p=0.8 -> 0.64, p=1.0 -> 0.69 (from 0.519; mean_device_f1 +0.011 to +0.034; pooled_cycle_f1 0.539 -> 0.60-0.67). The lift is robust to mediocre purity (added preds are few vs the denominator). Ceiling note: tails alone reach 0.69 at perfect purity - 0.7 needs the burst-swallow recovery (~1/day) on top. Purity prior: amp band 54-105 W is appliance-specific by construction (model caps the population at 120 W to exclude laptops/heaters; T2b cycling coupling is definitive) - higher than the 20-30% shape-fingerprint prior, but eval-only.\n\nANTI-OVERFIT: pre-span only; no eval-span variant evaluated; no cap spend (fridge stays 3/3); parameters only from calib marks + session conventions; pre-span submeter never loaded. Caveats disclosed: passive-window mark amp 50 W sits below the population mode (model comment), so run-basis amp_lo 40 W inherits that; the dur band p5-p95 is population-derived, never validated against cycle-length reality; tail purity is eval-only.","title":"diagnostic: fridge dur-tail pools hold 6.40/day unmeasured mass","summary":"Fridge p5-p95 gates reject 6.40/day compressor-class mass (run-basis 2386 replication exact); +576 eps/90d, fridge F1 0.52->0.57-0.69 by purity. Owner call: cap 3/3.","timestamp":1790470351228,"segment":1,"confidence":16.594591399738835,"asi":{"hypothesis":"the fridge event/run dur+amp gates (population p5-p95, self-referential) reject compressor-class mass outside the band that no existing path emits; the tails are the fridge miss mechanism","rollback_reason":"diagnostic-only: code unchanged at 71ad484, run 47 bitwise-identical to baseline; tails measured pre-span only with exact band + run-basis replication (2386 == echo); no cap spend, no eval-span variant","next_action_hint":"fridge tail pools = the one live F1 candidate with mass: extending the dur band below 606 s (and amp to FR_POP_AMP_HI) is a 4th fridge-family spend (cap 3/3) requiring owner authorization; ceiling fridge F1 0.69 at perfect purity, 0.60-0.64 at realistic purity; regression package (runs 44+45: mean_mae_w 20.87 / worst 46.87 at bitwise-identical F1) and the mw chain carve-out (0.28/day) also still await owner authorization"}}
{"run":48,"commit":"71ad484","metric":0.5896539900882762,"metrics":{"min_device_f1":0.36170212765957444,"pooled_cycle_f1":0.5393181428816174,"mean_mae_w":23.507104638131494,"worst_mae_w":54.020482254652265,"mean_nmae":0.067679223542272,"coverage_pred_share":0.25648754042515737,"coverage_true_share":0.25263950366526144,"kettle_f1":0.7792998477929985,"microwave_f1":0.36170212765957444,"fridge_f1":0.5186500888099467,"washing_machine_f1":0.6219512195121951,"dishwasher_f1":0.6666666666666666,"kettle_mae_w":10.264401709977083,"microwave_mae_w":7.0179556473755715,"fridge_mae_w":28.46002323504671,"washing_machine_mae_w":54.020482254652265,"dishwasher_mae_w":17.77266034360585},"status":"discard","description":"i44 diagnostic-only iteration (pre-span, free, no cap spend, no eval-span variant). Code unchanged at 71ad484; official run 48 bitwise-identical to the HEAD baseline (8/8 top-level + 10/10 per-device, full precision).\n\nREPLICATION VALIDITY: .scratch/diag_i44.py + diag_i44b.py rebuild the dw30 machinery with the model's own functions (_dw30_profile, _runs, _merge_runs, _dw30_grid, _extract_events). dw30 PASS runs 49 (0.151/day) == run-46/47 echo; profile bands reproduced exactly (span [2736, 6112.5] s, amp_lo 2106.8, mean [495.2, 943.0], hs [0.197, 0.612], idle<=144, dens<=0.1842, merge_n 140, heat 1622.6, no dens_lo). First-kill accounting closes exactly: 1085 raw merged runs = 49 pass + 1036 kills.\n\nPART A - dw30 FAILING-RUN CENSUS (the dw's missing half; dw F1 0.667, P 1.000, R 0.500 - needs only ~2 TPs/90d for the 0.7 goal): first-kill kills: sub-min (<20 min plateaus) 430 (1.32/day; p90 amp p50 2340 W, hs 1.00, dens 0, meal-hour tod - cooking bursts, correctly rejected per the DW_RUN_MIN_S design); span_band 366; amp_lo 182 (p90 p50 1643 W - weak plateaus, not dw-class); mean_band 34 (wm-like chatter); hs 8; idle 9; dens 7. Failure-vector refinement (all gates per run): single-gate failures are RARE - span-only 26 (0.080/day), dens-only 7, amp-only 5, idle-only 4, hs-only 3; 1036/1085 raw runs fail MULTIPLE gates -> the gate set is well-jointed, not over-tight. The span-only pool: span p10/50/90 1470/7035/12240 s - 62% ABOVE the band hi (the 70-min heater_gap_merge fusing adjacent dw cycles into 117-min runs; each occurrence can lose BOTH GT episodes) and 38% below lo (eco-length); tod morning-weighted (13/26 in 06-09h). Mass 7.2 candidate episodes/90d vs the 2-TP need; breakeven purity ~0.45-0.5 because dw P = 1.000 (added impurity dilutes P directly). VERDICT: real but marginal door - a 4th dw spend on span-band relaxation alone is not justified by this evidence; the merged-pair artifact (62% of the pool) is the more interesting structure.\n\nPART B - FRIDGE BURST-SWALLOW CENSUS (replaces i43's '~1/day' estimate): bursts >=1000 W: 2988 (9.19/day, dur p50 132 s); 537 (1.65/day) have the compressor running at onset (exc30 in [40, 105] one cell before). Geometric kill factor 1/3 (burst must land in the first third of the GT episode for the pre-burst fragment to fail the bench duration_band [1/3, 3]) -> 0.55/day swallowed-episode proxy. KEY MECHANISM NOTE: the pre-burst fragment is usually ALREADY emitted (the rise precedes the burst; fridge emission is chain-blind) - the burst fragments the pred episode so it fails the duration ratio, i.e. the swallow DAMAGE is a match failure, not a missing emission. Repairing it (extending the pred through the burst shadow) is precision-POSITIVE: converts unmatched preds into TPs without adding FP mass (+0.55/day TP at unchanged pred count -> fridge F1 0.519 -> 0.540 by itself).\n\nCOMBINED FRIDGE CEILING (tails 6.40/day from i43 + swallow repair 0.55/day): F1 = 0.706 at p=1.0 (crosses 0.70), 0.660 at p=0.8, 0.608 at p=0.6 (from 0.519). The 0.7 goal for fridge is plausible ONLY with the combined package at high purity.\n\nANTI-OVERFIT: pre-span only (325.1 d); no eval-span variant evaluated; no cap spend (all families stay at their spent counts); parameters only from calib marks + session conventions; pre-span submeter never loaded. Caveats disclosed: the swallow kill factor 1/3 is a geometric proxy (uniform burst position); the compressor-running-at-onset proxy uses the run-basis amp window on exc30 (the same circularity the detector has - disclosed); dw span-only purity (dw-eco vs oven/merged-pair) is eval-only.","title":"diagnostic: dw gates well-jointed; fridge swallow 0.55/day","summary":"dw30 census: 1036/1085 raw runs multi-fail; span-only 0.080/day (62% over-hi merged pairs) - weak door, breakeven purity 0.45-0.5. Fridge swallow proxy 0.55/day; combined fridge ceiling 0.70.","timestamp":1790470574974,"segment":1,"confidence":25.850585359644015,"asi":{"hypothesis":"dw30 gate rejects hold the dw's missing half (eco cycles / merged pairs); fridge burst-swallowing fragments otherwise-matchable compressor episodes","rollback_reason":"diagnostic-only: code unchanged at 71ad484, run 48 bitwise-identical to baseline; both censuses pre-span only with exact replication (49 pass == echo, accounting closes); no cap spend, no eval-span variant","next_action_hint":"dw verdict: gates well-jointed, span-only door marginal (0.080/day, breakeven purity 0.45-0.5, P=1.0 makes it unforgiving) - no spend recommended on this alone; the merged-pair artifact (62% over-hi) is the sharper dw structure; fridge owner package upgraded: tails 6.40/day + swallow repair 0.55/day (precision-positive) -> ceiling F1 0.706 at p=1.0 - the 4th fridge spend is now the highest-EV F1 authorization; mw carve-out (0.28/day) and the regression package (mean_mae_w 20.87 / worst 46.87) unchanged and still awaiting owner direction"}}
