{"run":53,"commit":"71ad484","metric":0.5896539900882762,"metrics":{"min_device_f1":0.36170212765957444,"pooled_cycle_f1":0.5393181428816174,"mean_mae_w":23.507104638131494,"worst_mae_w":54.020482254652265,"mean_nmae":0.067679223542272,"coverage_pred_share":0.25648754042515737,"coverage_true_share":0.25263950366526144,"kettle_f1":0.7792998477929985,"microwave_f1":0.36170212765957444,"fridge_f1":0.5186500888099467,"washing_machine_f1":0.6219512195121951,"dishwasher_f1":0.6666666666666666,"kettle_mae_w":10.264401709977083,"microwave_mae_w":7.0179556473755715,"fridge_mae_w":28.46002323504671,"washing_machine_mae_w":54.020482254652265,"dishwasher_mae_w":17.77266034360585},"status":"discard","description":"i49 is a HOLDING iteration with no model change - the evaluation re-ran the unchanged baseline at HEAD 71ad484 and reproduced every metric bitwise for the third time (mean_device_f1 0.5896539900882762, mean_mae_w 23.507104638131494; identical to runs 46-49 and 52). The iteration's work is a PRE-SPAN, AGGREGATE-ONLY calibration-robustness audit (.scratch/diag_i49.py, never touches the official bench, eval span, or model.py): build_calibration_v2 was re-run under 26 protocol-legal seeds (k_calib=5, press jitter +-30 s, fridge 3 h passive window unchanged) and every mark-derived constant the model consumes was measured across draws. VALIDATION ANCHORS: (1) the frozen draw's constants reproduce the recorded calibration exactly (kettle amp 2477 W, mw amp 1583 W, fridge amp 50 W dur 750 s, wm amp 2240 W with the known 4-mark drop, dw amp 2163.5 W); (2) the frozen mw burst-band count (750 events) equals the official i42 census identity exactly (659 non-chain admitted + 91 chain-interior shorts); (3) some draws drop to 4 marks per device, matching the known recording-gap protocol behavior. FINDINGS: (a) pre-span mw band admission swings 734-1238 events across draws (frozen 750, median 992, p95 1238 - a 67% p5-to-p95 swing) because mark.microwave.dur_s spans 48-129 s across draws (frozen 48 s sits AT the p5/minimum) and the REL_DUR ceiling scales with it; (b) chain thresholds seed_thr/heat_thr wobble +-20% (frozen 1082/1623 W at the p95 edge); (c) wm/dw run-basis bands wobble up to 222% (dw density ceiling p95 0.52/min vs frozen 0.052 - some draws open the gate 10x; wm span floor p5 234 s vs frozen 1823 s); (d) kettle/wm amp and mean_w sit AT or ABOVE the cross-draw p95 in the frozen draw (kettle mean_w 2478 vs median 2029); (e) ~5% of draws produce degenerate fridge profiles (3 h window catches no complete compressor cycle: amp p5 30 W) and ~5% catch heater draws (amp p95 658 W). INTERPRETATION: the official score 0.5897 is ONE draw from a wide protocol-noise distribution - the benchmark freezes CALIB_SEED=2026, so the score is protocol-valid but its calibration-sampling uncertainty is unquantified by the benchmark by construction; the frozen draw is at the distribution EDGE for several admission-relevant constants (mw dur minimum, kettle/wm amp+mean maximum), though the net F1 effect of a central draw is unknowable pre-span (more mw admissions would carry the known chain/heater contamination). PRODUCT IMPLICATION: k_calib=5 is the binding fragility of the deployed model; the owner's decision 3 (new data/relaxed constraints) is now quantified - more calibration marks per device, or a mark-ensemble protocol, would directly shrink these swings. DECLINED THIS ITERATION (recorded for governance): (1) the heater-filtered subset of the i47 mw chain pool - it is post-hoc re-litigation of a discarded pre-registration; EV arithmetic: ~79% of 91 events = ~20 eval preds, central mechanistic prior ~21% conversion gives mean +0.001, the measured 17% prior gives -0.0005 - marginal upside against a known-dead prior class, declined on both grounds; (2) evaluating resampled-calibration seeds on the eval span - off-protocol (the benchmark freezes the seed) and would be benchmark manipulation if any favorable draw were kept; (3) E3-scale groundwork - remains owner-gated. NO admission-pool spend: all families remain dead at the 17% prior vs 18.1-41.2% breakevens. Status discard = nothing kept; no code change exists to revert.","title":"i49 holding: calib-resample audit - constants wobble, frozen draw edge","summary":"Holding, no change (baseline bitwise 3rd time). Audit: 26 calib draws swing admission constants to +/-65%; frozen draw at edge. k_calib=5 is the fragility.","timestamp":1790472209515,"segment":1,"confidence":142.99295086054371,"asi":{"hypothesis":"The terminal model's mark-derived constants are materially draw-dependent under the frozen calibration protocol (k_calib=5, +-30 s jitter): 26 protocol-legal resamples swing admission-relevant constants and pre-span admission counts by tens of percent, so the official score is one draw from a wide, benchmark-unquantified calibration-noise distribution","rollback_reason":"No variant applied: holding iteration - the audit is scratch-only, pre-span, aggregate-only (submeter used only by the sanctioned mark-placement pathway) and never touched the official bench, eval span, or model.py; the baseline reproduced bitwise a third time so there is nothing to revert","next_action_hint":"Do NOT spend eval-span evaluations on draw-robustness variants (unquantified EV, same fishing pattern as the dead pools) and never resample the frozen seed on the eval span. Owner decisions sharpened: (3) new data/constraints now quantified - k_calib=5 is the binding fragility; (1) primary redefinition (regression package, runs 44/45) and (2) E3-scale rebuild unchanged. Loop stays in holding without direction"}}
{"run":54,"commit":"71ad484","metric":0.5896539900882762,"metrics":{"min_device_f1":0.36170212765957444,"pooled_cycle_f1":0.5393181428816174,"mean_mae_w":23.507104638131494,"worst_mae_w":54.020482254652265,"mean_nmae":0.067679223542272,"coverage_pred_share":0.25648754042515737,"coverage_true_share":0.25263950366526144,"kettle_f1":0.7792998477929985,"microwave_f1":0.36170212765957444,"fridge_f1":0.5186500888099467,"washing_machine_f1":0.6219512195121951,"dishwasher_f1":0.6666666666666666,"kettle_mae_w":10.264401709977083,"microwave_mae_w":7.0179556473755715,"fridge_mae_w":28.46002323504671,"washing_machine_mae_w":54.020482254652265,"dishwasher_mae_w":17.77266034360585},"status":"discard","description":"i50 is a HOLDING iteration with no model change - the evaluation re-ran the unchanged baseline at HEAD 71ad484 and reproduced every metric bitwise for the FOURTH time (mean_device_f1 0.5896539900882762, mean_mae_w 23.507104638131494). The work completes the calibration-fragility characterization started in i49 (run 52): a 4-arm variance decomposition plus a protocol-relevant jitter supplement (.scratch/diag_i50.py, diag_i50b.py - scratch-only, pre-span, aggregate-only, official bench/eval span/model.py untouched). ARMS (25 resampled seeds each unless noted): A full resample (k=5, jitter +-30 s) = i49's baseline; B selection only (jitter 0); C jitter only (frozen selection, jitter 0-50 s); D k=10 and k=20 with protocol jitter. ATTRIBUTION: (1) CYCLE SELECTION DOMINATES - arm B alone reproduces nearly the full admission wobble (mw band events 607-1111 vs arm A 734-1238; mw mark dur spread 75.6% vs A 103.8%; chain seed_thr spread 25.9% vs A 19.6%); (2) PRESS JITTER IS SECONDARY - within a fixed selection, 0-30 s protocol jitter moves mw admission by only +6-8% (seeds 2026: 694->750; seed 3: 703->748), but can interact pathologically with a specific selection (seed 17: mw dur 48->138 s and chain seed_thr 536->1055 W between jitter 0 and >=10 s - zero jitter can sit window probes exactly on mask bounds and misread a mark amp by 2x); between-selection spread (~2x admission) dwarfs within-selection jitter (+6-8%). K_SCALING (decision-3 quantification): mw band admission spread 50.3% (k=5) -> 45.6% (k=10) -> 31.8% (k=20); mw mark dur spread 103.8% -> 76.4% -> 55.0%; chain seed_thr 19.6% -> 14.9% -> 12.6%; the tight-band low tail disappears as k grows (adm.mw p5 734 -> 704 -> 864) and median constants shift toward population centers (mw dur median 78 -> 84 s vs the frozen draw's 48 s). PRODUCT TRANSLATION: doubling the calibration marks gives only modest stabilization; QUADRUPPLING to k=20 gives real stabilization (admission spread -36%, dur spread -47%); a tighter press protocol removes only the secondary jitter term (and zero jitter is not safer - seed 17's pathological zero-jitter read shows the protocol's +-30 s jitter is not the worst case). The frozen draw sits at the TIGHT edge of the mw duration distribution; the net eval-span effect of a central draw is UNKNOWABLE pre-span (any added admissions carry the measured chain/heater contamination), and evaluating resampled seeds on the eval span remains forbidden (off-protocol; keeping a favorable draw would be manipulation). DECLINED (unchanged): admission-pool spends (all dead at the 17% prior vs 18.1-41.2% breakevens), the heater-filtered i47 subset (post-hoc re-litigation), menu item 3 (F1-bitwise-identical on an identical baseline, unkeepable under the named metric), E3 groundwork (owner-gated). STATUS: the calibration-fragility characterization (i49+i50) is COMPLETE - the robustness question is closed; further audits would re-measure the same distribution. Status discard = nothing kept; no code change exists to revert.","title":"i50 holding: calib wobble attributed - selection dominates","summary":"No change (bitwise 4th time). Wobble attributed: selection dominates (66% spread alone), jitter secondary (+6-8%); k=20 cuts admission spread to 32%. Decision 3 quantified.","timestamp":1790472415127,"segment":1,"confidence":157.531110061054,"asi":{"hypothesis":"The calibration wobble decomposes into cycle-selection variance (dominant: selection-only resampling reproduces nearly the full admission spread) plus press-jitter variance (secondary: +6-8% admission within a selection, with occasional pathological selection-jitter interaction at zero jitter), and shrinks slowly with k_calib (mw admission spread 50.3% -> 45.6% -> 31.8% at k=5/10/20)","rollback_reason":"No variant applied: holding iteration - the audits are scratch-only, pre-span, aggregate-only and never touched the official bench, eval span, or model.py; the baseline reproduced bitwise a fourth time so there is nothing to revert","next_action_hint":"The calibration-fragility characterization is COMPLETE (i49+i50) - do not re-audit, do NOT evaluate resampled seeds on the eval span, and do NOT build draw-robustness variants (unquantified EV). Owner decisions stand: (1) primary redefinition (regression package, runs 44/45), (2) E3-scale rebuild, (3) new data/constraints now fully quantified: k=20 marks halves the wobble, tighter press protocol removes only the secondary jitter term"}}
{"run":55,"commit":"71ad484","metric":0.5896539900882762,"metrics":{"min_device_f1":0.36170212765957444,"pooled_cycle_f1":0.5393181428816174,"mean_mae_w":23.507104638131494,"worst_mae_w":54.020482254652265,"mean_nmae":0.067679223542272,"coverage_pred_share":0.25648754042515737,"coverage_true_share":0.25263950366526144,"kettle_f1":0.7792998477929985,"microwave_f1":0.36170212765957444,"fridge_f1":0.5186500888099467,"washing_machine_f1":0.6219512195121951,"dishwasher_f1":0.6666666666666666,"kettle_mae_w":10.264401709977083,"microwave_mae_w":7.0179556473755715,"fridge_mae_w":28.46002323504671,"washing_machine_mae_w":54.020482254652265,"dishwasher_mae_w":17.77266034360585},"status":"discard","description":"i51 is a HOLDING iteration with no model change - the evaluation re-ran the unchanged baseline at HEAD 71ad484 and reproduced every metric bitwise for the FIFTH time (mean_device_f1 0.5896539900882762, mean_mae_w 23.507104638131494). The work is the final decision-dossier component: a per-device GT-cycle VISIBILITY FUNNEL decomposing each device's recall gap into information-limited vs band-limited vs algorithmic shares (.scratch/diag_i51.py - pre-span only, aggregate-only, ANALYSIS-ONLY: no design constant, gate, or threshold is derived from it; the pre-span submeter GT is used exactly as the bench's own mark-placement pathway uses it, and the output is a coverage statistic for owner decisions). METHOD (fixed after a time-base bug: absolute unix-seconds cycle spans vs recording-relative event samples - first run printed all zeros, diagnosed and corrected): for each device, GT cycles via the bench's cycles_from_mask on the pre-span span; three overlap layers against (a) the extracted aggregate events and (b) the exc30 >= heat-threshold blocks for program devices: L1_any = cycle overlapped by ANY extracted event; L1_50 = an event covers >= 50% of the cycle span; L2_band = an overlapping event sits in the device's mark-anchored admission band (kettle amp 1982-2972 W/dur 44-396 s, mw amp 1266-1900 W/dur 16-144 s, fridge 40-300 W; wm/dw: a >=1623 W exc30 block overlapping the cycle). RESULTS (n_cyc, L1_any, L1_50, L2_band, eval recall, capture = eval_R/L2_band): kettle 1160, 0.909, 0.899, 0.572, 0.699, 1.224; microwave 899, 0.904, 0.809, 0.310, 0.297, 0.958; fridge 7774, 0.821, 0.746, 0.779, 0.416, 0.534; washing_machine 208, 0.966, 0.822, 0.942, 0.637, 0.677; dishwasher 94, 0.968, 0.638, 0.968, 0.500, 0.516. READING: (1) the aggregate information ceiling is HIGH everywhere (L1_any 0.82-0.97) - the INPUT is not the binding constraint anywhere, so decision 3 is forced by contamination economics, not by invisible cycles; (2) microwave capture 0.958: eval recall (0.297) sits AT the frozen band's own ceiling (0.310) - the mw loss is band-limited, not algorithmic; the only band-relief lever (admitting the 143 out-of-band long events) was measured dead in the menu era at the 16.7% conversion prior; (3) kettle capture 1.224: eval recall EXCEEDS the pre-span in-band overlap - cross-span population differences and matching onset tolerance (tau 60-600 s) make capture an indicative, not exact, statistic (caveat disclosed); (4) fridge/wm/dw capture 0.51-0.68: substantial ALGORITHMIC recall headroom exists in recall terms, but every measured lever to claim it (additional admissions, pool expansion, chain relaxation) was priced dead at the 18.1-41.2% breakevens against the measured 16.7% conversion - recall headroom is real, F1 headroom is not, under the named primary; (5) wm/dw L2_band is a loose proxy (any heat block, before profile-shape gating), so their true pipeline loss is even larger than capture suggests. DECISION DOSSIER NOW COMPLETE: score (0.5897) + bitwise terminal-state proof (5x) + calibration-noise envelope (i49) + wobble attribution and k_calib scaling (i50) + recall-gap decomposition (i51). The funnel does NOT reopen spends: it explains where the losses live and confirms the standing recommendation set. DECLINED (unchanged): admission-pool spends (dead at prior/breakevens), heater-filtered subsets (post-hoc), resampled-seed evals (off-protocol), draw-robustness variants, menu item 3 (F1-bitwise-identical on an identical baseline, unkeepable), E3 groundwork (owner-gated). Status discard = nothing kept; no code change exists to revert.","title":"i51 holding: recall gap = band + pipeline, input not binding","summary":"No change (bitwise 5th). Funnel: info ceiling 0.82-0.97 (input not binding); mw capture 0.96 band-limited; fridge/wm/dw 0.51-0.68 pipeline headroom, F1-priced dead. Dossier complete.","timestamp":1790472575676,"segment":1,"confidence":278.29611136835916,"asi":{"hypothesis":"The per-device recall gap decomposes into information-limited (aggregate-invisible cycles), band-limited (in-band raw material absent under the frozen admission bands), and algorithmic (pipeline) shares; the funnel shows the input ceiling is high (0.82-0.97), mw is band-limited (capture 0.958 at its band ceiling 0.310), and fridge/wm/dw carry 2x algorithmic recall headroom that is F1-priced dead","rollback_reason":"No variant applied: holding iteration - the funnel is scratch-only, pre-span, analysis-only (no constants derived), official bench/eval span/model.py untouched; baseline reproduced bitwise a fifth time so there is nothing to revert","next_action_hint":"Decision dossier is COMPLETE (score, 5x bitwise, calibration envelope, wobble attribution + k-scaling, recall decomposition). No further audits: the funnel explains but does not open spends (all levers F1-priced dead under the named primary). Owner decisions stand: (1) primary redefinition, (2) E3-scale rebuild, (3) new data/constraints (k=20 quantified in i50)"}}
{"run":56,"commit":"71ad484","metric":0.5896539900882762,"metrics":{"min_device_f1":0.36170212765957444,"pooled_cycle_f1":0.5393181428816174,"mean_mae_w":23.507104638131494,"worst_mae_w":54.020482254652265,"mean_nmae":0.067679223542272,"coverage_pred_share":0.25648754042515737,"coverage_true_share":0.25263950366526144,"kettle_f1":0.7792998477929985,"microwave_f1":0.36170212765957444,"fridge_f1":0.5186500888099467,"washing_machine_f1":0.6219512195121951,"dishwasher_f1":0.6666666666666666,"kettle_mae_w":10.264401709977083,"microwave_mae_w":7.0179556473755715,"fridge_mae_w":28.46002323504671,"washing_machine_mae_w":54.020482254652265,"dishwasher_mae_w":17.77266034360585},"status":"discard","description":"i52 is a HOLDING iteration with no model change - the evaluation re-ran the unchanged baseline at HEAD 71ad484 and reproduced every metric bitwise for the SIXTH time (mean_device_f1 0.5896539900882762, mean_mae_w 23.507104638131494). The work closes the one disclosed looseness from i51: the program-device (wm/dw) L2_band was a loose heat-block proxy; it is now refined to the FULL frozen run-basis gate using the model's own machinery (_dw30_profile/_wm30_profile/_dw30_runs/_chains/_name_program with the frozen seed-2026 calibration; pre-span only, aggregate-only, analysis-only - no constant derived). REPLICATION VALIDATED EXACTLY against the recorded run-46 stdout anchors after fixing two replication bugs (30 s grid-index-to-samples stride omitted for dw spans; chain merge gap guessed as 2 samples instead of meta merge_s = CHAIN_GAP_S 600 s = 100 samples): dw sustained runs 49 (0.151/day) = recorded 49 (0.151/day); wm net-new candidates 82 (0.252/day) = recorded 82 (0.252/day); named program chains wm=139 = recorded 357 pass structure, named wm=139 dw=0. REFINED FUNNEL: dishwasher - the dw30-gated runs (49, spans 46-102 min) overlap 0.500 of the 94 GT dw cycles and eval recall is 0.500: CAPTURE 1.000 - the dw pipeline converts EVERY gated run into a matched episode (eval P=1.000 consistent); the dw recall loss is ENTIRELY detector-yield (the shape gates admit only half the true programs; emission and matching lose nothing). washing_machine - the pipeline's wm emission material is the UNION of named chains (139, 0.462 cycle overlap) and net-new sustained candidates (82): union overlap 0.817 of 208 GT cycles, eval recall 0.6375: CAPTURE 0.780 - moderate conversion loss on a 0.817 material ceiling (i51's loose proxy had overestimated material at 0.942 and underestimated conversion at 0.677). FINAL CAPTURE LADDER (recall gap decomposition, all validated): kettle 1.224 (cross-span caveat; band-limited-ish), microwave 0.958 (band-limited: eval recall 0.297 sits at its frozen band ceiling 0.310), fridge 0.534 (emission/dedup loss), washing_machine 0.780 (emission loss on 0.817 material), dishwasher 1.000 (pure detector-yield limit). UNIFIED CONCLUSION: no device loses material to the aggregate input (L1_any 0.82-0.97); the recall losses live in (a) the frozen admission bands, (b) the detector shape gates, (c) the emission/dedup machinery - every lever that would widen (a) or relax (b)/(c) is an admission spend priced dead at the 18.1-41.2% breakevens against the measured 16.7% conversion. The decision dossier is now FINAL and fully anchor-validated: score + 6x bitwise terminal-state proofs + calibration-noise envelope + wobble attribution/k-scaling + recall decomposition with exact pipeline replication. DECLINED (unchanged): admission-pool spends, heater-filtered subsets (post-hoc), resampled-seed evals (off-protocol), draw-robustness variants, menu item 3 (F1-bitwise-identical on an identical baseline, unkeepable), E3 groundwork (owner-gated). Status discard = nothing kept; no code change exists to revert.","title":"i52 holding: program capture refined - dw yield-limited","summary":"No change (bitwise 6th). Anchors exact (49/82/139). dw capture 1.00 = pure detector yield; wm 0.78 on 0.817 material. Losses: bands, gates, emission - all F1-priced dead. Dossier final.","timestamp":1790472831201,"segment":1,"confidence":1192.4105333845587,"asi":{"hypothesis":"Refining the program-device material proxy to the full frozen run-basis gate shifts the decomposition: dw is a pure detector-yield limit (capture 1.000 - zero emission loss), wm converts 0.780 of an 0.817 material ceiling; the recall losses live in bands, gates, and emission machinery, never in the aggregate input","rollback_reason":"No variant applied: holding iteration - the refinement is scratch-only, pre-span, analysis-only with exact anchor replication (49/82/139), official bench/eval span/model.py untouched; baseline reproduced bitwise a sixth time so there is nothing to revert","next_action_hint":"Dossier FINAL - no disclosed loosenesses remain; all future iterations are pure holding controls unless the owner decides on (1) primary redefinition, (2) E3-scale rebuild, (3) new data/constraints. No further audits or spends under the named primary"}}
