{"run":76,"commit":"df85d3c","metric":0.313629,"metrics":{"mean_device_f1_p10":0.304885,"median_kettle_f1":0.524061,"median_microwave_f1":0.239266,"median_fridge_f1":0.328763,"median_washing_machine_f1":0.216631,"median_dishwasher_f1":0.342203,"transfer_mean_f1":0.151921,"b1_events_mined":5260,"b1_enroll_top1_enc":0.84,"b1_enroll_top1_raw":0.65,"b1_cross_house_top1":0.21,"b1_gate_kettle_kept_frac":0.813,"b1_gate_mw_kept_frac":0.853,"b2_probe_mw_iso_mean":0.34,"b2_probe_iso_all_mean":0.61,"device_balanced_mean":0.313828,"house_1_v4_mean":0.48456,"v4_n_pairs":66,"v4_n_houses":20,"fridge_median_delta":0.063684,"primary_delta":0.007201},"status":"discard","description":"Hypothesis (from this iteration's diagnostic): the fridge's bimodality is caused by a pair of amp floors that both sit ABOVE the true compressor step on the majority of the pool - the extractor's rise/fall floor AMP_MIN_W = 50.0 W, and the fridge candidate-class floor DUTY_AMP_W[0] = 40.0 W. Change: AMP_MIN_W 50.0 -> 20.0 and DUTY_AMP_W (40.0, 300.0) -> (20.0, 300.0). Two literals, nothing else touched. DUTY_DUR_S stays (600, 2400) s so the duration band cannot collapse into blips.\n\nWHY THE AMP FLOORS ARE THE CAUSE (new diagnostic this iteration, GT used for diagnosis only, never in the model). Instrumented the coarse grid against ground truth on 9 houses. (1) The TRUE mains step at GT fridge onsets is monotone in fridge F1: eco/house_02 63 W -> F1 0.75 and ukdale/house_1 64 W -> 0.49 both have a step ABOVE 50 W, hence mined events; every collapsing house has a step BELOW it - refit/house_17 91 W (its p10 is 26), eco/house_06 42 W -> 0.002, refit/house_10 41 W -> 0.02, refit/house_8 33 W -> 0.16, refit/house_12 33 W -> 0.03, eco/house_01 30 W -> 0.04, eco/house_03 22 W -> 0.03. (2) The mined population band is therefore structurally too high everywhere: p5 = 51 W on every house, because dm filters ev_amp >= 40 W and the extractor can never produce an event below AMP_MIN_W = 50 W. (3) The run-basis path, which exists exactly for sub-floor compressors, is gated on TWO numbers read off a single unlabeled 3 h passive window, and the census shows it cannot work in principle: the peak coarse-grid residual DURING a GT fridge cycle is 100-480 W (p50 103-477 W across houses) against a band ceiling of only 81-117 W, so the level window can never contain a fridge cycle in a real house - the fraction of GT cycles whose peak residual is inside the window is 0.00-0.68 and the fraction actually overlapped by an admitted run is 0.00-0.35. The asymmetry that explains everything: a MINED EVENT measures a STEP (fut - past, robust to the house's background), while the coarse grid measures a LEVEL (not robust). The two houses that work are exactly the two whose step clears the step floor. (4) eco/house_06 is a separate, unfixed failure: its window IS satisfied for 68% of cycles but its GT cycle is 4.0 min against an 11 min duration floor, so it is killed by the band, not the level.\n\nRESULT (bench v4, 5 seeds, 66 pairs, 20 houses, 66.7 s, checks pass). primary mean_device_f1 0.306428 -> 0.313629 (+0.0072); p10 0.299752 -> 0.304885 (+0.0051); device-balanced 0.315375 -> 0.313828 (-0.0015, i.e. the gain is concentrated in the fridge pairs which carry 18/66 of the pool weight); median fridge 0.265079 -> 0.328763 (+0.0637, the best fridge readout of the campaign and roughly 10x any movement measured so far); median kettle 0.536898 -> 0.524061 (-0.0128); median microwave 0.266004 -> 0.239266 (-0.0267); median washing_machine 0.228634 -> 0.216631 (-0.0120); median dishwasher 0.346705 -> 0.342203 (-0.0045); house_1_v4_mean 0.529246 -> 0.484560 (-0.0447). All four non-fridge device medians are inside the -0.03 guard; p10 rises; only the primary misses the +0.01 bar, by 0.0028.\n\nINTERPRETATION: not noise. A +0.0637 device-median move on the heaviest device in the pool, from a change that is a direct test of a mechanism, with p10 and the pair mean both up, is a real effect. The costs are the same defect seen from the other side: with the class floor at 20 W the population band widens DOWNWARD in every house, so a house whose compressor step is large (ukdale/house_1, step 64 W, whose passive mark 61 W is credible) now also admits 20-50 W lookalikes as fridge events - hence house_1 -0.0447 and the small non-fridge losses (one shared event set feeds all devices). The correct refinement is therefore per-house: keep the band's low edge near the credible mark where the mark IS credible, and take it from the data where it is not.\n\nVERDICT: discard under the standing keep rule (primary must rise >= 0.01). Reverted. But this run re-opens the fridge with the first structural explanation that fits every house, and the two literals are trivially re-appliable.\n\nNEXT (fridge, in order): (1) re-apply both floors and replace the p5/p95 population band with an AMP-MODE band - the amp value of the dominant mode of the low-floor fridge-class event population - which is the statistic that separates eco/house_03 (mode at its 22 W fridge, ~13 cycles/day) from eco/house_02 (mode at its 63 W fridge, 20-50 W events are lookalikes); note the earlier cell detector's failure was its occupancy and CV gates, not the idea of clustering the population by amp, so an amp histogram with no CV gate is untested; (2) then handle eco/house_06 by making the duration band follow the house's own cycle period (GT p50 4.0 min vs an 11 min floor). Attribution risk: changes (1) bundle the two floors with the mode band - run them as separate ablation if the result is ambiguous.","title":"fridge amp floors 50/40 -> 20: +0.0072 primary, fridge +0.0637","summary":"Extractor step floor 50->20 W and fridge class floor 40->20 W unblinded sub-50 W compressors: primary +0.0072, p10 +0.0051, fridge 0.265->0.329. Sub-bar, reverted.","timestamp":1790496094226,"segment":2,"confidence":1.1622476483854993,"asi":{"hypothesis":"the fridge collapses wherever the true compressor step is below the amp floors: the extractor's AMP_MIN_W = 50 W and the class filter DUTY_AMP_W[0] = 40 W, both above the 22-46 W steps measured at GT onsets on 6 of 8 collapsing houses","outcome":"CONFIRMED in direction, sub-bar in size: primary 0.306428 -> 0.313629 (+0.0072, needs +0.01), p10 +0.0051, median fridge 0.265079 -> 0.328763 (+0.0637, best of the campaign, ~10x noise), device-balanced -0.0015; costs: house_1 -0.0447, mw -0.0267, kettle -0.0128, wm -0.0120, dw -0.0045 (all inside the -0.03 guard).","rollback_reason":"primary misses the +0.01 keep bar by 0.0028 and house_1 (a standing-bar device) drops 0.0447 because the widened class floor drags every house's population band downward into 20-50 W lookalikes","next_action_hint":"re-apply both floors, then replace the p5/p95 population band with an AMP-MODE band (dominant mode of the low-floor fridge-class event population) so a house with a large compressor does not inherit a 20 W floor; separately, let the duration band follow the house's own cycle period to rescue eco/house_06 (GT 4.0 min vs an 11 min floor). The run-basis level path is now provably dead: the peak coarse-grid residual during a GT fridge cycle is 100-480 W vs a <=117 W ceiling, so a level window cannot contain a fridge cycle - only STEP-based extraction can work.","new_finding":"the fridge's bimodality is fully explained by one number per house: the true mains step at GT fridge onsets (63/64 W -> F1 0.75/0.49, 22-46 W -> F1 0.00-0.16). The extractor's step floor is the binding constraint, not the gating, not the band edges, not the level path. Also: a mined event measures a step (background-robust) while the coarse grid measures a level (not background-robust) - this is why the run-basis path cannot work in principle, and it retires m8's level-based 'dead cell' lead for good."}}
{"run":77,"commit":"703a591","metric":0.321967,"metrics":{"mean_device_f1_p10":0.318039,"median_kettle_f1":0.536898,"median_microwave_f1":0.266004,"median_fridge_f1":0.328763,"median_washing_machine_f1":0.228634,"median_dishwasher_f1":0.346705,"transfer_mean_f1":0.151921,"b1_events_mined":5260,"b1_enroll_top1_enc":0.84,"b1_enroll_top1_raw":0.65,"b1_cross_house_top1":0.21,"b1_gate_kettle_kept_frac":0.813,"b1_gate_mw_kept_frac":0.853,"b2_probe_mw_iso_mean":0.34,"b2_probe_iso_all_mean":0.61,"device_balanced_mean":0.328482,"house_1_v4_mean":0.542204,"v4_n_pairs":66,"v4_n_houses":20,"fridge_median_delta":0.063684,"primary_delta":0.015539},"status":"keep","description":"Fridge deficit re-diagnosed as extraction-side only, and fixed by SCOPING the low step floor to the fridge (no shared-event collateral).\n\nCHANGE (src/experiments/04_autoresearch/model.py only): _extract_events gains an amp_min argument (default AMP_MIN_W); new FR_STEP_MIN_W = 20.0 and DUTY_AMP_W (40,300) -> (20,300); build_and_train mines a second, fridge-only event set from the same roll-median pre-span signal (fr_on/fr_off/fr_amp/fr_dur) and the fridge band mining now reads that set; predict mines the matching fridge-only set on the eval span and the fridge event block plus the fr_ok_idx overlap test use it. AMP_MIN_W stays 50 W and the shared event stream is untouched.\n\nWHY: run 76 lowered the GLOBAL floor to 20 W and gained fridge +0.0637 but only +0.0072 primary, with house_1 mean -0.0447. The collateral was the other four devices (kettle -0.0128, mw -0.0267, wm -0.0120, dw -0.0045) because the shared event set feeds every device's program and density statistics. Scoping the floor to the fridge removes that coupling.\n\nRESULT (seed-median over the frozen v4 pool, 66 pairs / 20 houses):\n  primary        0.306428 -> 0.321967  (+0.015539, bar +0.01 MET)\n  p10            0.299752 -> 0.318039  (+0.018287)\n  device_balanced 0.315375 -> 0.328482 (+0.013107)\n  house_1_v4_mean 0.529246 -> 0.542204 (+0.012958, guardrail IMPROVED)\n  medians: fridge 0.265079 -> 0.328763 (+0.063684); kettle 0.536898, microwave 0.266004, wm 0.228634, dishwasher 0.346705 ALL bit-identical to the floor.\n  Fridge band mined on the low-floor population: amp 22-111 W / dur 11-37 min (n=5610) on one house, amp 25-113 W / dur 10-33 min (n=6316) on the next, vs a floor band of 51-117 W that excluded every 22-46 W compressor.\n\nEVIDENCE FOR THE MECHANISM (GT-mask-on-mains step at fridge onsets, diagnosis only): 63-64 W on eco/house_02 (F1 0.75) and ukdale/house_1 (0.49); 22-46 W on refit/house_17 (0.09), eco/house_06 (0.002), refit/house_10 (0.02), refit/house_8 (0.16), refit/house_12 (0.03), eco/house_01 (0.04), eco/house_03 (0.03). A mined event measures a STEP (fut-past, background-robust) while the coarse grid measures a LEVEL, which is why only step-based extraction can see a sub-floor compressor. Run 74/75 bracketed the run-gate path at ~0, so the deficit was never the gating.\n\nRULES OUT: a different fridge emission path (level/event emission works once the events exist); the cell detector as the route (m8/m9 already refuted); and read-across from run 76 that the fridge change 'cost house_1' - it did not, the global floor did.\n\nSTILL OPEN: eco/house_06 has a GT cycle p50 of 4.0 min against an 11 min duration floor - the duration band, not the amp floor, is the next fridge lever.","title":"fridge-only 20W step floor: +0.0155 primary, fridge +0.0637","summary":"Primary 0.306428->0.321967 (+0.0155), p10 +0.0183, house_1 +0.0130; kettle/mw/wm/dw medians bit-identical (floor scoped to the fridge).","timestamp":1790496365002,"segment":2,"confidence":1.0750365706290146,"asi":{"hypothesis":"The fridge's amp floor is the whole deficit: a step-based mine at 20 W on the fridge's own event set recovers sub-50 W compressors without perturbing any other device's program.","mechanism":"FR_STEP_MIN_W=20 fridge-only extraction; shared event set and AMP_MIN_W unchanged; DUTY_AMP_W low edge 40->20 only feeds the fridge band.","evidence":"fridge median +0.0637, four other medians bit-identical to the floor, house_1 +0.0130, p10 +0.0183.","next_action_hint":"Follow the duration band per house (eco/house_06 GT cycle 4.0 min vs an 11 min floor); then pivot to the owner's directed work (52-literal parameter fit, B4 wm phase model)."}}
{"run":78,"commit":"703a591","metric":0.323317,"metrics":{"mean_device_f1_p10":0.314758,"transfer_mean_f1":0.151921,"median_kettle_f1":0.536898,"median_microwave_f1":0.266004,"median_fridge_f1":0.31864,"median_washing_machine_f1":0.228634,"median_dishwasher_f1":0.346705,"b1_events_mined":5260,"b1_enroll_top1_enc":0.84,"b1_enroll_top1_raw":0.65,"b1_cross_house_top1":0.21,"b1_gate_kettle_kept_frac":0.813,"b1_gate_mw_kept_frac":0.853,"b2_probe_mw_iso_mean":0.34,"b2_probe_iso_all_mean":0.61,"device_balanced_mean":0.326818,"house_1_v4_mean":0.537285,"v4_n_pairs":66,"v4_n_houses":20,"fridge_median_delta":-0.010123,"primary_delta":0.00135},"status":"discard","description":"HYPOTHESIS: the fridge EVENT path gated its duration on the pool population band\n(fridge_band['dur'], floor 10-11 min) while the RUN path used mark_dur/3 - and the\nbuild comment at model.py:1061-1064 asserts the event path uses 'the same 1/3 margin\nthe event path uses against the mark'. The pool floor therefore silently overrode the\nper-house calibration, which should exclude short-cycling fridges (eco/house_06 GT\ncycle p50 4.0 min, 1839 GT cycles/90 d but only 123 emitted at seed 2026).\nCHANGE (2 sites, no new constants): build fr_ok (L1077-1080) and predict ok\n(L1275-1284) both gate ev_dur/fr_dur_e on fridge_band['fr_run']['dur_lo'..'dur_hi']\n= (mark_dur/3, population top) - the band the run path already used.\nRESULT (bench v4, 130.5 s, checks pass): primary 0.321967 -> 0.323317 (+0.001350),\np10 0.318039 -> 0.314758 (-0.003281), device_balanced 0.328482 -> 0.326818,\nhouse_1_v4_mean 0.542204 -> 0.537285. Device medians: fridge 0.328763 -> 0.318640\n(-0.010123); kettle/microwave/wm/dishwasher bit-identical. seed_means 2026 .318169\n1 .323317 2 .337768 3 .334018 4 .312485.\nVERDICT: discard - primary far below the +0.01 keep bar AND p10 drops, which the\nrule forbids. The mean-over-pairs rose while the median fell, i.e. the worst fridge\nhouses gained (short cycles admitted) while mid-range houses lost: mark_dur/3 is\nSTRICTER than the pool floor for long-mark houses (mark 45 min -> 15 min floor vs\n10-11 min), so the change both widened and narrowed the band.\nWHAT IT RULES OUT: the fridge population duration floor is not a pure bug - it does\ngenuine precision work on mid-range houses; and the short-cycle census gap (123/1839)\nis partly real and partly worth only ~0.001-0.004 primary.\nNEXT: same structural idea with a monotonicity invariant - the marks may only WIDEN\nthe pool band, never narrow it: dur_lo = min(pool_lo, mark_dur/3), dur_hi unchanged.\nThat leaves every mid-range house bit-identical and only admits short cycles for\nhouses whose own 5 marks say their cycles are minutes long.","title":"fridge dur gate mark-relative: p10 -0.0033, fridge med -0.010","summary":"Mark-scaled short fridge events lifted the pair mean (+0.0014) but cost the median (fridge 0.3288->0.3186) and p10 (-0.0033): the pool duration floor was protective.","timestamp":1790496947629,"segment":2,"confidence":1,"asi":{"hypothesis":"fridge event-path duration gate should be mark-relative (mark_dur/3) as the run path and the build comment already claim","rollback_reason":"primary +0.0014 below the +0.01 bar and p10 fell -0.0033; fridge median -0.0101","next_action_hint":"retry with dur_lo = min(pool_lo, mark_dur/3) so the marks may only widen the pool band, never narrow it; expect mid-range houses bit-identical","mechanism":"mark_dur/3 is stricter than the 10-11 min pool floor whenever mark_dur > 33 min, so the change simultaneously widened (short-mark houses) and narrowed (long-mark houses) the admitted duration band"}}
{"run":79,"commit":"703a591","metric":0.322648,"metrics":{"mean_device_f1_p10":0.317801,"transfer_mean_f1":0.151921,"median_kettle_f1":0.536898,"median_microwave_f1":0.266004,"median_fridge_f1":0.328763,"median_washing_machine_f1":0.228634,"median_dishwasher_f1":0.346705,"b1_events_mined":5260,"b1_enroll_top1_enc":0.84,"b1_enroll_top1_raw":0.65,"b1_cross_house_top1":0.21,"b1_gate_kettle_kept_frac":0.813,"b1_gate_mw_kept_frac":0.853,"b2_probe_mw_iso_mean":0.34,"b2_probe_iso_all_mean":0.61,"device_balanced_mean":0.331399,"house_1_v4_mean":0.542204,"v4_n_pairs":66,"v4_n_houses":20,"fridge_median_delta":0,"primary_delta":0.000681},"status":"discard","description":"Hypothesis: a calibration statistic that is undefined (a fully-heated mark window has\nno idle level) or blocked (an onset correction clipped at 0) silently disables/biases the\ndishwasher detector; letting both degrade gracefully should recover the two dead scored dw\npairs (refit/house_10 dw 0.00, refit/house_11 dw 0.00).\n\nEdits (src/experiments/04_autoresearch/model.py only):\n1. both `idles.append(float(np.median(below)) if len(below) else 0.0)` -> `else None`, and\n   `'idle_hi': 2.0 * max(idles)` -> max over the non-None values (inf when none). Verified\n   (seed 2026): refit/house_10 dw 0.00 -> 0.1458 (n 1 -> 10, P=0.70, R=0.08); its profile\n   now prints idle<=infW instead of idle<=0W. Census: it is the ONLY pool house with a\n   0-valued idle_hi (other dw houses 263-1426 W, wm houses 122-2952 W), so the repair is\n   scoped to exactly one scored pair.\n2. `new_b = np.clip(old_b + med, 0.0, 1800.0)` -> lower bound -1800.0, plus a closed-loop\n   guard that restores the pre-correction onset when the re-measured probe bias worsens;\n   and the base clamp `ext_back_s = max(0.0, median(pres))` removed. Verified: refit/\n   house_11's synthetic probe self-corrects (ext_back -0.5 -> -11.0 min, pasted-onset\n   deltas -630/-630/-30 -> +0/+0/+600) BUT its real eval span does not move: dw stays\n   F1 0.00 n=12/12. => the pasted-mark probe is NOT a faithful proxy for the real span.\n\nMeasured (pool v4, 5 seeds, 105 s): primary 0.322648 (+0.000681 vs the 703a591 floor\n0.321967); p10 0.317801 (-0.000238); device_balanced 0.331399 (+0.002917); house_1 0.542204\n(flat). All five device medians bit-identical to the floor (dw median 0.346705 sits above\n0.146, so a gain on the lowest dw pair cannot move it). Seed means 2026 .322648 / 1 .322175\n/ 2 .329331 / 3 .331287 / 4 .314886. Verdict: discard - the gain is real on the pair that\nwas dead but far under the +0.01 bar, and it is seed-dependent (a deterministic +0.0022 is\neroded to +0.0007, so the probe-driven onset shift costs about the same elsewhere).\n\nReal-span geometry measured directly (emitted vs GT dw onsets, seed 2026):\n- refit/house_10 gt=86 em=10: every emission lands exactly on a GT onset (best|d| 0 s) but\n  only 7/86 GT are covered -> recall-limited, not placement-limited. Its own pasted marks\n  are rejected by its gates (0/3 recovered) with heater_gap_merge=70 min against a span\n  band of 8-21 min.\n- refit/house_11 gt=12 em=12: nearest miss 648 s against the 600 s TAU_ONSET_S tolerance.\n- controls: refit/house_16 32/58 and refit/house_21 37/76 and refit/house_13 34/73 within\n  tolerance -> the detector is near-correct wherever the profile is non-degenerate.\nAlso refuted (ACF over all 18 fridge pre-spans): the fridge cycle period is not recoverable\nfrom the mains - 8/18 peak at the 10 min search boundary, peaks miss GT p50 by 2-6x, and\nthe small-step rise count (36-170/day) exceeds the true cycle rate (20-47/day), a\nlookalike-dominated train consistent with the m9 interval-CV result.","title":"dw calibration degeneracy: idle sentinel + onset clamp (sub-bar)","summary":"pool 0.322648 (+0.0007), p10 -0.0002; house_10 dw 0.00->0.146 but house_11 real span flat; reverted","timestamp":1790497563883,"segment":2,"confidence":0.9687972855243248,"asi":{"hypothesis":"undefined (fully-heated mark -> no idle) or blocked (onset correction clipped at 0) calibration statistics silently disable/bias the dw detector","outcome":"discard: house_10 dw pair repaired (0.00->0.146) and house_11 probe self-corrects, but pool +0.000681 and p10 -0.000238","rollback_reason":"sub-bar on the primary (+0.0007 << +0.01) with a p10 drop; the pair-level gain is seed-dependent because the probe-driven onset shift is not reality-faithful","next_action_hint":"bundle the idle fix with (a) the dens_lo = 0.75*min(denss) zero-gate (5+ wm houses measure dens_lo=0.000, which disables the lower density gate) and (b) a merge-vs-span-band consistency fix for house_10's recall (merge 70 min vs span band 8-21 min), then measure the bundle","mechanisms":"idle sentinel; onset-correction sign clamp; synthetic pasted-mark probe is not a faithful proxy for the real eval span; ACF refutes fridge-period recovery","real_span_dw":"house_10 exact placement but 7/86 recall; house_11 648 s miss vs 600 s tol; controls 32/58, 37/76, 34/73"}}
