{"run":73,"commit":"df85d3c","metric":0.306428,"metrics":{"mean_device_f1_p10":0.299752,"median_kettle_f1":0.536898,"median_microwave_f1":0.266004,"median_fridge_f1":0.265079,"median_washing_machine_f1":0.228634,"median_dishwasher_f1":0.346705,"transfer_mean_f1":0.151921,"b1_events_mined":5260,"b1_enroll_top1_enc":0.84,"b1_enroll_top1_raw":0.65,"b1_cross_house_top1":0.21,"b1_gate_kettle_kept_frac":0.813,"b1_gate_mw_kept_frac":0.853,"b2_probe_mw_iso_mean":0.34,"b2_probe_iso_all_mean":0.61,"device_balanced_mean":0.315375,"house_1_v4_mean":0.529246,"v4_n_pairs":66,"v4_n_houses":20},"status":"keep","description":"Owner-directed protocol migration: bench v4 replaces v3's transfer track (which applied house_1's predictor to other homes) with the deployment path - every pool house re-calibrated on its own K=5 marks, its own pre-split history and a fresh build_and_train.\n\nNew files: .auto/bench_v4.py (per-home re-calibrated scorer over the frozen .auto/pool_v4.json; calibration marks from the last PRE_PROBE_DAYS before the split, the same window P2 proved holds >= 5 cycles, falling back to the full pre-split span for pairs P2 only passed there; GT is pool_v4._union_mask verbatim; device iteration in v1.DEVICES order so the RNG stream does not depend on which devices are absent). Migrated: .auto/measure.sh now runs bench_v4; .auto/checks.sh now validates the v4 artefacts (all five per-device medians present and in [0,1], primary/p10/device-balanced/house_1 finite in [0,1], and scored houses/pairs equal to the frozen pool's 20/66 - a dropped house or pair fails the gate).\n\nv4 FLOOR AT HEAD (5 seeds, 66 pairs, 20 houses, 128 s, checks pass):\n  primary mean_device_f1 (pair-mean, median over seeds) = 0.306428\n  p10 over seeds                                      = 0.299752\n  device-balanced (mean of the 5 device means)         = 0.315375\n  house_1 subset (re-calibrated, 5 pairs)              = 0.529246\n  per-device medians: kettle 0.536898 / microwave 0.266004 / fridge 0.265079 / washing_machine 0.228634 / dishwasher 0.346705\n  per-seed means: 2026 0.302565, 1 0.306428, 2 0.311406, 3 0.313968, 4 0.297877 (spread 0.298-0.314)\n\nInterpretation and comparability: the previous tracked number 0.505987 was a house_1-ONLY readout and is NOT comparable to the v4 pool primary - the v4 metric is a median over 20 homes, most of which are not ukdale-like, and 16 of the 20 have fewer than five canonical devices. The v3 transfer mean 0.151921 is retained in the metrics dict as a carried frozen readout (bench_v4 does not recompute it); v4 replaces it at milestones with holdout_mean_f1 over the 7 frozen holdout houses. Seed spread is only 0.298-0.314, so the 5-seed median is a low-noise statistic; the pair-mean and the device-balanced mean differ by only 0.009, so the fridge-domination concern (18 of 66 pairs) is mild in practice.\nNo metric gain is claimed. DECLARED PROTOCOL EXCEPTION (second): logged as keep, not discard, because the migration lives in .auto/ and must be committed to be durable, and because the flag governs src/ code retention, which is empty here (the device-subset refactor was already committed at run 72, 5ad5980). The metric is reported as the new floor, explicitly not as an improvement.","title":"bench v4 re-baseline: per-home re-calibrated pool primary 0.3064","summary":"Protocol change, not a gain: 66 frozen pairs scored re-calibrated per home. Floor 0.306428, p10 0.299752, device-balanced 0.315375, house_1 0.529246; checks pass.","timestamp":1790495239749,"segment":2,"confidence":2,"asi":{"hypothesis":"re-baselining HEAD on the deployment path (per-home re-calibration over the frozen pool) gives a trustworthy, low-noise reference for segment 2","outcome":"established: primary 0.306428, p10 0.299752, device-balanced 0.315375, house_1 0.529246; seed spread 0.298-0.314 so the 5-seed median is low-noise; 128 s per full pass","keep_exception":"no metric gain; the 0.3064 vs 0.505987 difference is a metric REDEFINITION (house_1-only readout -> 20-home re-calibrated pair-mean), not a regression. Logged keep because the migration lives in .auto/ and the flag governs src/ retention (empty here).","next_action_hint":"the loop can now run on v4: launch parameter fitting (52 model literals -> one parameter dict, grouped CV by house on the pool) and the B4 washing-machine phase model in parallel. Per-iteration readout = v4 primary; house_1 subset and device-balanced are guardrails; holdout only at claimed breakthroughs.","new_finding":"v3's transfer mean 0.151921 (un-recalibrated) vs v4's 0.306428 (re-calibrated) confirms the owner's diagnosis that re-calibration roughly doubles cross-home performance; washing_machine is the weakest pool device (0.2286) despite having 15 pairs, and its per-house spread is the widest"}}
{"run":74,"commit":"df85d3c","metric":0.30333,"metrics":{"mean_device_f1_p10":0.297894,"median_kettle_f1":0.536898,"median_microwave_f1":0.266004,"median_fridge_f1":0.258555,"median_washing_machine_f1":0.228634,"median_dishwasher_f1":0.346705,"transfer_mean_f1":0.151921,"b1_events_mined":5260,"b1_enroll_top1_enc":0.84,"b1_enroll_top1_raw":0.65,"b1_cross_house_top1":0.21,"b1_gate_kettle_kept_frac":0.813,"b1_gate_mw_kept_frac":0.853,"b2_probe_mw_iso_mean":0.34,"b2_probe_iso_all_mean":0.61,"device_balanced_mean":0.313924,"house_1_v4_mean":0.529246,"v4_n_pairs":66,"v4_n_houses":20},"status":"discard","description":"Bet: the fridge cannot be button-calibrated (PASSIVE_FRIDGE_H = 3), so its mark is inferred from ONE random 3 h mains window with no labels. On the v4 pool that mark amp reads 30 / 298 / 328 / 601 / 932 / 2203 W while the mined per-house population band sits at 51-117 W on EVERY diagnosed house, so the run-basis gate amp_lo = 0.8 x mark amp lands ABOVE the band top and the run path emits 0 candidates - on 5 of the 8 diagnosed houses, all of them high-precision/extremely-low-recall (refit/house_17 P.57 R.05, refit/house_8 P.50 R.09, refit/house_10 P.03 R.02, refit/house_12 P.05 R.02, eco/house_01 P.15 R.02).\n\nChange: clamp the mark amp into the band this house's own history mined, keeping the 0.8 and 3.0 margins unchanged (and therefore not touching any hand-set constant). A credible mark is a no-op: ukdale/house_1's mark amp is 91 W inside its 57-114 W band, so the v3 guardrail house_1 was bit-identical at 0.529246 exactly as predicted - the only device that moved was fridge, which is what isolates the effect.\n\nRESULT (bench v4, 5 seeds, 66 pairs, 20 houses, 92 s, checks pass): primary mean_device_f1 0.306428 -> 0.303330 (-0.0031); p10 0.299752 -> 0.297894 (-0.0019); device-balanced 0.315375 -> 0.313924; fridge median 0.265079 -> 0.258555 (-0.0065); kettle/microwave/washing_machine/dishwasher medians bit-identical. Per-seed: 2026 0.302565->0.300587, 1 0.306428->0.303330, 2 0.311406->0.307786, 3 0.313968->0.313072, 4 0.297877->0.296098. All five seeds fell uniformly by 0.0020-0.0036, so this is systematic, not seed noise.\n\nVerdict: REFUTED and reverted. This is not a tuning miss - it rules out a whole explanation. The pool fridge deficit is not a mis-based gate or a silently disabled detection path: the 0.8 x mark margin was actively PROTECTING precision, because run-basis emission at 51-117 W / 11-38 min over a 90 day window admits more lookalikes than compressor cycles in exactly the houses that fail. The band SELECTION is what is wrong there, not the gates on top of it.\n\nConcrete lead for the next iteration: on 8 of 8 diagnosed houses the build log printed 'fridge fallback: population band' - the intended per-house calibration (the most regular (amp, dur) duty cell, DUTY_AMP_W=(40,300), DUTY_DUR_S=(600,2400), DUTY_CELL_MIN=300, DUTY_CV_MAX=0.6) NEVER FIRES anywhere in the pool and is effectively dead code. Every house is therefore calibrated from the p10-p90 of the entire <=120 W small-sustained population, which in the collapsing houses is dominated by non-fridge activity. Diagnose why the cell detector falls through (best CV vs the 0.6 gate, per-cell occupancy vs the 300 floor) instead of re-margining the fallback band.\n\nDataset pathology worth recording: the eco houses cannot be fit by one global duration band - eco/house_06's GT fridge cycles have p50 duration 4.0 min against a band dur of 11-37 min (thr 24 W), eco/house_03 is 18.3 min at thr 12 W, and eco/house_01 is 22.7 min with p90 66 min against a band top of 38 min. The fridge duration distribution is house-specific by an order of magnitude.","title":"fridge run-gate re-basing REFUTED (-0.0031, precision lost)","summary":"Clamping the fridge mark amp into the mined band re-enabled the dead run path; primary .306428->.303330, p10 -0.0019, fridge median -0.0065, all other devices bit-identical. Reverted.","timestamp":1790495549137,"segment":2,"confidence":1.9511035183304075,"asi":{"hypothesis":"the fridge run-basis path is silently disabled on most pool houses because amp_lo = 0.8 x the unreliable passive-window mark amp exceeds the mined band top; re-basing it on the band should add recall cheaply","outcome":"REFUTED: primary 0.306428 -> 0.303330 (-0.0031), fridge median -0.0065, p10 -0.0019, all five seeds down uniformly, all other devices bit-identical","rollback_reason":"the run-basis emission admits more lookalikes than compressor cycles at 51-117 W / 11-38 min in exactly the houses that fail; the mark margin was protecting precision","next_action_hint":"stop re-margining the fridge fallback band. Diagnose why the regular duty-cell calibration never fires (8/8 houses printed 'fridge fallback'): print the best candidate CV vs DUTY_CV_MAX=0.6 and the largest cell occupancy vs DUTY_CELL_MIN=300, then repair the cell detector so each house is calibrated from its own regular recycling cell. Expect the fridge dur distribution to need a per-house band (eco/house_06 is 4 min p50, eco/house_01 is 22.7 min p50).","new_finding":"the fridge's intended per-house calibration (the most regular (amp,dur) duty cell) is DEAD CODE on the entire v4 pool - every house falls through to the <=120 W population p10-p90 band, which in the low-scoring houses is lookalike-dominated. Also: clamping to a credible mark is a no-op on house_1 (91 W in 57-114 W), which gives a clean single-device isolation for future fridge experiments."}}
{"run":75,"commit":"df85d3c","metric":0.306011,"metrics":{"mean_device_f1_p10":0.300272,"median_kettle_f1":0.536898,"median_microwave_f1":0.266004,"median_fridge_f1":0.264973,"median_washing_machine_f1":0.228634,"median_dishwasher_f1":0.346705,"transfer_mean_f1":0.151921,"b1_events_mined":5260,"b1_enroll_top1_enc":0.84,"b1_enroll_top1_raw":0.65,"b1_cross_house_top1":0.21,"b1_gate_kettle_kept_frac":0.813,"b1_gate_mw_kept_frac":0.853,"b2_probe_mw_iso_mean":0.34,"b2_probe_iso_all_mean":0.61,"device_balanced_mean":0.316359,"house_1_v4_mean":0.529246,"v4_n_pairs":66,"v4_n_houses":20},"status":"discard","description":"Two ablations of the fridge run-basis gating, plus the diagnostic that kills the duty-cell detector as a line of work.\n\nDIAGNOSTIC (instrumented mining, 5-7 houses, reverted). The shipped cell detector quantizes mined events to 10 W x 300 s cells and requires a cell with >= DUTY_CELL_MIN = 300 events whose inter-event interval CV is <= DUTY_CV_MAX = 0.6. Measured occupancy: eco/house_02 7 qualifying cells, ukdale/house_1 2, eco/house_01 0, eco/house_06 0, refit/house_17 0. Best cell CVs 0.74-1.06 (house_17 0.740, house_02 0.816, ukdale/house_1 0.881, house_01 1.061, house_06 1.021). Both gates fail everywhere, which is why 8 of 8 houses printed 'fridge fallback: population band'. Root cause of the occupancy failure: the extractor yields only ~11 fridge-class events/day over the 180-day pre-span, so dm is 1002-7588 events spread over 100-140 cells and no single cell can hold 300 of them - DUTY_CELL_MIN is an absolute count that does not scale with span or yield. I then re-ran the diagnostic with coarser 20 W x 600 s cells and a 20-event floor: cells collapsed from 100-140 to ~40 and the gate STILL did not fire - best CVs 1.018/0.865/0.891/2.037/1.006/0.834/0.765 across house_02/house_1/house_01/house_03/house_06/house_17/house_8, while the most-populated cells have CV 1.0-11.8. So the statistic itself does not discriminate: the mined fridge-class events are near-Poisson in time on every house. Relaxing DUTY_CV_MAX would select a small random 20-58-event cell, which is worse than the population band. The per-house regular-cell calibration is dead code by construction and is not repairable by re-scaling its thresholds.\n\nWHY THE RUN PATH IS GATED BY GARBAGE. For the fridge, _profile_from_marks runs pair_fallback() over ONE 3 h passive window: if it finds >= 2 matched 10-40 min up/down step pairs it takes their median as the mark amp, else it returns max(p85-base, 30.0) and a 1200 s duration default. On the pool the resulting mark amp is 30/298/328/601/932/2203 W against a mined band of 51-117 W on every house, so amp_lo = 0.8 x mark_amp lands above the band top and the run path emits 0 candidates on 5 of the 8 diagnosed houses - all high-precision/very-low-recall (refit/house_17 P.57 R.05, refit/house_8 P.50 R.09, refit/house_10 P.03 R.02, refit/house_12 P.05 R.02, eco/house_01 P.15 R.02). The same window also produces mark durations of 0.3-2.2 min on house_17/10/12 (the 1200 s default path), which makes dur_lo = mark_dur/3 near zero.\n\nRUN 74 (amp clamp only, already logged as discard): clamp the mark amp into the mined band, margins 0.8/3.0 unchanged, house_1 a predicted no-op and measured bit-identical at 0.529246. Primary 0.306428 -> 0.303330 (-0.0031), p10 -0.0019, fridge median -0.0065, all five seeds down uniformly, all other devices bit-identical. The margin was protecting precision.\n\nRUN 75 (this run: amp clamp + duration floor). Same amp clamp, plus floor the mark duration at the mined band's own low edge (fr_dur = clip(mark dur, band dur lo, band dur hi)), so dur_lo = fr_dur/3 can no longer be near zero when the passive window fell through to the 1200 s default. house_1 again bit-identical (amp 61 W in 54-103 W, dur 19.9 min in 10-35 min: both are no-ops, confirming the change only touches houses with a non-credible mark).\n\nRESULT (bench v4, 5 seeds, 66 pairs, 20 houses, 83 s, checks pass): primary mean_device_f1 0.306428 -> 0.306011 (-0.0004); p10 0.299752 -> 0.300272 (+0.0005); device-balanced 0.315375 -> 0.316359 (+0.001); fridge median 0.265079 -> 0.264973 (-0.0001); kettle/microwave/washing_machine/dishwasher medians bit-identical; house_1 0.529246 unchanged. Per-seed: 2026 0.302565->0.303907 (+0.0013), 1 0.306428->0.306011 (-0.0004), 2 0.311406->0.313759 (+0.0024), 3 0.313968->0.314077 (+0.0001), 4 0.297877->0.297848 (-0.00003). Mixed seed signs, so the -0.0004 is noise.\n\nVERDICT: discard (fails the +0.01 keep rule) and reverted, but it is informative rather than null. The duration floor exactly cancels run-74's loss, which localises that loss to the near-zero dur_lo blip flood rather than to the amp gate being wrong. Taken together the two ablations bracket the run-basis path at -0.003 to 0.000: correctly gated or not, it contributes essentially nothing to the pool fridge metric. The fridge deficit is therefore NOT in the gating. It is two of: (a) the house's compressor level sits above the FR_POP_AMP_HI = 120 W cap that the fallback band's top inherits, (b) the house's cycle duration is outside the mined 10-40 min class entirely (eco/house_06 GT p50 4.0 min at thr 24 W, eco/house_01 22.7 min with p90 66 min against a 38 min band top), (c) the fridge's unsupervised signature is not separable from lookalikes (P .03-.15 in the collapsed houses).\n\nNext: the honest remaining fridge lever is per-house cycle-period estimation from the mains itself (an autocorrelation peak of the small-excursion indicator over the pre-span), which is a different statistic from the mined-event interval CV that just failed and is the only untested route to a duration band that can span 4 min and 22 min devices. Otherwise the fridge should be left alone: the directed parameter fitting (52 literals) and the B4 washing-machine phase model have far larger headroom.","title":"fridge run-path amp+dur clamp: flat, path is a no-op","summary":"Flooring the mark dur at the band low edge cancelled run-74's flood: primary -0.0004, p10 +0.0005, device-balanced +0.001, fridge median flat. Reverted.","timestamp":1790495791384,"segment":2,"confidence":1.4161430318872636,"asi":{"hypothesis":"the run-basis path is dead because BOTH its gates come from one 3 h passive window (amp_lo above the band, dur_lo near zero); clamping amp into the band and flooring dur at the band's low edge should make it contribute","outcome":"FLAT: primary 0.306428 -> 0.306011 (-0.0004, mixed seed signs), p10 +0.0005, device-balanced +0.001, fridge median -0.0001, house_1 bit-identical. Duration floor exactly cancels run-74's -0.0031 loss, so that loss was the near-zero dur_lo blip flood, not the amp gate.","rollback_reason":"fails the +0.01 keep rule; and the two ablations together show the run-basis path is worth ~0 to the pool fridge metric whether or not it is correctly gated","next_action_hint":"stop working the fridge gates. The duty-cell detector is dead code by construction (occupancy floors unreachable at ~11 events/day over 180 days, and best-cell CV 0.74-1.06 vs a 0.6 gate even with coarser 20 W x 600 s cells and a 20-event floor, because mined fridge-class events are near-Poisson). Residual fridge headroom is in (a) the FR_POP_AMP_HI=120 W cap on the fallback band top, (b) per-house cycle durations spanning 4 min to 22 min, (c) separability from lookalikes. Only untested route to (b): autocorrelation of the small-excursion indicator over the pre-span. Better: switch spend to the directed 52-literal parameter fitting and the B4 washing-machine phase model.","new_finding":"the fridge's intended per-house calibration is unreachable on the whole pool for two independent reasons, and the CV statistic does not discriminate even when the occupancy floor is made relative - the mined fridge-class event series is near-Poisson on every house. Also: for a fridge the model gates its run path on TWO numbers from a single unlabeled 3 h window (amp and duration), and run 74 vs run 75 isolates the damage to the duration default (1200 s fallback -> near-zero dur_lo), not the amp."}}
