{"run":39,"commit":"fa33e1a","metric":0.5745970795191705,"metrics":{"min_device_f1":0.36170212765957444,"pooled_cycle_f1":0.5371801476901941,"mean_mae_w":22.572097880454653,"worst_mae_w":49.345448466268046,"mean_nmae":0.06498724882482013,"coverage_pred_share":0.2271736366017475,"coverage_true_share":0.25263950366526144,"kettle_f1":0.7792998477929985,"kettle_mae_w":10.264401709977083,"microwave_f1":0.36170212765957444,"microwave_mae_w":7.0179556473755715,"fridge_f1":0.5186500888099467,"fridge_mae_w":28.46002323504671,"washing_machine_f1":0.5466666666666666,"washing_machine_mae_w":49.345448466268046,"dishwasher_f1":0.6666666666666666,"dishwasher_mae_w":17.77266034360585},"status":"keep","description":"HYPOTHESIS: the i34 run-basis fridge detector dur gate (the event population pband, 10.1-35.8 min) excludes short compressor cycles. The REL_DUR lo convention (1/3 x mark dur 12.5 min = 250 s) bounds what the event path itself would accept against the mark, so extending the run-basis dur_lo from 606 s to 250 s should add recall the way the amp-floor fix did.\n\nFREE DIAGNOSTIC (pre-span only, .scratch replication validated: model-gate replication reproduced the build echo exactly, 1296): full gate-combo decomposition of the merged 40-105 W run pool. Extension candidates: DUR-LO [300,606) s iso-clear no-dup 1021 runs (3.14/day) with structure IDENTICAL to the proven pool (flatness p90/p10 med 1.12 vs 1.13, p75 1.38 vs 1.37; chatter 0.000; amp med mode 50-60 W = mark amp 50; per-day med 2, p75 5, 255/325 days active); [250,300) 69 runs (0.21/day, flat med 1.18, thin); DUR-HI [2148,2400] 68 runs (0.21/day, thin - skipped); AMP-HI 105-120 W net-new only 22 runs (0.07/day - skipped, amp_hi stays 105). EV estimate at i34's 68% purity: fridge R 0.393->~0.62, mean +0.02-0.03. THE ESTIMATE WAS WRONG.\n\nIMPLEMENTATION (minimal): fr_run gains dur_lo = mark['fridge']['dur_s']/3 (250 s) and dur_hi = the population band top (2148 s); the build echo and the predict step-4 gates switch to these keys. Amp window, iso (3x mark amp 150 W, 600 s), bridge, dedupe unchanged. Build echo: 2386 net-new candidates (7.34/day) as predicted.\n\nDISCLOSED DRY-RUN (bash .auto/measure.sh before the official run; deterministic, identical values): mean_device_f1 0.574597, fridge run-basis echo 2386 (7.34/day).\n\nRESULT vs run 38 (0.5739511739067139): mean_device_f1 0.5745970795191705 (+0.000646). Fridge: preds 1475->1699 (+224), matched 1103->1168 (+65): added-batch purity 29% - far below the i34 batch's 68% and below the ~35% F1-breakeven estimate. P 0.748->0.687, R 0.393->0.416, fridge F1 0.5154->0.5187 (+0.0032); fridge MAE 28.66->28.46 W (improved). Purity-transfer lesson: the pre-span structural profile (flatness, amp mode, per-day regularity) matched the proven pool exactly, yet the eval-span short-run population matches GT at only 29% - the pre-span and eval spans differ in what generates 5-10 min 40-105 W iso-clear flat draws (plausibly seasonal small loads). F1 still rose because the added spans carry accurate emit levels (MAE improved) and the breakeven at the current operating point is lower than the naive estimate. Kettle/microwave/wm/dw byte-identical; min_device_f1 unchanged 0.361702 (mw); pooled_cycle_f1 0.535453->0.537180; mean_mae_w 22.6116->22.5721; mean_nmae 0.065101->0.064987; coverage_pred_share 0.224586->0.227174.\n\nDATA HYGIENE: all mining/diagnostics on pre-span mains aggregate only; pre-span submeter ON-mask never loaded; no eval statistic entered any parameter (dur_lo derived from the calib mark and the REL_DUR convention); frozen bench files untouched; the GT dwell 30 s and cycle threshold never referenced in the model.","title":"i35 fridge run-basis dur-lo extension to mark/3","summary":"fridge run dur-lo 606->250s (mark/3): +224 preds, +65 matched (29% purity vs 68% in i34), fridge F1 0.5154->0.5187, mean_device_f1 0.5740->0.5746; all secondaries improved","timestamp":1790465470228,"segment":1,"confidence":2.7958642893305865,"asi":{"hypothesis":"fridge run-basis dur gate extended to the REL_DUR mark lo (250 s) recovers short compressor cycles the extractor cannot pair; pre-span pool structure matched the proven amp-floor pool exactly","run_family":"fridge","next_action_hint":"PURITY-TRANSFER LESSON: pre-span structure did not transfer for the sub-band pool (29% vs 68%). Fridge family 1 run left; remaining headroom (iso-failing runs, sub-250 s blips) carries the same transfer risk - demand a stronger pre-span discriminator before spending it. Next: wm30 gate-failure diagnostic (wm 2 runs left); mw still the binding gap (0.362, family exhausted)"}}
{"run":40,"commit":"71ad484","metric":0.5896539900882762,"metrics":{"min_device_f1":0.36170212765957444,"pooled_cycle_f1":0.5393181428816174,"mean_mae_w":23.507104638131494,"worst_mae_w":54.020482254652265,"mean_nmae":0.067679223542272,"coverage_pred_share":0.25648754042515737,"coverage_true_share":0.25263950366526144,"kettle_f1":0.7792998477929985,"kettle_mae_w":10.264401709977083,"microwave_f1":0.36170212765957444,"microwave_mae_w":7.0179556473755715,"fridge_f1":0.5186500888099467,"fridge_mae_w":28.46002323504671,"washing_machine_f1":0.6219512195121951,"washing_machine_mae_w":54.020482254652265,"dishwasher_f1":0.6666666666666666,"dishwasher_mae_w":17.77266034360585},"status":"keep","description":"HYPOTHESIS: the wm30 run-basis heater p90 floor (amp_lo = min of the 4 mark windows' p90s = 2392 W) is the ONLY wm30 gate without a session margin - every other band uses the conventions (0.6/1.25 span, 0.8/1.25 mean, 0.75/1.75 heat share, 0.75/2x density, 2x idle). Runs whose heater plateaus sit below the strongest observed mark draws but pass all five other gates are plausibly genuine wm low-heat cycles. Applying the same REL_AMP lo margin (0.8x -> 1914 W) should admit them cleanly.\n\nFREE DIAGNOSTICS (pre-span only; both replication-validated: wm30 PASS pool reproduced the i33 echo 92 exactly, profile echoes matched the run-39 build):\n(i) Gate funnel over 1947 merged >=1623 W runs (5.99/day, merge gap 17 min): PASS 92 (0.28/day); single-gate failures: p90 83 (0.26/day), dens_lo 25 (quiet heater lookalikes - correctly gated by design), min_span 8 (16-19 min, below the 20-min cooking floor), span_hi 3, mean_lo 1. The p90 pool passes span med 31.5 min, mean 1327 W, hs 0.50, idle 642 W, dens 0.441/min - all in-band - failing only the heater p90 (med 2263 vs 2392); tod midday-heavy [0,0,14,19,29,13,5,3].\n(ii) AMBIGUITY TEST (the i35 purity-transfer lesson applied): the pool is also consistent with a modulating tumble dryer (heater ~2200 switching + 500-700 W steady tumble). Decisive free discriminator - the wm pump switches on/off sub-heat (400-700 W events every 1-3 min) while a steady tumble produces almost no switching events: sub-heat event rate inside runs, p90 pool p50 0.440/min (p10 0.226 p90 0.601, zero-rate 0/83) vs gated pool p50 0.394/min (zero-rate 0/92) - IDENTICAL: the pump signature is present in every pool run. Co-occurrence: 74/83 p90 runs >3h from any gated run (9 within 3h) - not wash-then-dry pairing. Mark windows: 4 wm heater exc-p90s [2534, 2392, 2526, 2523]; pool med 2263 sits inside the wm heater range (mark amp 2240) but below the unmargined min. Verdict: genuine wm low-heat cycles.\n(iii) REJECTED alternatives: dens_lo pool kept gated (quiet lookalikes); min_span 8 runs negligible; fridge event amp (105,120] fallback rejected (183 in-band events 0.56/day at 2.1-2.4x mark amp - no mark anchor, i35 transfer risk); run-mask lo 30-40 W rejected (14.8/day, span p50 1.0 min - blip/electronics territory).\n\nIMPLEMENTATION (minimal): _wm30_profile amp_lo: min(p90s) -> 0.8 * min(p90s), with the rationale comment; all other wm30 gates, the dw30 profile (amp_lo 2107 unchanged), and every other detector untouched.\n\nDISCLOSED DRY-RUN (bash .auto/measure.sh before the official run; deterministic, identical values): build echo 'wm sustained profile: amp>=1914W' and 'wm sustained runs: 82 net-new candidates (0.252/day)'; mean_device_f1 0.589654.\n\nRESULT vs run 39 (0.5745970795191705): mean_device_f1 0.5896539900882762 (+0.015057 - the largest single-iteration gain since i33). Washing machine: preds 70->84 (+14), matched 41->51 (+10): added-batch purity 71% (vs i35's 29% - the pump-signature discriminator worked; breakeven was 27%, cleared 2.6x). wm P 0.586->0.607 (rose - the batch is pure), R 0.512->0.637, wm F1 0.5467->0.6220 (+0.0753). Cost: wm MAE 49.35->54.02 W (the 936 W emission level applied to low-heat cycles) and worst_mae_w accordingly; mean_mae_w 22.5721->23.5071; mean_nmae 0.064987->0.067679; coverage_pred_share 0.227174->0.256488 (the asymmetric run+53.2min extension). pooled_cycle_f1 0.537180->0.539318. Kettle/microwave/fridge/dishwasher byte-identical; min_device_f1 unchanged 0.361702 (mw).\n\nDATA HYGIENE: all mining/diagnostics on pre-span mains aggregate only; pre-span submeter ON-mask never loaded; the 0.8x margin is the session REL_AMP lo convention (no eval statistic entered any parameter); frozen bench files untouched; the GT thr/dwell/tau never referenced in the model.\n\nFAMILY STATE: wm 2/3 used (1 left). Remaining wm headroom: the dens_lo quiet pool is correctly gated; the cold-wash cycles with no >=1623 W run are invisible to any heater basis; the wm MAE cost suggests the emit level (mark mean) is the next lever if the family is revisited - but that trades against the MAE guardrails.","title":"i36 wm30 heater p90 floor gets REL_AMP lo margin","summary":"wm30 amp_lo 2392->1914 (0.8x, last unmargined gate): +14 preds, +10 matched (71% purity, pump-signature validated), wm F1 0.5467->0.6220, mean_device_f1 0.5746->0.5897","timestamp":1790465874324,"segment":1,"confidence":2.7962181586297192,"asi":{"hypothesis":"wm30 heater p90 floor lacked the session REL_AMP lo margin every other gate has; 0.8x admits genuine low-heat wm cycles identified by the pump-switching signature (sub-heat event rate identical to gated runs, 0/83 zero-rate)","run_family":"washing_machine","next_action_hint":"PUMP-SIGNATURE LESSON (positive): appliance-specific switching fingerprints beat aggregate shape stats - i35 flatness lied (29%), the pump rate did not (71%). wm 1 run left: emit-level (mark mean 936 vs low-heat reality) is the MAE lever, not more recall. Next candidates: dw emit-level extension (dw P 1.0, 14/14, MAE cost low) or park wm; mw 0.362 still the binding min (family exhausted)"}}
{"run":41,"commit":"71ad484","metric":0.5865532148944779,"metrics":{"min_device_f1":0.36170212765957444,"pooled_cycle_f1":0.539226,"mean_mae_w":23.5607,"worst_mae_w":54.020482254652265,"mean_nmae":0.067834,"coverage_pred_share":0.257201,"coverage_true_share":0.25263950366526144,"kettle_f1":0.7792998477929985,"kettle_mae_w":10.264401709977083,"microwave_f1":0.36170212765957444,"microwave_mae_w":7.0179556473755715,"fridge_f1":0.5186500888099467,"fridge_mae_w":28.46002323504671,"washing_machine_f1":0.6219512195121951,"washing_machine_mae_w":54.020482254652265,"dishwasher_f1":0.651163,"dishwasher_mae_w":18.035},"status":"discard","description":"HYPOTHESIS: the dw30 heater p90 floor (amp_lo = min of the 5 mark-window p90s = 2107 W) is the only unmargined gate in the dw30 profile - the exact situation i36 fixed for wm30. Applying the same REL_AMP lo margin (0.8x -> 1686 W) should admit eco-program dw cycles whose heater plateaus sit below the strongest mark draws.\n\nFREE DIAGNOSTIC (pre-span only; replication-validated: dw30 PASS pool reproduced the i34 funnel 49 exactly, profile echo matched the run-40 build): pool 1085 merged >=1623 W runs (3.34/day, merge gap 35 min); PASS 49 (0.15/day); p90-only failures just 5 (0.015/day). Pool shape: span med 70.0 min (57.6-79.1), mean 512 W, hs 0.23, idle 70 W, dens 0.071/min - all in-band, failing only the heater p90 (med 1822 vs 2107). Mark p90s tight: [2107, 2201, 2230, 2293, 2337] (11% spread). Fingerprint checks: sub-heat switching rate p50 0.025/min vs gated pool 0.039/min (dw pump signature present - not a steady radiator), per-month scattered {3:2, 5:1, 7:1, 9:1} (non-seasonal: no heating-season signature), tod [0,0,4,0,0,0,0,1], wm30-gate overlap 0/5 (the dens floor separates wm chatter). All five looked like genuine eco dw cycles.\n\nIMPLEMENTATION (minimal): _dw30_profile amp_lo: min(p90s) -> 0.8 * min(p90s) with rationale comment; wm30 and everything else untouched.\n\nDISCLOSED DRY-RUN (bash .auto/measure.sh before the official run; the official run then confirmed identical values - deterministic): build echo 'dw sustained profile: ... amp>=1685W' and 'dw sustained runs: 54 pass run-basis gates (0.166/day)' (+5 = the diagnostic pool exactly).\n\nRESULT vs run 40 (0.5896539900882762): mean_device_f1 0.5865532148944779 (-0.003101). Dishwasher: preds 14->15 (only 1 net-new: 4 of 5 eco runs chain-owned by the emission dedupe), matched 14->14 (0/1 added-batch purity), P 1.000->0.933, R 0.500, F1 0.6667->0.6512 (-0.0155), MAE 17.77->18.04. Kettle/microwave/fridge/washing-machine byte-identical; min_device_f1 unchanged 0.361702 (mw).\n\nWHY DISCARD: the i35 purity-transfer lesson repeats with a new twist - pre-span fingerprint evidence (pump-switching rate match, non-seasonal months, full shape in-band) did not transfer: the single emitted eval pred missed its GT cycle entirely. Likely miss mode: eco programs run a longer pre-heater pump phase, pushing the pred onset (heater start minus the 9.3 min mark-calibrated extension) outside the onset tolerance relative to the cycle's pump-start GT onset - unfixable without mark support for the eco cycle structure, and n=1 carries no usable signal either way. The cost lands on the device whose P=1.0 was precious (28 GT: each FP costs -0.0155 F1). EV analysis pre-run: downside ~flat, upside +0.006-0.015 mean; the downside case materialized.\n\nFAMILY STATE: dw 2/3 used (1 left). Remaining dw ideas are weaker: the emit-level change has no primary-metric EV; the heat-threshold 0.75->0.65 would break the PROG_HEAT_AMP_FRAC session convention to chase sub-1623 W eco heaters that the p90 gate would then still need admitting (two-parameter change on thin evidence). Park dw unless a new mark-anchored basis appears.\n\nDATA HYGIENE: all mining/diagnostics on pre-span mains aggregate only; pre-span submeter ON-mask never loaded; the 0.8x margin is the session REL_AMP lo convention (no eval statistic entered any parameter); frozen bench files untouched; GT thr/dwell/tau never referenced in the model.","title":"i37 dw30 amp_lo margin rejected: 1 pred, 0/1 purity","summary":"dw30 amp_lo 2107->1686 (0.8x): 5 pre-span eco runs -> 1 net-new pred, 0/1 matched; dw F1 0.667->0.651 (P cost), mean 0.5897->0.5866: discard","timestamp":1790466072394,"segment":1,"confidence":3.2104026185739003,"asi":{"hypothesis":"dw30 heater p90 floor lacked the session REL_AMP lo margin; 0.8x would admit eco-program dw cycles identified by the dw pump-switching signature","run_family":"dishwasher","rollback_reason":"mean 0.5897->0.5866, dw F1 0.667->0.651 (P 1.0->0.933): 5 pre-span eco candidates yielded 1 net-new eval pred, 0/1 matched - fingerprint evidence did not transfer (i35 lesson repeats); reverted to run-40 state 71ad484","next_action_hint":"dw amp_lo mirror REJECTED: small-denominator P protection beats thin-pool upside. Remaining dw ideas weaker (emit-level: no F1 EV; heat-threshold: breaks PROG_HEAT_AMP_FRAC). Next candidates: mw sequence basis (cluster mw-band events, intra-cluster amp-consistency fingerprint separates same-setting mw repeats from hob level-changes; family cap 3/3 exhausted - needs owner decision) or park small families; fridge has 1 run left but only fingerprint-less pools"}}
